superiotool r4.10-563-gc563d34fc1
Found Aspeed AST2400 (id=0x00) at 0x2e
Register dump:
idx 20 21 22 23 24 25 26 27  28 29 2a 2b 2c 2d 2e 2f
val 00 00 00 00 00 00 00 00  00 00 00 00 00 00 00 00
def 00 00 00 00 00 00 00 00  00 00 00 00 00 00 00 00
LDN 0x02 (SUART1)
idx 30 60 61 70 71 f0
val 01 03 f8 04 02 00
def 00 03 f8 04 02 RR
LDN 0x03 (SUART2)
idx 30 60 61 70 71 f0
val 01 02 f8 03 02 00
def 00 02 f8 03 02 00
LDN 0x04 (SWC)
idx 30 60 61 62 63 64 65 66  67 70 71
val 01 0a 00 0a 10 0a 20 0a  30 00 01
def 00 08 e6 08 e0 08 e4 08  e8 09 01
LDN 0x05 (Keyboard config (KBC))
idx 30 60 61 62 63 70 71 72  73 f0
val 00 00 60 00 64 01 02 0c  02 83
def 00 00 60 00 64 01 02 0c  02 83
LDN 0x07 (GPIO)
idx 30 38 70 71
val 01 00 00 01
def 00 00 0b 01
LDN 0x0b (SUART3)
idx 30 60 61 70 71 f0
val 00 00 00 06 02 00
def 00 03 e8 06 02 00
LDN 0x0c (SUART4)
idx 30 60 61 70 71 f0
val 00 00 00 05 02 00
def 00 02 e8 05 02 00
LDN 0x0d (iLPC2AHB)
idx 30 70 71 f0 f1 f2 f3 f4  f5 f6 f7 f8 fe
val 01 00 01 1e 6e 20 7c 02  01 03 03 a2 03
def 00 09 01 NA NA NA NA NA  NA NA NA 00 00
LDN 0x0e (Mailbox)
idx 30 60 61 70 71
val 01 0a 40 00 01
def 00 08 c0 09 01
superiotool r4.10-563-gc563d34fc1
Found Aspeed AST2400 (id=0x00) at 0x2e
Register dump:
idx   val    def
0x20: 0x00   (0x00)
0x21: 0x00   (0x00)
0x22: 0x00   (0x00)
0x23: 0x00   (0x00)
0x24: 0x00   (0x00)
0x25: 0x00   (0x00)
0x26: 0x00   (0x00)
0x27: 0x00   (0x00)
0x28: 0x00   (0x00)
0x29: 0x00   (0x00)
0x2a: 0x00   (0x00)
0x2b: 0x00   (0x00)
0x2c: 0x00   (0x00)
0x2d: 0x00   (0x00)
0x2e: 0x00   (0x00)
0x2f: 0x00   (0x00)

LDN 0x02 (SUART1)
idx   val    def
0x30: 0x01   (0x00)
0x60: 0x03   (0x03)
0x61: 0xf8   (0xf8)
0x70: 0x04   (0x04)
0x71: 0x02   (0x02)
0xf0: 0x00   (RR)

LDN 0x03 (SUART2)
idx   val    def
0x30: 0x01   (0x00)
0x60: 0x02   (0x02)
0x61: 0xf8   (0xf8)
0x70: 0x03   (0x03)
0x71: 0x02   (0x02)
0xf0: 0x00   (0x00)

LDN 0x04 (SWC)
idx   val    def
0x30: 0x01   (0x00)
0x60: 0x0a   (0x08)
0x61: 0x00   (0xe6)
0x62: 0x0a   (0x08)
0x63: 0x10   (0xe0)
0x64: 0x0a   (0x08)
0x65: 0x20   (0xe4)
0x66: 0x0a   (0x08)
0x67: 0x30   (0xe8)
0x70: 0x00   (0x09)
0x71: 0x01   (0x01)

LDN 0x05 (Keyboard config (KBC))
idx   val    def
0x30: 0x00   (0x00)
0x60: 0x00   (0x00)
0x61: 0x60   (0x60)
0x62: 0x00   (0x00)
0x63: 0x64   (0x64)
0x70: 0x01   (0x01)
0x71: 0x02   (0x02)
0x72: 0x0c   (0x0c)
0x73: 0x02   (0x02)
0xf0: 0x83   (0x83)

LDN 0x07 (GPIO)
idx   val    def
0x30: 0x01   (0x00)
0x38: 0x00   (0x00)
0x70: 0x00   (0x0b)
0x71: 0x01   (0x01)

LDN 0x0b (SUART3)
idx   val    def
0x30: 0x00   (0x00)
0x60: 0x00   (0x03)
0x61: 0x00   (0xe8)
0x70: 0x06   (0x06)
0x71: 0x02   (0x02)
0xf0: 0x00   (0x00)

LDN 0x0c (SUART4)
idx   val    def
0x30: 0x00   (0x00)
0x60: 0x00   (0x02)
0x61: 0x00   (0xe8)
0x70: 0x05   (0x05)
0x71: 0x02   (0x02)
0xf0: 0x00   (0x00)

LDN 0x0d (iLPC2AHB)
idx   val    def
0x30: 0x01   (0x00)
0x70: 0x00   (0x09)
0x71: 0x01   (0x01)
0xf0: 0x1e   (NA)
0xf1: 0x6e   (NA)
0xf2: 0x20   (NA)
0xf3: 0x7c   (NA)
0xf4: 0x02   (NA)
0xf5: 0x01   (NA)
0xf6: 0x03   (NA)
0xf7: 0x03   (NA)
0xf8: 0xa2   (0x00)
0xfe: 0x03   (0x00)

LDN 0x0e (Mailbox)
idx   val    def
0x30: 0x01   (0x00)
0x60: 0x0a   (0x08)
0x61: 0x40   (0xc0)
0x70: 0x00   (0x09)
0x71: 0x01   (0x01)

