CPU: ID 0x906e9, Processor Type 0x0, Family 0x6, Model 0x9e, Stepping 0x9
Northbridge: 8086:5918 (7th generation (Kaby Lake family) Core Processor Xeon E3-1200)
Southbridge: 8086:a149 (C236)

============= MCHBAR ============

MCHBAR = 0xfed10000 (MEM)

0x0000: 0x3694d29d
0x0004: 0x3694d0a4
0x0008: 0x36103cb7
0x000c: 0x48000000
0x0010: 0x9aab76aa
0x0014: 0xa9aa777b
0x0018: 0x55a65477
0x0020: 0x03e164c7
0x0024: 0x03e170ce
0x0028: 0x03e168cb
0x0030: 0x5a557975
0x0034: 0x5a557a79
0x0038: 0x78757975
0x0040: 0xbc83bc23
0x0044: 0x6950ffdd
0x004c: 0x00120707
0x0050: 0xcadad8b9
0x0054: 0xcacac9c9
0x0058: 0xbabad7ba
0x005c: 0x88888888
0x0064: 0x80000000
0x0068: 0x2037b082
0x006c: 0x08102550
0x0070: 0x0cb24e00
0x0074: 0x5c0ae51c
0x0078: 0xb8518154
0x0080: 0x04000000
0x0084: 0xe3e0027f
0x0088: 0x5b000000
0x008c: 0x00000100
0x0100: 0x21c042ab
0x0104: 0x2a004040
0x0108: 0x21b0b4c2
0x010c: 0x28000000
0x0110: 0xa7aa75a9
0x0114: 0x88888888
0x0118: 0x76aa64a9
0x0120: 0x03f160cf
0x0124: 0x03f08060
0x0128: 0x03f164cf
0x0130: 0x96a97597
0x0134: 0x88888888
0x0138: 0x65779686
0x0140: 0xbc83bc23
0x0144: 0x6950ffdd
0x014c: 0x00120707
0x0150: 0x7aa9789b
0x0154: 0x88888888
0x0158: 0x9bba9a9b
0x015c: 0x88888888
0x0164: 0x80000000
0x0168: 0x20084000
0x016c: 0x0a143950
0x0170: 0x0cb27200
0x0174: 0x000e453a
0x0178: 0x00518154
0x0180: 0x04000000
0x0184: 0x03e00000
0x0188: 0x5b000000
0x018c: 0xf0000080
0x0200: 0x3e32c2a8
0x0204: 0x3e33c4aa
0x0208: 0x3df0bcb8
0x020c: 0x48000000
0x0210: 0x559a5587
0x0214: 0x55a97577
0x0218: 0x79aa7578
0x0220: 0x03e1a4e7
0x0224: 0x03e1b0ec
0x0228: 0x03e1a4e7
0x0230: 0x79897a75
0x0234: 0x78ba7995
0x0238: 0x989b9b94
0x0240: 0xbc83bc23
0x0244: 0x6950ffdd
0x024c: 0x00120707
0x0250: 0xc9bbb6aa
0x0254: 0xc9bab7a9
0x0258: 0xcacab8aa
0x025c: 0x88888888
0x0264: 0x80000000
0x0268: 0xe83fffff
0x026c: 0x08102550
0x0270: 0x04b2500c
0x0274: 0x1e0e453a
0x0278: 0x42518154
0x0280: 0x04000000
0x0284: 0x03e00000
0x0288: 0x5b000000
0x028c: 0x00000100
0x0300: 0x21c4c0bb
0x0304: 0x2a004040
0x0308: 0x21b3b6ca
0x030c: 0x28000000
0x0310: 0x77a97797
0x0314: 0x88888888
0x0318: 0x79ab75ac
0x0320: 0x03f1a0ee
0x0324: 0x03f08060
0x0328: 0x03f198e7
0x0330: 0x7b76a666
0x0334: 0x88888888
0x0338: 0x8a79a79b
0x0340: 0xbc83bc23
0x0344: 0x6950ffdd
0x034c: 0x00120707
0x0350: 0x7bab6a9a
0x0354: 0x88888888
0x0358: 0x7cab8b9b
0x035c: 0x88888888
0x0364: 0x80000000
0x0368: 0xe00000c3
0x036c: 0x0a142d50
0x0370: 0x0cb26c0c
0x0374: 0x000e453a
0x0378: 0x00518154
0x0380: 0x04000000
0x0384: 0x03e00000
0x0388: 0x5b000000
0x038c: 0xf8000080
0x0400: 0x3680cebd
0x0404: 0x3683d0c1
0x0408: 0x35c3bacc
0x040c: 0x4c000000
0x0410: 0x99a875b9
0x0414: 0xbac875cc
0x0418: 0x77767579
0x0420: 0x03f1e509
0x0424: 0x03f1f110
0x0428: 0x03f1d904
0x0430: 0xa9757a95
0x0434: 0x9a957795
0x0438: 0x9a697957
0x0440: 0xbc83bc23
0x0444: 0x6950ffdd
0x044c: 0x00120707
0x0450: 0xbacac8d9
0x0454: 0xbac9c8ca
0x0458: 0xbacbc9cb
0x045c: 0x88888888
0x0464: 0x80000000
0x0468: 0x2037b0c3
0x046c: 0x0a143550
0x0470: 0x0cb26e03
0x0474: 0x000e453a
0x0478: 0x00518154
0x0480: 0x04000000
0x0484: 0x03e00000
0x0488: 0x5b000000
0x048c: 0xfc010000
0x0500: 0x19a7c2bf
0x0504: 0x2a004040
0x0508: 0x19b4bcd6
0x050c: 0x28000000
0x0510: 0x87a77578
0x0514: 0x88888888
0x0518: 0x99b9649a
0x0520: 0x03f1e50f
0x0524: 0x03f08060
0x0528: 0x03f1dd0b
0x0530: 0x86555755
0x0534: 0x88888888
0x0538: 0x75577845
0x0540: 0xbc83bc23
0x0544: 0x6950ffdd
0x054c: 0x00120707
0x0550: 0x69ab977c
0x0554: 0x88888888
0x0558: 0x8cabaaad
0x055c: 0x88888888
0x0564: 0x80000000
0x0568: 0xf0021000
0x056c: 0x0a143550
0x0570: 0x0cb26e03
0x0574: 0x000e453a
0x0578: 0x00518154
0x0580: 0x04000000
0x0584: 0x03e00000
0x0588: 0x5b000000
0x058c: 0xf00000c0
0x0600: 0x3a52c4c2
0x0604: 0x3a34c8cd
0x0608: 0x39c0bcdc
0x060c: 0x48000000
0x0610: 0x77a76677
0x0614: 0x77a87577
0x0618: 0x77a87577
0x0620: 0x03f22126
0x0624: 0x03f2312e
0x0628: 0x03f21523
0x0630: 0x69975a58
0x0634: 0x59a95997
0x0638: 0x99b97a65
0x0640: 0xbc83bc23
0x0644: 0x6950ffdd
0x064c: 0x00120707
0x0650: 0xb9cab8c9
0x0654: 0xb9baa8c9
0x0658: 0xcabbb9ca
0x065c: 0x88888888
0x0664: 0x80000000
0x0668: 0x08021082
0x066c: 0x0bd7bd50
0x0670: 0x0cb22c0f
0x0674: 0x000e453a
0x0678: 0x00518154
0x0680: 0x04000000
0x0684: 0x03e00000
0x0688: 0x5b000000
0x068c: 0x00000100
0x0700: 0x218034cb
0x0704: 0x2e004040
0x0708: 0x2140acee
0x070c: 0x2c000000
0x0714: 0x88888888
0x0720: 0x03e20921
0x0724: 0x03f08060
0x0728: 0x03e20d22
0x0730: 0x59897956
0x0734: 0x88888888
0x0738: 0x7a76ba98
0x0740: 0xbc83bc23
0x0744: 0x6950ffdd
0x074c: 0x00120707
0x0750: 0x7a79998a
0x0754: 0x88888888
0x0758: 0x9b89bbaa
0x075c: 0x88888888
0x0764: 0x80000000
0x0768: 0xf8000fff
0x076c: 0x08102e50
0x0770: 0x4cb24c0f
0x0774: 0x000e453a
0x0778: 0x00518154
0x0780: 0x04000000
0x0784: 0x03e00000
0x0788: 0x5b000000
0x078c: 0x00000100
0x0800: 0x3a80cf0c
0x0804: 0x3a90d10b
0x0808: 0x3a204713
0x080c: 0x44000000
0x0810: 0x77b77587
0x0814: 0x77c7759c
0x0818: 0x77a875ba
0x0820: 0x03f2ad6c
0x0824: 0x03f2bd75
0x0828: 0x03f28158
0x0830: 0x87658866
0x0834: 0x77a4a777
0x0838: 0x9a6998b8
0x0840: 0xbc83bc23
0x0844: 0x6950ffdd
0x084c: 0x00120707
0x0850: 0xb8b8a7b7
0x0854: 0xb9b7a8b8
0x0858: 0xcbc9b9ca
0x085c: 0x88888888
0x0864: 0x80000000
0x0868: 0x103bd145
0x086c: 0x08307950
0x0870: 0x0cb26c06
0x0874: 0x000e453a
0x0878: 0x00518154
0x0880: 0x04000000
0x0884: 0x03e00000
0x0888: 0x5b000000
0x088c: 0x00000100
0x0900: 0x19c0430f
0x0904: 0x22004040
0x0908: 0x19f0bb26
0x090c: 0x20000000
0x0910: 0x77b875aa
0x0914: 0x88888888
0x0918: 0xa9ba75bb
0x0920: 0x03f29965
0x0924: 0x03f08060
0x0928: 0x03f2895b
0x0930: 0x7668a696
0x0934: 0x88888888
0x0938: 0xaa76a697
0x0940: 0xbc83bc23
0x0944: 0x6950ffdd
0x094c: 0x00120707
0x0950: 0x689a999a
0x0954: 0x88888888
0x0958: 0xabacabbc
0x095c: 0x88888888
0x0964: 0x80000000
0x0968: 0xf0000041
0x096c: 0x0a142550
0x0970: 0x0cb26e06
0x0974: 0x000e453a
0x0978: 0x00518154
0x0980: 0x04000000
0x0984: 0x03e00000
0x0988: 0x5b000000
0x098c: 0xf8000080
0x0a00: 0x3e93c528
0x0a04: 0x3e90cd2c
0x0a08: 0x3de0412c
0x0a0c: 0x4c000000
0x0a10: 0x777a7687
0x0a14: 0x77bb759b
0x0a18: 0x77a7557a
0x0a20: 0x03c2d17f
0x0a24: 0x03c2e189
0x0a28: 0x03c29d65
0x0a30: 0x5759a777
0x0a34: 0x87599557
0x0a38: 0x9959a7ba
0x0a40: 0xbc83bc23
0x0a44: 0x6950ffdd
0x0a4c: 0x00120707
0x0a50: 0xc9bab9b9
0x0a54: 0xc9a9a8a9
0x0a58: 0xcabab9aa
0x0a5c: 0x88888888
0x0a64: 0x80000000
0x0a68: 0x203ff104
0x0a6c: 0x0850a550
0x0a70: 0x08b29012
0x0a74: 0x220e453a
0x0a78: 0x3e518154
0x0a80: 0x04000000
0x0a84: 0x03e00000
0x0a88: 0x5b000000
0x0a8c: 0xfc010000
0x0b00: 0x29d4bd23
0x0b04: 0x22004040
0x0b08: 0x29d03d36
0x0b0c: 0x20000000
0x0b10: 0x77ba5579
0x0b14: 0x88888888
0x0b18: 0x779965bb
0x0b20: 0x03f2b975
0x0b24: 0x03f08060
0x0b28: 0x03f2a567
0x0b30: 0x777a7775
0x0b34: 0x88888888
0x0b38: 0xa86897a7
0x0b40: 0xbc83bc23
0x0b44: 0x6950ffdd
0x0b4c: 0x00120707
0x0b50: 0xaa9a789a
0x0b54: 0x88888888
0x0b58: 0x9989998a
0x0b5c: 0x88888888
0x0b64: 0x80000000
0x0b68: 0xe8042fbe
0x0b6c: 0x0850a650
0x0b70: 0x0cb28e12
0x0b74: 0x000e453a
0x0b78: 0x00518154
0x0b80: 0x04000000
0x0b84: 0x03e00000
0x0b88: 0x5b000000
0x0b8c: 0xfc000080
0x0c00: 0x3294d33d
0x0c04: 0x3294d340
0x0c08: 0x3224c13b
0x0c0c: 0x44000000
0x0c10: 0xa7a7959b
0x0c14: 0x97b975ab
0x0c18: 0x7799559a
0x0c20: 0x03f2ed8d
0x0c24: 0x03f2fd96
0x0c28: 0x03f2c175
0x0c30: 0x87499576
0x0c34: 0x8b686699
0x0c38: 0xba9a8a89
0x0c40: 0xbc83bc23
0x0c44: 0x6950ffdd
0x0c4c: 0x00120707
0x0c50: 0xa9a9bac9
0x0c54: 0xb9a9a9b8
0x0c58: 0xcab9bac9
0x0c5c: 0x88888888
0x0c64: 0x80000000
0x0c68: 0x0837b082
0x0c6c: 0x0a54bd50
0x0c70: 0x0cb2ae09
0x0c74: 0x000e453a
0x0c78: 0x00518154
0x0c80: 0x04000000
0x0c84: 0x03e00000
0x0c88: 0x5b000000
0x0c8c: 0x00000100
0x0d00: 0x25b1c333
0x0d04: 0x26004040
0x0d08: 0x25e03d4e
0x0d0c: 0x24000000
0x0d10: 0x77aa56a9
0x0d14: 0x88888888
0x0d18: 0xa7ca65bb
0x0d20: 0x03f2c57d
0x0d24: 0x03f08060
0x0d28: 0x03f2b974
0x0d30: 0x9a689995
0x0d34: 0x88888888
0x0d38: 0x97559695
0x0d40: 0xbc83bc23
0x0d44: 0x6950ffdd
0x0d4c: 0x00120707
0x0d50: 0x9baa88bb
0x0d54: 0x88888888
0x0d58: 0xac9a88bb
0x0d5c: 0x88888888
0x0d64: 0x80000000
0x0d68: 0xf8063fff
0x0d6c: 0x0a54a550
0x0d70: 0x0cb2ac09
0x0d74: 0x000e453a
0x0d78: 0x00518154
0x0d80: 0x04000000
0x0d84: 0x03e00000
0x0d88: 0x5b000000
0x0d8c: 0xfc0000c0
0x0e00: 0x3674cb61
0x0e04: 0x3664cf69
0x0e08: 0x35c3bf57
0x0e0c: 0x40000000
0x0e10: 0x79a7577b
0x0e14: 0x79b977ab
0x0e18: 0x97a7579a
0x0e20: 0x03f3119d
0x0e24: 0x03f31da4
0x0e28: 0x03f2d983
0x0e30: 0xaa76a967
0x0e34: 0x99776a64
0x0e38: 0xb7ba7997
0x0e40: 0xbc83bc23
0x0e44: 0x6950ffdd
0x0e4c: 0x00120707
0x0e50: 0xabcabbbd
0x0e54: 0xaacabbbc
0x0e58: 0xbcbabcbd
0x0e5c: 0x88888888
0x0e64: 0x80000000
0x0e68: 0xe0063041
0x0e6c: 0x0850a550
0x0e70: 0x0cb28e15
0x0e74: 0x000e453a
0x0e78: 0x00518154
0x0e80: 0x04000000
0x0e84: 0x03e00000
0x0e88: 0x5b000000
0x0e8c: 0x00000100
0x0f00: 0x1d53ad53
0x0f04: 0x2e004040
0x0f08: 0x1d41ad6f
0x0f0c: 0x2c000000
0x0f14: 0x88888888
0x0f20: 0x03f2c17f
0x0f24: 0x03f08060
0x0f28: 0x03f2c57a
0x0f30: 0x7aa97b76
0x0f34: 0x88888888
0x0f38: 0xa889ba97
0x0f40: 0xbc83bc23
0x0f44: 0x6950ffdd
0x0f4c: 0x00120707
0x0f50: 0xa79898a9
0x0f54: 0x88888888
0x0f58: 0xb999b9ba
0x0f5c: 0x88888888
0x0f64: 0x80000000
0x0f68: 0x180210c3
0x0f6c: 0x0c58b650
0x0f70: 0x4cb2ce15
0x0f74: 0x000e453a
0x0f78: 0x00518154
0x0f80: 0x04000000
0x0f84: 0x03e00000
0x0f88: 0x5b000000
0x0f8c: 0x00000100
0x1000: 0x3a92cedd
0x1004: 0x3a90d0e0
0x1008: 0x39d2bce9
0x100c: 0x48000000
0x1010: 0x97ba56bb
0x1014: 0x77c755a9
0x1018: 0x77a9577a
0x1020: 0x03f26547
0x1024: 0x03f2754f
0x1028: 0x03f23d34
0x1030: 0xa8589a75
0x1034: 0x77977996
0x1038: 0x9a995a99
0x1040: 0xbc83bc23
0x1044: 0x6950ffdd
0x104c: 0x00120707
0x1050: 0xb7a9a8a8
0x1054: 0xb6a797a7
0x1058: 0xb9a9cab9
0x105c: 0x88888888
0x1064: 0x80000000
0x1068: 0xf83bd145
0x106c: 0x08306950
0x1070: 0x0cb26e18
0x1074: 0x000e453a
0x1078: 0x00518154
0x1080: 0x04000000
0x1084: 0x03e00000
0x1088: 0x5b000000
0x108c: 0x00000100
0x1100: 0x2de042d3
0x1104: 0x2a004040
0x1108: 0x2d83b6fa
0x110c: 0x28000000
0x1110: 0x77a95499
0x1114: 0x88888888
0x1118: 0x65a864ab
0x1120: 0x03f23937
0x1124: 0x03f08060
0x1128: 0x03f24539
0x1130: 0x9a957865
0x1134: 0x88888888
0x1138: 0x6779a756
0x1140: 0xbc83bc23
0x1144: 0x6950ffdd
0x114c: 0x00120707
0x1150: 0x56696858
0x1154: 0x88888888
0x1158: 0xacacabac
0x115c: 0x88888888
0x1164: 0x80000000
0x1168: 0xf8042fbe
0x116c: 0x08102550
0x1170: 0x0cb24e18
0x1174: 0x000e453a
0x1178: 0x00518154
0x1180: 0x04000000
0x1184: 0x03e00000
0x1188: 0x5b000000
0x118c: 0x00000100
0x1200: 0x04a2e2d7
0x1210: 0x0061c2c7
0x1218: 0x0001470b
0x121c: 0x1013a010
0x1220: 0x00000007
0x1224: 0x02000000
0x1300: 0x04a2e2d7
0x1310: 0x0061c2c7
0x1318: 0x0001d404
0x131c: 0x1013a010
0x1320: 0x00000005
0x1324: 0x02000000
0x1400: 0x04a2e2d7
0x1404: 0x0000001b
0x140c: 0x10018010
0x1424: 0x02000000
0x1500: 0x04a2e2d7
0x1504: 0x0000000d
0x150c: 0x10018010
0x1524: 0x02000000
0x1600: 0xbc83bc23
0x1604: 0x6950ffdd
0x1608: 0x04a2e2d7
0x160c: 0x0061c2c7
0x1610: 0x0220a967
0x1614: 0xf0707fd8
0x1618: 0x040b8e77
0x161c: 0x1160e7d4
0x1620: 0x06000000
0x1624: 0x5e518154
0x1628: 0x00860001
0x162c: 0x00120707
0x1630: 0x1569d7a3
0x1634: 0x18728b90
0x1800: 0x00000007
0x1804: 0x0220a967
0x1808: 0x00007700
0x180c: 0x08048912
0x1810: 0x00000010
0x1814: 0x02000000
0x1818: 0x00000001
0x1820: 0xfc010000
0x1900: 0x00000005
0x1904: 0x0220a967
0x1908: 0x00007700
0x190c: 0x08052014
0x1910: 0x00000010
0x1914: 0x02000000
0x1918: 0x00000001
0x1920: 0x00010000
0x1a00: 0x04a2e2d7
0x1a04: 0x0000001b
0x1a0c: 0x10018010
0x1a24: 0x02000000
0x1b00: 0x04a2e2d7
0x1b04: 0x0000000d
0x1b0c: 0x10018010
0x1b24: 0x02000000
0x1c10: 0x0061c2c7
0x1c18: 0x0801470b
0x1c1c: 0x10120010
0x1c20: 0x00000007
0x1c24: 0x02000000
0x1d10: 0x0061c2c7
0x1d18: 0x0801d404
0x1d1c: 0x10120010
0x1d20: 0x00000005
0x1d24: 0x02000000
0x2008: 0x00500316
0x3000: 0x3674cb61
0x3004: 0x3664cf69
0x3008: 0x35c3bf57
0x300c: 0x40000000
0x3010: 0x79a7577b
0x3014: 0x79b977ab
0x3018: 0x97a7579a
0x3020: 0x03f3119d
0x3024: 0x03f31da4
0x3028: 0x03f2d983
0x3030: 0xaa76a967
0x3034: 0x99776a64
0x3038: 0xb7ba7997
0x3040: 0xbc83bc23
0x3044: 0x6950ffdd
0x304c: 0x00120707
0x3050: 0xabcabbbd
0x3054: 0xaacabbbc
0x3058: 0xbcbabcbd
0x305c: 0x88888888
0x3064: 0x80000000
0x3068: 0xe0063041
0x306c: 0x0850a550
0x3070: 0x0cb28e15
0x3074: 0x000e453a
0x3078: 0x00518154
0x3080: 0x04000000
0x3084: 0x03e00000
0x3088: 0x5b000000
0x308c: 0x00000100
0x3100: 0x21c042ab
0x3104: 0x2a004040
0x3108: 0x21b0b4c2
0x310c: 0x28000000
0x3110: 0xa7aa75a9
0x3114: 0x88888888
0x3118: 0x76aa64a9
0x3120: 0x03f160cf
0x3124: 0x03f08060
0x3128: 0x03f164cf
0x3130: 0x96a97597
0x3134: 0x88888888
0x3138: 0x65779686
0x3140: 0xbc83bc23
0x3144: 0x6950ffdd
0x314c: 0x00120707
0x3150: 0x7aa9789b
0x3154: 0x88888888
0x3158: 0x9bba9a9b
0x315c: 0x88888888
0x3164: 0x80000000
0x3168: 0x20084000
0x316c: 0x0a143950
0x3170: 0x0cb27200
0x3174: 0x000e453a
0x3178: 0x00518154
0x3180: 0x04000000
0x3184: 0x03e00000
0x3188: 0x5b000000
0x318c: 0xf0000080
0x3200: 0x04a2e2d7
0x3204: 0x0000001b
0x320c: 0x10018010
0x3224: 0x02000000
0x3300: 0x04a2e2d7
0x3304: 0x0000000d
0x330c: 0x10018010
0x3324: 0x02000000
0x3410: 0x0061c2c7
0x3418: 0x0801470b
0x341c: 0x10120010
0x3420: 0x00000007
0x3424: 0x02000000
0x3510: 0x0061c2c7
0x3518: 0x0801d404
0x351c: 0x10120010
0x3520: 0x00000005
0x3524: 0x02000000
0x3600: 0x3674cb61
0x3604: 0x3664cf69
0x3608: 0x35c3bf57
0x360c: 0x40000000
0x3610: 0x79a7577b
0x3614: 0x79b977ab
0x3618: 0x97a7579a
0x3620: 0x03f3119d
0x3624: 0x03f31da4
0x3628: 0x03f2d983
0x3630: 0xaa76a967
0x3634: 0x99776a64
0x3638: 0xb7ba7997
0x3640: 0xbc83bc23
0x3644: 0x6950ffdd
0x364c: 0x00120707
0x3650: 0xabcabbbd
0x3654: 0xaacabbbc
0x3658: 0xbcbabcbd
0x365c: 0x88888888
0x3664: 0x80000000
0x3668: 0xe0063041
0x366c: 0x0850a550
0x3670: 0x0cb28e15
0x3674: 0x000e453a
0x3678: 0x00518154
0x3680: 0x04000000
0x3684: 0x03e00000
0x3688: 0x5b000000
0x368c: 0x00000100
0x3700: 0x04a2e2d7
0x3704: 0x0000001b
0x370c: 0x10018010
0x3724: 0x02000000
0x3810: 0x0061c2c7
0x3818: 0x0801470b
0x381c: 0x10120010
0x3820: 0x00000007
0x3824: 0x02000000
0x3900: 0x00000007
0x3904: 0x0220a967
0x3908: 0x00007700
0x390c: 0x08048912
0x3910: 0x00000010
0x3914: 0x02000000
0x3918: 0x00000001
0x3920: 0xfc010000
0x3a00: 0xbc83bc23
0x3a04: 0x6950ffdd
0x3a08: 0x04a2e2d7
0x3a0c: 0x0061c2c7
0x3a10: 0x0220a967
0x3a14: 0xf0707fd8
0x3a18: 0x040b8e77
0x3a1c: 0x1160e7d4
0x3a20: 0x06000000
0x3a24: 0x62518154
0x3a28: 0x00860001
0x3a2c: 0x00120707
0x3a30: 0x1569d7a3
0x3a34: 0x18728b90
0x4000: 0x26092711
0x4004: 0x0002461a
0x4008: 0x26169d86
0x400c: 0x08070406
0x4010: 0x0c0b0909
0x4014: 0x07061820
0x4018: 0x07080406
0x401c: 0x0c004d34
0x4020: 0x45383838
0x4024: 0x0e154555
0x402c: 0x00000004
0x4034: 0x00000c00
0x4038: 0x01000040
0x403c: 0x00600040
0x4040: 0x00002080
0x4044: 0x00000046
0x4054: 0x76543210
0x4068: 0x383f2838
0x406c: 0x00401010
0x4070: 0x2df10112
0x4078: 0x0000c600
0x4080: 0x11441144
0x4100: 0x0000c749
0x4108: 0x00a10ca1
0x410c: 0x00ef0d08
0x4110: 0x00ad0a1e
0x4114: 0x00a10ca1
0x4118: 0x00ef0d08
0x411c: 0x00ad0a1e
0x4120: 0x00a10ca1
0x4124: 0x00ef0d08
0x4128: 0x00ad0a1e
0x412c: 0x00a10ca1
0x4130: 0x00ef0d08
0x4134: 0x00ad0a1e
0x4138: 0x0a010102
0x4190: 0x0007000f
0x419c: 0x30000083
0x41a0: 0x61110111
0x41bc: 0x01010100
0x41c0: 0x00000011
0x41c8: 0x05000000
0x41cc: 0x0f00080b
0x41d0: 0x00000001
0x4200: 0x00000040
0x4210: 0x01200d00
0x4214: 0x0ffa1346
0x4218: 0x03030303
0x421c: 0x03030303
0x4220: 0x00000003
0x4224: 0x03030303
0x4228: 0x01000000
0x4230: 0x20210210
0x4234: 0x64210210
0x4238: 0xa2009840
0x423c: 0x01a42494
0x4240: 0x62005300
0x4244: 0x00004000
0x4248: 0x00020080
0x424c: 0x000004e8
0x4254: 0x00000007
0x4260: 0x00000b0b
0x4264: 0x00000707
0x4268: 0x00008f8f
0x426c: 0x0000c8c8
0x4270: 0x00009696
0x4274: 0xffffffff
0x4278: 0x8000002a
0x4290: 0x00007000
0x42a8: 0x76543210
0x42b0: 0x51022f0e
0x4330: 0xffff0001
0x4358: 0x00000002
0x4360: 0x0000007f
0x4364: 0x0000007f
0x4368: 0x0000007f
0x436c: 0x0000007f
0x4370: 0x0000007f
0x4374: 0x0000007f
0x4378: 0x0000007f
0x437c: 0x0000007f
0x4380: 0x0000007f
0x43a0: 0x05010964
0x43a4: 0x020006e8
0x43a8: 0x01800008
0x43ac: 0x00000819
0x43b8: 0x1a1a1a1a
0x43bc: 0x1a191b18
0x43c0: 0x1a1a1a1a
0x43c4: 0x191b1a19
0x43c8: 0x13151514
0x43fc: 0x00003800
0x4400: 0x26092711
0x4404: 0x0002461a
0x4408: 0x26169d86
0x440c: 0x07060406
0x4410: 0x0a0a0909
0x4414: 0x05061820
0x4418: 0x07070406
0x441c: 0x0c004c34
0x4420: 0x45394539
0x4424: 0x0e154545
0x442c: 0x00000004
0x4434: 0x00000c00
0x4438: 0x01000040
0x443c: 0x00600040
0x4440: 0x00002080
0x4444: 0x00000046
0x4454: 0x76543210
0x4468: 0x383f2838
0x446c: 0x00401010
0x4470: 0x2df10112
0x4478: 0x0000c600
0x4480: 0x11441144
0x4500: 0x0000c749
0x4508: 0x00a10ca1
0x450c: 0x00ef0d08
0x4510: 0x00ad0a1e
0x4514: 0x00a10ca1
0x4518: 0x00ef0d08
0x451c: 0x00ad0a1e
0x4520: 0x00a10ca1
0x4524: 0x00ef0d08
0x4528: 0x00ad0a1e
0x452c: 0x00a10ca1
0x4530: 0x00ef0d08
0x4534: 0x00ad0a1e
0x4538: 0x0a010102
0x4590: 0x0005000f
0x459c: 0x30000083
0x45a0: 0x61110111
0x45bc: 0x01010100
0x45c0: 0x00000011
0x45c8: 0x05000080
0x45cc: 0x0f00080b
0x45d0: 0x00000001
0x4600: 0x00000040
0x4610: 0x01200d00
0x4614: 0x0ffa1b46
0x4618: 0xc1c1c1c1
0x461c: 0xc1c1c1c1
0x4620: 0x000000c1
0x4624: 0x03030303
0x4628: 0x01000101
0x4630: 0x20210210
0x4634: 0x64210210
0x4638: 0xa2009840
0x463c: 0x01a42494
0x4640: 0x62005300
0x4644: 0x00004000
0x4648: 0x00020080
0x464c: 0x000004e8
0x4654: 0x00000005
0x4660: 0x00000b0b
0x4664: 0x00000707
0x4668: 0x00008f8f
0x466c: 0x0000c8c8
0x4670: 0x00009696
0x4674: 0xffffffff
0x4678: 0x80000022
0x4690: 0x00007000
0x46a8: 0x76543210
0x46b0: 0x96e52b5a
0x4730: 0xffff0001
0x4758: 0x00000002
0x4760: 0x0000007f
0x4764: 0x0000007f
0x4768: 0x0000007f
0x476c: 0x0000007f
0x4770: 0x0000007f
0x4774: 0x0000007f
0x4778: 0x0000007f
0x477c: 0x0000007f
0x4780: 0x0000007f
0x47a0: 0x07010964
0x47a4: 0x020004e8
0x47a8: 0x01800008
0x47ac: 0x00000816
0x47b8: 0x16161617
0x47bc: 0x16151616
0x47c8: 0x191a1919
0x47fc: 0x00003800
0x4804: 0x00030000
0x4808: 0x00400007
0x480c: 0x08000000
0x4810: 0x08000000
0x4814: 0x08000000
0x4818: 0x08000000
0x481c: 0x08000000
0x4820: 0x08000000
0x4824: 0x08000000
0x4830: 0x00400007
0x4834: 0x08000000
0x4838: 0x08000000
0x483c: 0x08000000
0x4840: 0x08000000
0x4844: 0x08000000
0x4848: 0x08000000
0x484c: 0x08000000
0x4858: 0x21110202
0x485c: 0x21110202
0x4860: 0x21110202
0x4864: 0x21110202
0x4868: 0x21110202
0x486c: 0x21110202
0x4870: 0x21110202
0x4874: 0x21110202
0x4880: 0x21110202
0x4884: 0x21110202
0x4888: 0x21110202
0x488c: 0x21110202
0x4890: 0x21110202
0x4894: 0x21110202
0x4898: 0x21110202
0x489c: 0x21110202
0x48a8: 0x00003000
0x48ac: 0x00000002
0x48b0: 0x00003000
0x48b4: 0x00000002
0x48c0: 0x00100000
0x48c4: 0x00100000
0x48d0: 0x00000080
0x48d4: 0x00000080
0x48e8: 0xff0003f8
0x48ec: 0x000f00ff
0x48f0: 0xff0003f8
0x48f4: 0x000f00ff
0x48f8: 0xff0003f8
0x48fc: 0x000f00ff
0x4900: 0xff0003f8
0x4904: 0x000f00ff
0x4910: 0x00180008
0x4914: 0x80017047
0x4918: 0x00180008
0x491c: 0x80017047
0x4930: 0x00000002
0x4934: 0x00000002
0x4938: 0x0a418820
0x493c: 0x0a418820
0x4940: 0x16a4a0e6
0x4944: 0x0041ee6b
0x4948: 0x16a4a0e6
0x494c: 0x0041ee6b
0x4958: 0x0000ff00
0x495c: 0x0000ff00
0x4960: 0x01010100
0x4964: 0x01010100
0x4980: 0x76543210
0x4984: 0xfedcba98
0x4988: 0x76543210
0x498c: 0xfedcba98
0x49a0: 0x00100000
0x49a4: 0x00100000
0x49a8: 0x01ffffff
0x49ac: 0x01ffffff
0x4c00: 0x26092711
0x4c04: 0x0002461a
0x4c08: 0x26169d86
0x4c0c: 0x08070406
0x4c10: 0x0c0b0909
0x4c14: 0x07061820
0x4c18: 0x07080406
0x4c1c: 0x0c004d34
0x4c20: 0x45383838
0x4c24: 0x0e154555
0x4c2c: 0x00000004
0x4c34: 0x00000c00
0x4c38: 0x01000040
0x4c3c: 0x00600040
0x4c40: 0x00002080
0x4c44: 0x00000046
0x4c54: 0x76543210
0x4c68: 0x383f2838
0x4c6c: 0x00401010
0x4c70: 0x2df10112
0x4c78: 0x0000c600
0x4c80: 0x11441144
0x4d00: 0x0000c749
0x4d08: 0x00a10ca1
0x4d0c: 0x00ef0d08
0x4d10: 0x00ad0a1e
0x4d14: 0x00a10ca1
0x4d18: 0x00ef0d08
0x4d1c: 0x00ad0a1e
0x4d20: 0x00a10ca1
0x4d24: 0x00ef0d08
0x4d28: 0x00ad0a1e
0x4d2c: 0x00a10ca1
0x4d30: 0x00ef0d08
0x4d34: 0x00ad0a1e
0x4d38: 0x0a010102
0x4d90: 0x0007000f
0x4d9c: 0x30000083
0x4da0: 0x61110111
0x4dbc: 0x01010100
0x4dc0: 0x00000011
0x4dc8: 0x05000000
0x4dcc: 0x0f00080b
0x4dd0: 0x00000001
0x4e00: 0x00000040
0x4e10: 0x01200d00
0x4e14: 0x0ffa1346
0x4e18: 0x03030303
0x4e1c: 0x03030303
0x4e20: 0x00000003
0x4e24: 0x03030303
0x4e28: 0x01000000
0x4e30: 0x20210210
0x4e34: 0x64210210
0x4e38: 0xa2009840
0x4e3c: 0x01a42494
0x4e40: 0x62005300
0x4e44: 0x00004000
0x4e48: 0x00020080
0x4e4c: 0x000004e8
0x4e54: 0x00000007
0x4e60: 0x00000b0b
0x4e64: 0x00000707
0x4e68: 0x00008f8f
0x4e6c: 0x0000c8c8
0x4e70: 0x00009696
0x4e74: 0xffffffff
0x4e78: 0x8000002a
0x4e90: 0x00007000
0x4ea8: 0x76543210
0x4eb0: 0x510453d3
0x4f30: 0xffff0001
0x4f58: 0x00000002
0x4f60: 0x0000007f
0x4f64: 0x0000007f
0x4f68: 0x0000007f
0x4f6c: 0x0000007f
0x4f70: 0x0000007f
0x4f74: 0x0000007f
0x4f78: 0x0000007f
0x4f7c: 0x0000007f
0x4f80: 0x0000007f
0x4fa0: 0x05010964
0x4fa4: 0x020006e8
0x4fa8: 0x01800008
0x4fac: 0x00000819
0x4fb8: 0x1a1a1a1a
0x4fbc: 0x1a191b18
0x4fc0: 0x1a1a1a1a
0x4fc4: 0x191b1a19
0x4fc8: 0x13151514
0x4ffc: 0x00003800
0x5000: 0x00010000
0x5004: 0x00003110
0x5008: 0x00003110
0x500c: 0x00080408
0x5010: 0x00080008
0x5018: 0x00000013
0x5024: 0x120c3200
0x5030: 0x004001ab
0x5034: 0x03000000
0x5044: 0xd49bb6df
0x5048: 0x006fb364
0x5050: 0x94974ec1
0x5054: 0x604fdd06
0x5058: 0x877bdf81
0x505c: 0x1bd3f000
0x5060: 0x00010200
0x5068: 0xa74f2093
0x5074: 0x00000010
0x5078: 0x00001844
0x5080: 0x000a4016
0x5084: 0x00010cff
0x5094: 0xffffffff
0x50a4: 0x76543210
0x50fc: 0x0000008f
0x5130: 0xa0b401c2
0x5134: 0x000f0b05
0x5138: 0x00002484
0x5410: 0xfed90001
0x5418: 0x00000004
0x541c: 0x30000000
0x5420: 0xfed84001
0x5428: 0x00000055
0x5500: 0x00000001
0x5828: 0x56433f33
0x5830: 0x2862d56e
0x5880: 0x00000160
0x5884: 0x00000005
0x5890: 0x0000ffff
0x5894: 0x0000ffff
0x5898: 0x0000ffff
0x589c: 0x0000ffff
0x58a4: 0x00000007
0x58a8: 0x0000271e
0x58bc: 0x0000007f
0x58d0: 0x0000ffff
0x58d4: 0x0000ffff
0x58d8: 0x0000ffff
0x58dc: 0x0000ffff
0x58e4: 0x005400de
0x58e8: 0x004d37b5
0x58f0: 0x0000000a
0x58f8: 0x006d8016
0x58fc: 0x34000000
0x5904: 0x01000000
0x590c: 0x00000002
0x5918: 0x24000a12
0x5920: 0x00000010
0x5924: 0x00000010
0x5928: 0x00ac5227
0x5930: 0x00000240
0x5938: 0x000a0e03
0x593c: 0x00c4bb4d
0x5954: 0x00040000
0x5958: 0xf1012300
0x595c: 0x00080838
0x5968: 0x9cd48faa
0x596c: 0x05769df9
0x5978: 0x0000002b
0x597c: 0x0000002b
0x5984: 0x5d31ab9a
0x5994: 0x000000ff
0x5998: 0x00040810
0x599c: 0x00641400
0x59a0: 0x00010000
0x59b8: 0x00000400
0x59c0: 0x08000000
0x5d10: 0x00000001
0x5d20: 0x00000005
0x5d24: 0x000001f4
0x5d44: 0x76543210
0x5da4: 0x00000007
0x5da8: 0x0000000b
0x5e00: 0x00000009
0x5e04: 0x00000009
0x5f00: 0x00002706
0x5f04: 0x00000010
0x5f08: 0x00000014
0x5f14: 0x00000001
0x5f18: 0x00000001
0x5f3c: 0x00000023
0x5f50: 0x80000000
0x6000: 0x00000004
0x6008: 0x800000f8
0x6010: 0xfff00000
0x6014: 0x0000007f
0x6020: 0x00000001
0x6030: 0x000700b0
0x6034: 0x000700b0
0x6044: 0x76543210
0x6100: 0x00fec000
0x6200: 0x883a0800
0x6300: 0x00001888
0x6304: 0x00001888
0x63fc: 0x00000001
0x6410: 0x00000f00
0x6434: 0x76543210
0x6438: 0x004a0000
0x6800: 0x80000044
0x6804: 0x800000ff
0x7000: 0x80444444
0x701c: 0x01400000
0x702c: 0x00000003
0x7060: 0x000083e9
0x7070: 0x000083e9
0x7080: 0x000083e9
0x713c: 0x00000002
0x7178: 0x76543210
0x717c: 0x76543210
0x7180: 0x76543210
0x7184: 0x76543210
0x7188: 0x76543210
0x7190: 0x76543210
0x71a0: 0x76543210
0x71ac: 0x76543210
0x7200: 0x24924924
0x7204: 0x00924924
0x7208: 0x00924844
0x720c: 0x00924924
0x7210: 0x00004844
0x7214: 0x00024924
0x7218: 0x00004844
0x721c: 0x24924924
0x7220: 0x00004844
0x7224: 0x00000924
0x7228: 0x00004844
0x722c: 0x24924924
0x7230: 0x00004924
0x7234: 0x00024924
0x7238: 0x00004924
0x723c: 0x00024924
0x7240: 0x00000024
0x7400: 0x0a241251
0x7404: 0x0a241251
0x7408: 0x00441492
0x740c: 0x00000012
0x7410: 0x00000652
0x7414: 0x0033bb67
0x7418: 0x00341080
0x741c: 0x0033bb67
0x7424: 0x76543210
0x742c: 0x00000001
0x7454: 0x00641080
0x7458: 0x0418d608
0x745c: 0x00000212
0x7460: 0x00004100
0x746c: 0x0000048a
0x7470: 0x0a241251
0x7474: 0x0a241251
0x7500: 0x00070000
0x7504: 0x000700fa
0x7600: 0x00001888
0x7604: 0x00001888
0x7608: 0x00001888
0x77fc: 0x00000001
0x7800: 0x00444444
0x7804: 0x00004400
0x7808: 0x00004444
0x780c: 0x44444444
0x7810: 0x40004444
0x7814: 0x00000444
0x7818: 0x00000044
0x782c: 0x76543210
0x7838: 0x00004848
0x7840: 0x00001888
0x7844: 0x00001888
0x7848: 0x00001888
0x7850: 0x00001888
0x7854: 0x00042108
0x7bfc: 0x00000001
0x7db4: 0x76543210
0x7dc4: 0x76543210
0x7de0: 0x00000024
0x7de4: 0x00001888
0x7de8: 0x00000444
0x7e54: 0x76543210


