CPU: ID 0x906e9, Processor Type 0x0, Family 0x6, Model 0x9e, Stepping 0x9
Northbridge: 8086:5918 (7th generation (Kaby Lake family) Core Processor Xeon E3-1200)
Southbridge: 8086:a149 (C236)

========== PMBASE/ABASE =========

PMBASE = 0x1800 (IO)

pmbase+0x0000: 0x0000     (PM1_STS)
pmbase+0x0002: 0x0120     (PM1_EN)
pmbase+0x0004: 0x00000001 (PM1_CNT)
pmbase+0x0008: 0x00e77cc7 (PM1_TMR)
pmbase+0x0030: 0x90002023 (SMI_EN)
pmbase+0x0034: 0x00004000 (SMI_STS)
pmbase+0x0040: 0x00000000 (GPE_CNTL)
pmbase+0x0044: 0x1020     (DEVACT_STS)
pmbase+0x0050: 0x00000000 (PM2_CNT)
pmbase+0x0054: 0x00002000 (OC_WDT_CTL)
pmbase+0x0080: 0x00000000 (GPE0_STS_31_0)
pmbase+0x0084: 0x00000000 (GPE0_STS_63_31)
pmbase+0x0088: 0x00000000 (GPE0_STS_95_64)
pmbase+0x008c: 0x00000000 (GPE0_STS_127_96)
pmbase+0x0090: 0x00080000 (GPE0_EN_31_0)
pmbase+0x0094: 0x00000000 (GPE0_EN_63_31)
pmbase+0x0098: 0x00000020 (GPE0_EN_95_64)
pmbase+0x009c: 0x00008246 (GPE0_EN_127_96)

=========== PWRMBASE ===========

PWRMBASE = 0xfe000000 (MEM)

0x0000: 0xffffffff
0x0004: 0xffffffff
0x0008: 0xffffffff
0x000c: 0xffffffff
0x0010: 0x0a310100
0x0014: 0x11052fff
0x0018: 0x294f0024
0x001c: 0x80000000
0x0020: 0x3000000f
0x003c: 0x04000000
0x0048: 0x1e2dd701
0x004c: 0x00000001
0x0050: 0x1e2dd701
0x0054: 0x00000001
0x0058: 0x0001c000
0x0068: 0x04043400
0x0080: 0xbf8ff701
0x0084: 0x0201c7e1
0x0088: 0x3f8ff701
0x008c: 0x0201c7e1
0x0098: 0x0001c000
0x00a8: 0x00181300
0x00ac: 0x02006001
0x00b0: 0x00181300
0x00b4: 0x02006001
0x00c0: 0x00060a00
0x00d0: 0x00200840
0x00d4: 0x7000f4e6
0x00e0: 0x01040001
0x00e4: 0x16bf0003
0x00e8: 0x40028018
0x00ec: 0x00000201
0x00f0: 0x30002de4
0x00f4: 0x7000f4c0
0x00fc: 0x00000002
0x0100: 0x00000008
0x010c: 0x00002de4
0x0110: 0xffffffff
0x0120: 0x00000436
0x012c: 0x00000002
0x0200: 0x0000ff00
0x0204: 0x0a000000
0x0210: 0x00003fff
0x0300: 0x07ffffff
0x0314: 0x1e0a4616
0x031c: 0x2bc0d003
0x0320: 0x0005db01
0x0324: 0x40000006
0x0340: 0x40000008
0x034c: 0xc0200000
0x0350: 0x00040201
0x0354: 0x0174ba5d
0x0358: 0x0174ba5d
0x035c: 0x00000001
0x0368: 0x00009001
0x036c: 0x88b988b9
0x0370: 0x000013ff
0x0378: 0x88ff88ff
0x03a8: 0x40000029
0x03b0: 0x00000021
0x03c0: 0x00008003
0x03d0: 0x800a2205
0x03e0: 0x60000069
0x03e8: 0x00200001
0x03ec: 0x02020000
0x0500: 0x03020100
0x0504: 0x07060504
0x0508: 0x0b0a0908
0x050c: 0x0f0e0d0c
0x0510: 0x13121110
0x0514: 0x17161514
0x0518: 0x1b1a1918
0x051c: 0x1f1e1d1c
0x0520: 0x23222120
0x0524: 0x27262524
0x0528: 0x2b2a2928
0x052c: 0x2f2e2d2c
0x0530: 0x33323130
0x0534: 0x37363534
0x0538: 0x3b3a3938
0x053c: 0x3f3e3d3c
0x0580: 0xf94081ef
0x0584: 0xffffffcf
0x0590: 0x06ba7e10
0x0594: 0xfff80000
0x05a0: 0x06000606
0x05d0: 0x80000001
0x05e0: 0xf94081ef
0x05e4: 0xffffffcf
0x0600: 0xe0000082
0x0604: 0x20000082
0x0620: 0x80000000
0x0624: 0x000007ff
0x0628: 0x00bffbbc
0x0644: 0x00000016


