CPU: ID 0x906e9, Processor Type 0x0, Family 0x6, Model 0x9e, Stepping 0x9
Northbridge: 8086:5918 (7th generation (Kaby Lake family) Core Processor Xeon E3-1200)
Southbridge: 8086:a149 (C236)
Trying to reveal Primary to Sideband Bridge (P2SB),
let's hope the OS doesn't mind... done.
SBREG_BAR = 0xfd000000 (MEM)

Hiding Primary to Sideband Bridge (P2SB).

========== PCR 0x89 ==========

PCR port offset: 0x890000

0x0000: 0x00000000
*
0x1d00: 0x00000007
0x1d04: 0x00000000
*
0x1e10: 0x000fff00
0x1e14: 0x00000000
*
0x1e80: 0x00fcff01
0x1e84: 0x000200f0
0x1e88: 0x00000061
0x1e8c: 0x00010020
0x1e90: 0x00000000
*
CPU: ID 0x906e9, Processor Type 0x0, Family 0x6, Model 0x9e, Stepping 0x9
Northbridge: 8086:5918 (7th generation (Kaby Lake family) Core Processor Xeon E3-1200)
Southbridge: 8086:a149 (C236)
Trying to reveal Primary to Sideband Bridge (P2SB),
let's hope the OS doesn't mind... done.
SBREG_BAR = 0xfd000000 (MEM)

Hiding Primary to Sideband Bridge (P2SB).

========== PCR 0xa8 ==========

PCR port offset: 0xa80000

0x0000: 0x80000100
0x0004: 0x04000045
0x0008: 0x00000000
*
0x0010: 0x723f0000
0x0014: 0x11000511
0x0018: 0x0209003c
0x001c: 0x60000000
0x0020: 0x0d071622
0x0024: 0xa40b0a10
0x0028: 0x010201e0
0x002c: 0x00000000
0x0030: 0x80808080
0x0034: 0x32323232
0x0038: 0x00000025
0x003c: 0x00008f02
0x0040: 0xff027f04
0x0044: 0x00004096
0x0048: 0x005a0001
0x004c: 0x001e0001
0x0050: 0x00000001
0x0054: 0x000f0000
0x0058: 0x2001030f
0x005c: 0x1f1f0001
0x0060: 0x18090e40
0x0064: 0xa015000b
0x0068: 0x00000000
*
0x0080: 0x1d1d3b3b
0x0084: 0x1e1e0000
0x0088: 0x28003b32
0x008c: 0x28282828
0x0090: 0x00000000
0x0094: 0x28292a06
0x0098: 0x151f2800
0x009c: 0x202a0000
0x00a0: 0x00000014
0x00a4: 0x4c4c4c4c
0x00a8: 0x200a1414
0x00ac: 0x000012e4
0x00b0: 0x080c0a10
0x00b4: 0x0c000000
0x00b8: 0x00140008
0x00bc: 0x00000000
0x00c0: 0x06080600
0x00c4: 0x00000a08
0x00c8: 0x5e4188e3
0x00cc: 0x201f0000
0x00d0: 0x00817eaa
0x00d4: 0x0f0fb400
0x00d8: 0x88430fff
0x00dc: 0x204a0c00
0x00e0: 0x06060400
0x00e4: 0x00000000
*
0x00f0: 0x00200000
0x00f4: 0x00000000
*
0x0100: 0x0952a90c
0x0104: 0x00050989
0x0108: 0xffe01840
0x010c: 0x00529b1f
0x0110: 0x00c40155
0x0114: 0x0330631d
0x0118: 0x320072bf
0x011c: 0x003b0a08
0x0120: 0x00004000
0x0124: 0xaa3360f8
0x0128: 0x08102000
0x012c: 0x000a200a
0x0130: 0xbe468050
0x0134: 0x00000000
0x0138: 0x000d0000
0x013c: 0x000000e0
0x0140: 0x0108d15e
0x0144: 0x01051548
0x0148: 0x0105154c
0x014c: 0x0102cf37
0x0150: 0x033f3f3f
0x0154: 0x80c00102
0x0158: 0x0132a008
0x015c: 0x0060082a
0x0160: 0x00000000
0x0164: 0x00005400
0x0168: 0xb801822a
0x016c: 0x48042400
0x0170: 0x3340215a
0x0174: 0x80808040
0x0178: 0x40804060
0x017c: 0x40181818
0x0180: 0x00a80760
0x0184: 0xe0174000
0x0188: 0x24743000
0x018c: 0x0008407c
0x0190: 0x75503044
0x0194: 0x00000000
0x0198: 0x78747800
0x019c: 0x00302602
0x01a0: 0x1b000cec
0x01a4: 0x7a1b1b1b
0x01a8: 0x006e0076
0x01ac: 0x000060f6
0x01b0: 0x4a480000
0x01b4: 0x22813a3c
0x01b8: 0xf8f80280
0x01bc: 0x00000408
0x01c0: 0x1b880000
0x01c4: 0xffffffff
0x01c8: 0x608d8850
0x01cc: 0x4017171b
0x01d0: 0x0000003e
0x01d4: 0x008000c0
0x01d8: 0x3e000000
0x01dc: 0x57364a3c
0x01e0: 0x08000000
0x01e4: 0x4b0b0540
0x01e8: 0x18174800
0x01ec: 0x00000000
*
0x01f8: 0x00000100
*
0x0200: 0x80000100
0x0204: 0x04000045
0x0208: 0x00000000
*
0x0210: 0x723f0000
0x0214: 0x11000511
0x0218: 0x0209003c
0x021c: 0x60000000
0x0220: 0x0d071622
0x0224: 0xa40b0a10
0x0228: 0x010201e0
0x022c: 0x00000000
0x0230: 0x80808080
0x0234: 0x32323232
0x0238: 0x00000025
0x023c: 0x00008f02
0x0240: 0xff027f04
0x0244: 0x00004096
0x0248: 0x005a0001
0x024c: 0x001e0001
0x0250: 0x00000001
0x0254: 0x000f0000
0x0258: 0x2001030f
0x025c: 0x1f1f0001
0x0260: 0x18090e40
0x0264: 0xa015000b
0x0268: 0x00000000
*
0x0280: 0x1d1d3b3b
0x0284: 0x1e1e0000
0x0288: 0x28003b32
0x028c: 0x28282828
0x0290: 0x00000000
0x0294: 0x28292a06
0x0298: 0x151f2800
0x029c: 0x202a0000
0x02a0: 0x00000014
0x02a4: 0x4c4c4c4c
0x02a8: 0x200a1414
0x02ac: 0x000010e4
0x02b0: 0x080c0a10
0x02b4: 0x0c000000
0x02b8: 0x00140008
0x02bc: 0x00000000
0x02c0: 0x06080600
0x02c4: 0x00000a08
0x02c8: 0x5e4188e3
0x02cc: 0x201f0000
0x02d0: 0x00817eaa
0x02d4: 0x0f0fb400
0x02d8: 0x884110ff
0x02dc: 0x204a0c00
0x02e0: 0x06060400
0x02e4: 0x00000000
*
0x02f0: 0x00200000
0x02f4: 0x00000000
*
0x0300: 0x0952a90c
0x0304: 0x00050989
0x0308: 0xffe01840
0x030c: 0x00529b1f
0x0310: 0x00c40155
0x0314: 0x0330631b
0x0318: 0x320072bf
0x031c: 0x003b0808
0x0320: 0x00004000
0x0324: 0xaa3360f8
0x0328: 0x08102000
0x032c: 0x000a200a
0x0330: 0xbe468050
0x0334: 0x00000000
0x0338: 0x000d0007
0x033c: 0x000000e0
0x0340: 0x0108d15e
0x0344: 0x01051548
0x0348: 0x0105154c
0x034c: 0x0102cf37
0x0350: 0x043f3f3f
0x0354: 0x80c00102
0x0358: 0x0132a008
0x035c: 0x0060082a
0x0360: 0x00000000
0x0364: 0x00005400
0x0368: 0xb801822a
0x036c: 0x48042400
0x0370: 0x3340215a
0x0374: 0x80808040
0x0378: 0x40804060
0x037c: 0x40181818
0x0380: 0x00a80760
0x0384: 0xe0174000
0x0388: 0x24743000
0x038c: 0x0008407c
0x0390: 0x75503044
0x0394: 0x00000000
0x0398: 0x767e7800
0x039c: 0x00301a04
0x03a0: 0x1b000cec
0x03a4: 0x7c1b1b1b
0x03a8: 0x0074007e
0x03ac: 0x000060f6
0x03b0: 0x4a480000
0x03b4: 0x22813a48
0x03b8: 0xf0020080
0x03bc: 0x00003c02
0x03c0: 0x1b880000
0x03c4: 0xffffffff
0x03c8: 0x608d8850
0x03cc: 0x4017171b
0x03d0: 0x0000003e
0x03d4: 0x008000c0
0x03d8: 0x4a000000
0x03dc: 0x57485856
0x03e0: 0x08000000
0x03e4: 0x4b0b0540
0x03e8: 0x18174800
0x03ec: 0x00000000
*
0x03f8: 0x00000100
*
0x0400: 0x80000100
0x0404: 0x04000045
0x0408: 0x00000000
*
0x0410: 0x723f0000
0x0414: 0x11000511
0x0418: 0x0209003c
0x041c: 0x60000000
0x0420: 0x0d071622
0x0424: 0xa40b0a10
0x0428: 0x010201e0
0x042c: 0x00000000
0x0430: 0x80808080
0x0434: 0x33333333
0x0438: 0x00000026
0x043c: 0x00008f02
0x0440: 0xff027f04
0x0444: 0x00004096
0x0448: 0x005a0001
0x044c: 0x001e0001
0x0450: 0x00000001
0x0454: 0x000f0000
0x0458: 0x2001030f
0x045c: 0x1f1f0001
0x0460: 0x18090e40
0x0464: 0xa015000b
0x0468: 0x00000000
*
0x0480: 0x1e1e3d3d
0x0484: 0x1f1f0000
0x0488: 0x28003d33
0x048c: 0x28282828
0x0490: 0x00000000
0x0494: 0x28292a06
0x0498: 0x151f2800
0x049c: 0x202a0000
0x04a0: 0x00000014
0x04a4: 0x4c4c4c4c
0x04a8: 0x200a1414
0x04ac: 0x00001be4
0x04b0: 0x080c0a10
0x04b4: 0x0c000000
0x04b8: 0x00140008
0x04bc: 0x00000000
0x04c0: 0x06080600
0x04c4: 0x00000a08
0x04c8: 0x5e4188e3
0x04cc: 0x201f0000
0x04d0: 0x00817eaa
0x04d4: 0x0f0fb400
0x04d8: 0x884110ff
0x04dc: 0x204a0c00
0x04e0: 0x06060400
0x04e4: 0x00000000
*
0x04f0: 0x00200000
0x04f4: 0x00000000
*
0x0500: 0x0952a90c
0x0504: 0x00050989
0x0508: 0xffe01840
0x050c: 0x00529b1f
0x0510: 0x00c80155
0x0514: 0x0330631b
0x0518: 0x330073bf
0x051c: 0x003b0808
0x0520: 0x00004000
0x0524: 0xaa3360f8
0x0528: 0x08102000
0x052c: 0x000a200a
0x0530: 0xbe468050
0x0534: 0x00000000
0x0538: 0x000d001d
0x053c: 0x000000e0
0x0540: 0x0108d15e
0x0544: 0x01051548
0x0548: 0x0105154c
0x054c: 0x0102cf37
0x0550: 0x043f3f3f
0x0554: 0x80c00102
0x0558: 0x0132a008
0x055c: 0x0060082a
0x0560: 0x00000000
0x0564: 0x00005400
0x0568: 0xb801822a
0x056c: 0x48042400
0x0570: 0x3340215a
0x0574: 0x80808040
0x0578: 0x40804060
0x057c: 0x40181818
0x0580: 0x00a80760
0x0584: 0xe0174000
0x0588: 0x24743000
0x058c: 0x0008407c
0x0590: 0x75503044
0x0594: 0x00000000
0x0598: 0x767e767e
0x059c: 0x00302400
0x05a0: 0x1b000cec
0x05a4: 0x7c1b1b1b
0x05a8: 0x707c707c
0x05ac: 0x000060f6
0x05b0: 0x5a580000
0x05b4: 0x22814c4a
0x05b8: 0xf200fc80
0x05bc: 0x00003e04
0x05c0: 0x1b880000
0x05c4: 0xffffffff
0x05c8: 0x608d8850
0x05cc: 0x4017171b
0x05d0: 0x0000003e
0x05d4: 0x008000c0
0x05d8: 0x4a000000
0x05dc: 0x773a564a
0x05e0: 0x08000000
0x05e4: 0x4b0b0540
0x05e8: 0x18174800
0x05ec: 0x00000000
*
0x05f8: 0x00000100
*
0x0600: 0x80000100
0x0604: 0x04000045
0x0608: 0x00000000
*
0x0610: 0x723f0000
0x0614: 0x11000511
0x0618: 0x0209003c
0x061c: 0x60000000
0x0620: 0x0d071622
0x0624: 0xa40b0a10
0x0628: 0x010201e0
0x062c: 0x00000000
0x0630: 0x80808080
0x0634: 0x33333333
0x0638: 0x00000026
0x063c: 0x00008f02
0x0640: 0xff027f04
0x0644: 0x00004096
0x0648: 0x005a0001
0x064c: 0x001e0001
0x0650: 0x00000001
0x0654: 0x000f0000
0x0658: 0x2001030f
0x065c: 0x1f1f0001
0x0660: 0x18090e40
0x0664: 0xa015000b
0x0668: 0x00000000
*
0x0680: 0x1e1e3d3d
0x0684: 0x1f1f0000
0x0688: 0x28003d33
0x068c: 0x28282828
0x0690: 0x00000000
0x0694: 0x28292a06
0x0698: 0x151f2800
0x069c: 0x202a0000
0x06a0: 0x00000014
0x06a4: 0x4c4c4c4c
0x06a8: 0x200a1414
0x06ac: 0x00001ee4
0x06b0: 0x080c0a10
0x06b4: 0x0c000000
0x06b8: 0x00140008
0x06bc: 0x00000000
0x06c0: 0x06080600
0x06c4: 0x00000a08
0x06c8: 0x5e4188e3
0x06cc: 0x201f0000
0x06d0: 0x00817eaa
0x06d4: 0x0f0fb400
0x06d8: 0x884713ff
0x06dc: 0x204a0c00
0x06e0: 0x06060400
0x06e4: 0x00000000
*
0x06f0: 0x00200000
0x06f4: 0x00000000
*
0x0700: 0x0952a90c
0x0704: 0x00050989
0x0708: 0xffe01840
0x070c: 0x00529b1f
0x0710: 0x00c80155
0x0714: 0x0330631f
0x0718: 0x330073bf
0x071c: 0x003b0608
0x0720: 0x00004000
0x0724: 0xaa3360f8
0x0728: 0x08102000
0x072c: 0x000a200a
0x0730: 0xbe468050
0x0734: 0x00000000
0x0738: 0x000d0012
0x073c: 0x000000e0
0x0740: 0x0108d15e
0x0744: 0x01051548
0x0748: 0x0105154c
0x074c: 0x0102cf37
0x0750: 0x043f3f3f
0x0754: 0x80c00102
0x0758: 0x0132a008
0x075c: 0x0060082a
0x0760: 0x00000000
0x0764: 0x00005400
0x0768: 0xb801822a
0x076c: 0x48042400
0x0770: 0x3340215a
0x0774: 0x80808040
0x0778: 0x40804060
0x077c: 0x40181818
0x0780: 0x00a80760
0x0784: 0xe0174000
0x0788: 0x24743000
0x078c: 0x0008407c
0x0790: 0x75503044
0x0794: 0x00000000
0x0798: 0x7c767e7e
0x079c: 0x00302600
0x07a0: 0x1b000cec
0x07a4: 0x781b1b1b
0x07a8: 0x747a747a
0x07ac: 0x000060f6
0x07b0: 0x4a480000
0x07b4: 0x22813c3e
0x07b8: 0x00f80080
0x07bc: 0x00003e08
0x07c0: 0x1b880000
0x07c4: 0xffffffff
0x07c8: 0x608d8850
0x07cc: 0x4017171b
0x07d0: 0x0000003a
0x07d4: 0x008000c0
0x07d8: 0x4c000000
0x07dc: 0x573c564a
0x07e0: 0x08000000
0x07e4: 0x4b0b0540
0x07e8: 0x18174800
0x07ec: 0x00000000
*
0x07f8: 0x00000100
*
0x0800: 0x80000100
0x0804: 0x04000045
0x0808: 0x00000000
*
0x0810: 0x723f0000
0x0814: 0x11000511
0x0818: 0x0209003c
0x081c: 0x60000000
0x0820: 0x0d071622
0x0824: 0xa40b0a10
0x0828: 0x010201e0
0x082c: 0x00000000
0x0830: 0x80808080
0x0834: 0x34343434
0x0838: 0x00000027
0x083c: 0x00008f02
0x0840: 0xff027f04
0x0844: 0x00004096
0x0848: 0x005a0001
0x084c: 0x001e0001
0x0850: 0x00000001
0x0854: 0x000f0000
0x0858: 0x2001030f
0x085c: 0x1f1f0001
0x0860: 0x18090e40
0x0864: 0xa015000b
0x0868: 0x00000000
*
0x0880: 0x1e1e3e3e
0x0884: 0x1f1f0000
0x0888: 0x28003e34
0x088c: 0x28282828
0x0890: 0x00000000
0x0894: 0x28292a06
0x0898: 0x151f2800
0x089c: 0x202a0000
0x08a0: 0x00000014
0x08a4: 0x4c4c4c4c
0x08a8: 0x200a1414
0x08ac: 0x00001be4
0x08b0: 0x080c0a10
0x08b4: 0x0c000000
0x08b8: 0x00140008
0x08bc: 0x00000000
0x08c0: 0x06080600
0x08c4: 0x00000a08
0x08c8: 0x5e4188e3
0x08cc: 0x201f0000
0x08d0: 0x00817eaa
0x08d4: 0x0f0fb400
0x08d8: 0x884111ff
0x08dc: 0x204a0c00
0x08e0: 0x06060400
0x08e4: 0x00000000
*
0x08f0: 0x00200000
0x08f4: 0x00000000
*
0x0900: 0x0952a90c
0x0904: 0x00050989
0x0908: 0xffe01840
0x090c: 0x00529b1f
0x0910: 0x00c80155
0x0914: 0x0330631f
0x0918: 0x340074bf
0x091c: 0x003b0a08
0x0920: 0x00004000
0x0924: 0xaa3360f8
0x0928: 0x08102000
0x092c: 0x000a200a
0x0930: 0xb6468050
0x0934: 0x00000000
0x0938: 0x000d0005
0x093c: 0x000000e0
0x0940: 0x0108d15e
0x0944: 0x01051548
0x0948: 0x0105154c
0x094c: 0x0102cf37
0x0950: 0x003f3f3f
0x0954: 0x80c00102
0x0958: 0x0132a008
0x095c: 0x0060082a
0x0960: 0x00000000
0x0964: 0x00005400
0x0968: 0xb801822a
0x096c: 0x48042400
0x0970: 0x3340215a
0x0974: 0x80808040
0x0978: 0x40804060
0x097c: 0x40181818
0x0980: 0x00a80760
0x0984: 0xe0174000
0x0988: 0x24743000
0x098c: 0x0008407c
0x0990: 0x75503044
0x0994: 0x00000000
0x0998: 0x7c6a7a7c
0x099c: 0x00301400
0x09a0: 0x1b000cec
0x09a4: 0x001b1b1b
0x09a8: 0x7c787c7a
0x09ac: 0x000060f6
0x09b0: 0x484c0000
0x09b4: 0x22813e48
0x09b8: 0xf6ec0080
0x09bc: 0x00000006
0x09c0: 0x1b880000
0x09c4: 0xffffffff
0x09c8: 0x608d8850
0x09cc: 0x4017171b
0x09d0: 0x0000003e
0x09d4: 0x008000c0
0x09d8: 0x38000000
0x09dc: 0x33343e3c
0x09e0: 0x08000000
0x09e4: 0x4b0b0540
0x09e8: 0x18174800
0x09ec: 0x00000000
*
0x09f8: 0x00000100
*
0x0a00: 0x80000100
0x0a04: 0x04000045
0x0a08: 0x00000000
*
0x0a10: 0x723f0000
0x0a14: 0x11000511
0x0a18: 0x0209003c
0x0a1c: 0x60000000
0x0a20: 0x0d071622
0x0a24: 0xa40b0a10
0x0a28: 0x010201e0
0x0a2c: 0x00000000
0x0a30: 0x80808080
0x0a34: 0x33333333
0x0a38: 0x00000026
0x0a3c: 0x00008f02
0x0a40: 0xff027f04
0x0a44: 0x00004096
0x0a48: 0x005a0001
0x0a4c: 0x001e0001
0x0a50: 0x00000001
0x0a54: 0x000f0000
0x0a58: 0x2001030f
0x0a5c: 0x1f1f0001
0x0a60: 0x18090e40
0x0a64: 0xa015000b
0x0a68: 0x00000000
*
0x0a80: 0x1e1e3d3d
0x0a84: 0x1f1f0000
0x0a88: 0x28003d33
0x0a8c: 0x28282828
0x0a90: 0x00000000
0x0a94: 0x28292a06
0x0a98: 0x151f2800
0x0a9c: 0x202a0000
0x0aa0: 0x00000014
0x0aa4: 0x4c4c4c4c
0x0aa8: 0x200a1414
0x0aac: 0x000002e4
0x0ab0: 0x080c0a10
0x0ab4: 0x0c000000
0x0ab8: 0x00140008
0x0abc: 0x00000000
0x0ac0: 0x06080600
0x0ac4: 0x00000a08
0x0ac8: 0x5e4188e3
0x0acc: 0x201f0000
0x0ad0: 0x00817eaa
0x0ad4: 0x0f0fb400
0x0ad8: 0x884513ff
0x0adc: 0x204a0c00
0x0ae0: 0x06060400
0x0ae4: 0x00000000
*
0x0af0: 0x00200000
0x0af4: 0x00000000
*
0x0b00: 0x0952a90a
0x0b04: 0x00050989
0x0b08: 0xffe01840
0x0b0c: 0x00529b1f
0x0b10: 0x00c80155
0x0b14: 0x03306321
0x0b18: 0x330073bf
0x0b1c: 0x003b0808
0x0b20: 0x00004000
0x0b24: 0xaa3360f8
0x0b28: 0x08102000
0x0b2c: 0x000a200a
0x0b30: 0xbe468050
0x0b34: 0x00000000
0x0b38: 0x000d000a
0x0b3c: 0x000000e0
0x0b40: 0x0108d15e
0x0b44: 0x01051548
0x0b48: 0x0105154c
0x0b4c: 0x0102cf37
0x0b50: 0x003f3f3f
0x0b54: 0x80c00102
0x0b58: 0x0132a008
0x0b5c: 0x0060082a
0x0b60: 0x00000000
0x0b64: 0x00005400
0x0b68: 0xb801822a
0x0b6c: 0x48042400
0x0b70: 0x3340215a
0x0b74: 0x80808040
0x0b78: 0x40804060
0x0b7c: 0x40181818
0x0b80: 0x00a80760
0x0b84: 0xe0174000
0x0b88: 0x24743000
0x0b8c: 0x0008407c
0x0b90: 0x75503044
0x0b94: 0x00000000
0x0b98: 0x7478787e
0x0b9c: 0x00301202
0x0ba0: 0x1b000eec
0x0ba4: 0x001b1b1b
0x0ba8: 0x7e767e7a
0x0bac: 0x000060f6
0x0bb0: 0x56560000
0x0bb4: 0x22813c4c
0x0bb8: 0x00000080
0x0bbc: 0x00003e06
0x0bc0: 0x1b880000
0x0bc4: 0xffffffff
0x0bc8: 0x608d8850
0x0bcc: 0x4017171b
0x0bd0: 0x0000003c
0x0bd4: 0x008000c0
0x0bd8: 0x4e000000
0x0bdc: 0x593c584a
0x0be0: 0x08000000
0x0be4: 0x4b0b0540
0x0be8: 0x18174800
0x0bec: 0x00000000
*
0x0bf8: 0x00000100
*
0x0c00: 0x80000100
0x0c04: 0x00000044
0x0c08: 0x00000000
*
0x0c10: 0x723f0000
0x0c14: 0x11000511
0x0c18: 0x0209003c
0x0c1c: 0x60000000
0x0c20: 0x0d071622
0x0c24: 0xa40b0a10
0x0c28: 0x010201e0
0x0c2c: 0x00000000
0x0c30: 0x80808080
0x0c34: 0x33333333
0x0c38: 0x0000001a
0x0c3c: 0x00008f02
0x0c40: 0xff027f04
0x0c44: 0x00004096
0x0c48: 0x005a0001
0x0c4c: 0x001e0001
0x0c50: 0x00000001
0x0c54: 0x000f0000
0x0c58: 0x2001030f
0x0c5c: 0x1f1f0001
0x0c60: 0x18090e40
0x0c64: 0x00000000
*
0x0c80: 0x21213333
0x0c84: 0x12120000
0x0c88: 0x28023d33
0x0c8c: 0x28282828
0x0c90: 0x00000000
0x0c94: 0x28292a00
0x0c98: 0x151f2020
0x0c9c: 0x202a0000
0x0ca0: 0x00000014
0x0ca4: 0x4c4c4c4c
0x0ca8: 0x200a1414
0x0cac: 0x00001ce4
0x0cb0: 0x080c0a10
0x0cb4: 0x0c000000
0x0cb8: 0x00140008
0x0cbc: 0x00000000
0x0cc0: 0x06080600
0x0cc4: 0x00000a08
0x0cc8: 0x5e4188e3
0x0ccc: 0x201f0000
0x0cd0: 0x00817eaa
0x0cd4: 0x0f0fb400
0x0cd8: 0x884010ff
0x0cdc: 0x204a0c00
0x0ce0: 0x06060400
0x0ce4: 0x00000000
*
0x0cf0: 0x00200000
0x0cf4: 0x00000000
*
0x0d00: 0x0952a810
0x0d04: 0x00050989
0x0d08: 0xffe01840
0x0d0c: 0x00529b1f
0x0d10: 0x00b80155
0x0d14: 0x0330631d
0x0d18: 0x330073bf
0x0d1c: 0x003b0608
0x0d20: 0x00004c00
0x0d24: 0xaa3360f8
0x0d28: 0x08102000
0x0d2c: 0x0008105a
0x0d30: 0xbe46c050
0x0d34: 0x00000000
0x0d38: 0x000d0081
0x0d3c: 0x000881e0
0x0d40: 0x0102cf36
*
0x0d4c: 0x0102c907
0x0d50: 0x003f3f3f
0x0d54: 0x80c00000
0x0d58: 0x8131a408
0x0d5c: 0x0060082a
0x0d60: 0x00000000
0x0d64: 0x0006a008
0x0d68: 0x88188206
0x0d6c: 0x48042400
0x0d70: 0x33402158
0x0d74: 0x80808040
0x0d78: 0x40804060
0x0d7c: 0x40181818
0x0d80: 0xc0a81760
0x0d84: 0xe0174000
0x0d88: 0x24740020
0x0d8c: 0x00080058
0x0d90: 0x75503044
0x0d94: 0x00000000
0x0d98: 0x007a7a7c
0x0d9c: 0x00ac0000
0x0da0: 0x280010ec
0x0da4: 0x00282828
0x0da8: 0x7a767a76
0x0dac: 0x000060f6
0x0db0: 0x22240000
0x0db4: 0x22811214
0x0db8: 0xf4fe0080
0x0dbc: 0x00003e10
0x0dc0: 0x1b880000
0x0dc4: 0xffffffff
0x0dc8: 0x600d8850
0x0dcc: 0x4017171b
0x0dd0: 0x00000002
0x0dd4: 0x008000c0
0x0dd8: 0x14000000
0x0ddc: 0x13102622
0x0de0: 0x08000000
0x0de4: 0x1c0b0550
0x0de8: 0x18174800
0x0dec: 0x00000004
0x0df0: 0x28282820
0x0df4: 0x00000000
0x0df8: 0x00000100
*
0x0e00: 0x80000100
0x0e04: 0x00000044
0x0e08: 0x00000000
*
0x0e10: 0x723f0000
0x0e14: 0x11000511
0x0e18: 0x0209003c
0x0e1c: 0x60000000
0x0e20: 0x0d071622
0x0e24: 0xa40b0a10
0x0e28: 0x010201e0
0x0e2c: 0x00000000
0x0e30: 0x80808080
0x0e34: 0x34343434
0x0e38: 0x0000001b
0x0e3c: 0x00008f02
0x0e40: 0xff027f04
0x0e44: 0x00004096
0x0e48: 0x005a0001
0x0e4c: 0x001e0001
0x0e50: 0x00000001
0x0e54: 0x000f0000
0x0e58: 0x2001030f
0x0e5c: 0x1f1f0001
0x0e60: 0x18090e40
0x0e64: 0x00000000
*
0x0e80: 0x22223434
0x0e84: 0x12120000
0x0e88: 0x28023e34
0x0e8c: 0x28282828
0x0e90: 0x00000000
0x0e94: 0x28292a00
0x0e98: 0x151f2020
0x0e9c: 0x202a0000
0x0ea0: 0x00000014
0x0ea4: 0x4c4c4c4c
0x0ea8: 0x200a1414
0x0eac: 0x00001ce4
0x0eb0: 0x080c0a10
0x0eb4: 0x0c000000
0x0eb8: 0x00140008
0x0ebc: 0x00000000
0x0ec0: 0x06080600
0x0ec4: 0x00000a08
0x0ec8: 0x5e4188e3
0x0ecc: 0x201f0000
0x0ed0: 0x00817eaa
0x0ed4: 0x0f0fb400
0x0ed8: 0x884010ff
0x0edc: 0x204a0c00
0x0ee0: 0x06060400
0x0ee4: 0x00000000
*
0x0ef0: 0x00200000
0x0ef4: 0x00000000
*
0x0f00: 0x0952a810
0x0f04: 0x00050989
0x0f08: 0xffe01840
0x0f0c: 0x00529b1f
0x0f10: 0x00be0155
0x0f14: 0x0330631f
0x0f18: 0x340074bf
0x0f1c: 0x003b0608
0x0f20: 0x00004c00
0x0f24: 0xaa3360f8
0x0f28: 0x08102000
0x0f2c: 0x0008105a
0x0f30: 0xbe46c050
0x0f34: 0x00000000
0x0f38: 0x000d0087
0x0f3c: 0x002085e0
0x0f40: 0x0102cf36
*
0x0f4c: 0x0102c907
0x0f50: 0x003f3f3f
0x0f54: 0x80c00000
0x0f58: 0x8131a408
0x0f5c: 0x0060082a
0x0f60: 0x00000000
0x0f64: 0x0006a008
0x0f68: 0x88188206
0x0f6c: 0x48042400
0x0f70: 0x33402158
0x0f74: 0x80808040
0x0f78: 0x40804060
0x0f7c: 0x40181818
0x0f80: 0xc0a81760
0x0f84: 0xe0174000
0x0f88: 0x24740020
0x0f8c: 0x00080058
0x0f90: 0x75503044
0x0f94: 0x00000000
0x0f98: 0x767c7e7c
0x0f9c: 0x00ac0000
0x0fa0: 0x280010ec
0x0fa4: 0x00282828
0x0fa8: 0x7e007e7a
0x0fac: 0x000060f6
0x0fb0: 0x22220000
0x0fb4: 0x22811420
0x0fb8: 0xfefefe80
0x0fbc: 0x00003c02
0x0fc0: 0x1b880000
0x0fc4: 0xffffffff
0x0fc8: 0x600d8850
0x0fcc: 0x4017171b
0x0fd0: 0x0000003e
0x0fd4: 0x008000c0
0x0fd8: 0x18000000
0x0fdc: 0x33142416
0x0fe0: 0x08000000
0x0fe4: 0x1c0b0550
0x0fe8: 0x18174800
0x0fec: 0x00000004
0x0ff0: 0x28282820
0x0ff4: 0x00000000
0x0ff8: 0x00000100
*
0x1000: 0xffffffff
*
0x8000: 0x00130034
0x8004: 0x200000e0
0x8008: 0x00000001
0x800c: 0xc4c40000
0x8010: 0x80008000
0x8014: 0x000280c4
0x8018: 0x21000001
0x801c: 0x00000000
0x8020: 0x052583e8
0x8024: 0x00000000
0x8028: 0x05000000
0x802c: 0x00000000
0x8030: 0x00300401
0x8034: 0x00000000
0x8038: 0x00001fff
0x803c: 0x00000006
0x8040: 0xffffffff
*
0x8070: 0xfd730000
0x8074: 0x00000000
*
0x8080: 0x003a3a00
0x8084: 0x00000500
0x8088: 0x00040040
0x808c: 0x00000000
0x8090: 0x25000300
0x8094: 0x00008000
0x8098: 0x00000000
0x809c: 0x80000080
0x80a0: 0x8670cc16
0x80a4: 0xc1382e05
0x80a8: 0x3c460880
0x80ac: 0x050f8240
0x80b0: 0x01c29044
0x80b4: 0x4050a015
0x80b8: 0xb00c1903
0x80bc: 0x000004c0
0x80c0: 0x00202000
0x80c4: 0x40000000
0x80c8: 0x00000000
*
0x80d0: 0x00001f70
0x80d4: 0x00000000
*
0x80dc: 0x00002000
0x80e0: 0x00000000
0x80e4: 0x00000500
0x80e8: 0x00403f7f
0x80ec: 0x40788007
0x80f0: 0x00403f7f
0x80f4: 0x00788007
0x80f8: 0x0c00d4ac
0x80fc: 0x000c0000
0x8100: 0x0000001e
0x8104: 0x00000000
*
0x8110: 0x0a020904
0x8114: 0x00000000
*
0x8120: 0x00000200
0x8124: 0x00000202
0x8128: 0x001f0006
0x812c: 0x0000030b
0x8130: 0x78003c00
0x8134: 0x00000000
*
0x815c: 0x0000001e
0x8160: 0x00000000
*
0x8168: 0x01ff0000
0x816c: 0x00000000
0x8170: 0x01400000
0x8174: 0x1928bc1b
0x8178: 0x00000000
0x817c: 0x2d08090a
0x8180: 0x0000001e
0x8184: 0x00000000
*
0x8190: 0x0a020904
0x8194: 0x00000000
*
0x81a0: 0x00000200
0x81a4: 0x00000202
0x81a8: 0x001f0006
0x81ac: 0x0000030b
0x81b0: 0x78003c00
0x81b4: 0x00000000
*
0x81dc: 0x0000001e
0x81e0: 0x00000000
*
0x81e8: 0x01ff0000
0x81ec: 0x00000000
0x81f0: 0x01400000
0x81f4: 0x1928bc1b
0x81f8: 0x00000000
0x81fc: 0x2d08090a
0x8200: 0xffffffff
*
CPU: ID 0x906e9, Processor Type 0x0, Family 0x6, Model 0x9e, Stepping 0x9
Northbridge: 8086:5918 (7th generation (Kaby Lake family) Core Processor Xeon E3-1200)
Southbridge: 8086:a149 (C236)
Trying to reveal Primary to Sideband Bridge (P2SB),
let's hope the OS doesn't mind... done.
SBREG_BAR = 0xfd000000 (MEM)

Hiding Primary to Sideband Bridge (P2SB).

========== PCR 0xa9 ==========

PCR port offset: 0xa90000

0x0000: 0x00000100
0x0004: 0x00000044
0x0008: 0x00000000
*
0x0010: 0x723f0000
0x0014: 0x11000511
0x0018: 0x0209003c
0x001c: 0x60000000
0x0020: 0x0d071622
0x0024: 0xa40b0a10
0x0028: 0x010201e0
0x002c: 0x00000000
0x0030: 0x80808080
0x0034: 0x2f2f2f2f
0x0038: 0x00000026
0x003c: 0x00008f02
0x0040: 0xff027f04
0x0044: 0x00004096
0x0048: 0x005a0001
0x004c: 0x001e0001
0x0050: 0x00000001
0x0054: 0x000f0000
0x0058: 0x2001030f
0x005c: 0x1f1f0001
0x0060: 0x18090e40
0x0064: 0x00000000
*
0x0080: 0x141d262f
0x0084: 0x1b120900
0x0088: 0x283f382f
0x008c: 0x28282828
0x0090: 0x00000000
0x0094: 0x28292a00
0x0098: 0x151f2020
0x009c: 0x202a0000
0x00a0: 0x00000014
0x00a4: 0x4c4c4c4c
0x00a8: 0x200a1414
0x00ac: 0x000016e4
0x00b0: 0x080c0a10
0x00b4: 0x0c000000
0x00b8: 0x00140008
0x00bc: 0x00000000
0x00c0: 0x06080600
0x00c4: 0x00000a08
0x00c8: 0x5e4188e3
0x00cc: 0x201f0000
0x00d0: 0x00817eaa
0x00d4: 0x0f0fb400
0x00d8: 0x88410dff
0x00dc: 0x204a0c00
0x00e0: 0x06060400
0x00e4: 0x00000000
*
0x00f0: 0x00200000
0x00f4: 0x00000000
*
0x0100: 0x0952a810
0x0104: 0x00050989
0x0108: 0xffe01840
0x010c: 0x00529b1f
0x0110: 0x00c80155
0x0114: 0x03306321
0x0118: 0x2f006fbf
0x011c: 0x003b0608
0x0120: 0x00004c00
0x0124: 0xaa3360f8
0x0128: 0x080d210b
0x012c: 0x0008105a
0x0130: 0xbfccc050
0x0134: 0x00000000
0x0138: 0x000d0084
0x013c: 0x20000de0
0x0140: 0x0102cf36
*
0x014c: 0x0102c907
0x0150: 0x003f3f3f
0x0154: 0x80c00000
0x0158: 0x8131a408
0x015c: 0x00600c2a
0x0160: 0x00000000
0x0164: 0x3c08a008
0x0168: 0x88188206
0x016c: 0x48042400
0x0170: 0x33402158
0x0174: 0x80808040
0x0178: 0x40804060
0x017c: 0x40181818
0x0180: 0xc0a81760
0x0184: 0xe0174000
0x0188: 0x24740020
0x018c: 0x00080058
0x0190: 0x75503044
0x0194: 0x00000000
0x0198: 0x787a747e
0x019c: 0x00ac0000
0x01a0: 0x28000cec
0x01a4: 0x7e282828
0x01a8: 0x747c747c
0x01ac: 0x000060f6
0x01b0: 0x6e6e0000
0x01b4: 0x22816a6c
0x01b8: 0xc2fafc80
0x01bc: 0x0000363e
0x01c0: 0x1b880000
0x01c4: 0xffffffff
0x01c8: 0x600d8850
0x01cc: 0x4017171b
0x01d0: 0x0000003c
0x01d4: 0x008000c0
0x01d8: 0x00000000
0x01dc: 0x33007f7f
0x01e0: 0x08000000
0x01e4: 0x1c0b0550
0x01e8: 0x18174800
0x01ec: 0x00000004
0x01f0: 0x28282820
0x01f4: 0x00000000
0x01f8: 0x00000100
*
0x0204: 0x00000044
0x0208: 0x00000000
*
0x0210: 0x723f0000
0x0214: 0x11000511
0x0218: 0x0209003c
0x021c: 0x60000000
0x0220: 0x0d071622
0x0224: 0xa40b0a10
0x0228: 0x010201e0
0x022c: 0x00000000
0x0230: 0x80808080
0x0234: 0x30303030
0x0238: 0x00000027
0x023c: 0x00008f02
0x0240: 0xff027f04
0x0244: 0x00004096
0x0248: 0x005a0001
0x024c: 0x001e0001
0x0250: 0x00000001
0x0254: 0x000f0000
0x0258: 0x2001030f
0x025c: 0x1f1f0001
0x0260: 0x18090e40
0x0264: 0x00000000
*
0x0280: 0x141e2730
0x0284: 0x1c120900
0x0288: 0x283f3930
0x028c: 0x28282828
0x0290: 0x00000000
0x0294: 0x28292a00
0x0298: 0x151f2020
0x029c: 0x202a0000
0x02a0: 0x00000014
0x02a4: 0x4c4c4c4c
0x02a8: 0x200a1414
0x02ac: 0x000016e4
0x02b0: 0x080c0a10
0x02b4: 0x0c000000
0x02b8: 0x00140008
0x02bc: 0x00000000
0x02c0: 0x06080600
0x02c4: 0x00000a08
0x02c8: 0x5e4188e3
0x02cc: 0x201f0000
0x02d0: 0x00817eaa
0x02d4: 0x0f0fb400
0x02d8: 0x88470cff
0x02dc: 0x204a0c00
0x02e0: 0x06060400
0x02e4: 0x00000000
*
0x02f0: 0x00200000
0x02f4: 0x00000000
*
0x0300: 0x0952a810
0x0304: 0x00050989
0x0308: 0xffe01840
0x030c: 0x00529b1f
0x0310: 0x00c20155
0x0314: 0x0330631b
0x0318: 0x300070bf
0x031c: 0x003b0008
0x0320: 0x00004c00
0x0324: 0xaa3360f8
0x0328: 0x080e2009
0x032c: 0x0008105a
0x0330: 0xbfcec050
0x0334: 0x00000000
0x0338: 0x000d0054
0x033c: 0x200047e0
0x0340: 0x0102cf36
*
0x034c: 0x0102c907
0x0350: 0x003f3f3f
0x0354: 0x80c00000
0x0358: 0x8131a408
0x035c: 0x00600a2a
0x0360: 0x00000000
0x0364: 0x0008a008
0x0368: 0x88188206
0x036c: 0x48042400
0x0370: 0x33402158
0x0374: 0x80808040
0x0378: 0x40804060
0x037c: 0x40181818
0x0380: 0xc0a81760
0x0384: 0xe0174000
0x0388: 0x24740020
0x038c: 0x00080058
0x0390: 0x75503044
0x0394: 0x00000000
0x0398: 0x7a787c7a
0x039c: 0x00ac0000
0x03a0: 0x28000aec
0x03a4: 0x7e282828
0x03a8: 0x007e007e
0x03ac: 0x000060f6
0x03b0: 0x66660000
0x03b4: 0x22815c66
0x03b8: 0x3efafc80
0x03bc: 0x00003c3e
0x03c0: 0x1b880000
0x03c4: 0xffffffff
0x03c8: 0x600d8850
0x03cc: 0x4017171b
0x03d0: 0x00000002
0x03d4: 0x008000c0
0x03d8: 0x7f000000
0x03dc: 0x13007f00
0x03e0: 0x08000000
0x03e4: 0x1c0b0550
0x03e8: 0x18174800
0x03ec: 0x00000004
0x03f0: 0x28282820
0x03f4: 0x00000000
0x03f8: 0x00000100
*
0x0404: 0x00000044
0x0408: 0x00000000
*
0x0410: 0x723f0000
0x0414: 0x11000511
0x0418: 0x0209003c
0x041c: 0x60000000
0x0420: 0x0d071622
0x0424: 0xa40b0a10
0x0428: 0x010201e0
0x042c: 0x00000000
0x0430: 0x80808080
0x0434: 0x30303030
0x0438: 0x00000027
0x043c: 0x00008f02
0x0440: 0xff027f04
0x0444: 0x00004096
0x0448: 0x005a0001
0x044c: 0x001e0001
0x0450: 0x00000001
0x0454: 0x000f0000
0x0458: 0x2001030f
0x045c: 0x1f1f0001
0x0460: 0x18090e40
0x0464: 0x00000000
*
0x0480: 0x141e2730
0x0484: 0x1c120900
0x0488: 0x283f3930
0x048c: 0x28282828
0x0490: 0x00000000
0x0494: 0x28292a00
0x0498: 0x151f2020
0x049c: 0x202a0000
0x04a0: 0x00000014
0x04a4: 0x4c4c4c4c
0x04a8: 0x200a1414
0x04ac: 0x000016e4
0x04b0: 0x080c0a10
0x04b4: 0x0c000000
0x04b8: 0x00140008
0x04bc: 0x00000000
0x04c0: 0x06080600
0x04c4: 0x00000a08
0x04c8: 0x5e4188e3
0x04cc: 0x201f0000
0x04d0: 0x00817eaa
0x04d4: 0x0f0fb400
0x04d8: 0x884b0dff
0x04dc: 0x204a0c00
0x04e0: 0x06060400
0x04e4: 0x00000000
*
0x04f0: 0x00200000
0x04f4: 0x00000000
*
0x0500: 0x0952a810
0x0504: 0x00050989
0x0508: 0xffe01840
0x050c: 0x00529b1f
0x0510: 0x00c80155
0x0514: 0x0330631d
0x0518: 0x300070bf
0x051c: 0x003b0008
0x0520: 0x00004c00
0x0524: 0xaa3360f8
0x0528: 0x080e1f0b
0x052c: 0x0008105a
0x0530: 0xbfcec050
0x0534: 0x00000000
0x0538: 0x000d00db
0x053c: 0x200093e0
0x0540: 0x0102cf36
*
0x054c: 0x0102c907
0x0550: 0x003f3f3f
0x0554: 0x80c00000
0x0558: 0x8131a408
0x055c: 0x00600b2a
0x0560: 0x00000000
0x0564: 0x3b08a008
0x0568: 0x88188206
0x056c: 0x48042400
0x0570: 0x33402158
0x0574: 0x80808040
0x0578: 0x40804060
0x057c: 0x40181818
0x0580: 0xc0a81760
0x0584: 0xe0174000
0x0588: 0x24740020
0x058c: 0x00080058
0x0590: 0x75503044
0x0594: 0x00000000
0x0598: 0x7274727c
0x059c: 0x00ac0000
0x05a0: 0x28000cec
0x05a4: 0x7a282828
0x05a8: 0x7a787a7e
0x05ac: 0x000060f6
0x05b0: 0x68660000
0x05b4: 0x22815a5c
0x05b8: 0xc2f8fe80
0x05bc: 0x0000003e
0x05c0: 0x1b880000
0x05c4: 0xffffffff
0x05c8: 0x600d8850
0x05cc: 0x4017171b
0x05d0: 0x0000003e
0x05d4: 0x008000c0
0x05d8: 0x00000000
0x05dc: 0x33007f7f
0x05e0: 0x08000000
0x05e4: 0x1c0b0550
0x05e8: 0x18174800
0x05ec: 0x00000004
0x05f0: 0x28282820
0x05f4: 0x00000000
0x05f8: 0x00000100
*
0x0604: 0x00000044
0x0608: 0x00000000
*
0x0610: 0x723f0000
0x0614: 0x11000511
0x0618: 0x0209003c
0x061c: 0x60000000
0x0620: 0x0d071622
0x0624: 0xa40b0a10
0x0628: 0x010201e0
0x062c: 0x00000000
0x0630: 0x80808080
0x0634: 0x30303030
0x0638: 0x00000027
0x063c: 0x00008f02
0x0640: 0xff027f04
0x0644: 0x00004096
0x0648: 0x005a0001
0x064c: 0x001e0001
0x0650: 0x00000001
0x0654: 0x000f0000
0x0658: 0x2001030f
0x065c: 0x1f1f0001
0x0660: 0x18090e40
0x0664: 0x00000000
*
0x0680: 0x141e2730
0x0684: 0x1c120900
0x0688: 0x283f3930
0x068c: 0x28282828
0x0690: 0x00000000
0x0694: 0x28292a00
0x0698: 0x151f2020
0x069c: 0x202a0000
0x06a0: 0x00000014
0x06a4: 0x4c4c4c4c
0x06a8: 0x200a1414
0x06ac: 0x000016e4
0x06b0: 0x080c0a10
0x06b4: 0x0c000000
0x06b8: 0x00140008
0x06bc: 0x00000000
0x06c0: 0x06080600
0x06c4: 0x00000a08
0x06c8: 0x5e4188e3
0x06cc: 0x201f0000
0x06d0: 0x00817eaa
0x06d4: 0x0f0fb400
0x06d8: 0x88410cff
0x06dc: 0x204a0c00
0x06e0: 0x06060400
0x06e4: 0x00000000
*
0x06f0: 0x00200000
0x06f4: 0x00000000
*
0x0700: 0x0952a810
0x0704: 0x00050989
0x0708: 0xffe01840
0x070c: 0x00529b1f
0x0710: 0x00c40155
0x0714: 0x0330631b
0x0718: 0x300070bf
0x071c: 0x003b0108
0x0720: 0x00004c00
0x0724: 0xaa3360f8
0x0728: 0x080d2205
0x072c: 0x0008105a
0x0730: 0xbfcec050
0x0734: 0x00000000
0x0738: 0x000d0049
0x073c: 0x20004fe0
0x0740: 0x0102cf36
*
0x074c: 0x0102c907
0x0750: 0x003f3f3f
0x0754: 0x80c00000
0x0758: 0x8131a408
0x075c: 0x00600b2a
0x0760: 0x00000000
0x0764: 0x0008a008
0x0768: 0x88188206
0x076c: 0x48042400
0x0770: 0x33402158
0x0774: 0x80808040
0x0778: 0x40804060
0x077c: 0x40181818
0x0780: 0xc0a81760
0x0784: 0xe0174000
0x0788: 0x24740020
0x078c: 0x00080058
0x0790: 0x75503044
0x0794: 0x00000000
0x0798: 0x767e747e
0x079c: 0x00ac0000
0x07a0: 0x28000aec
0x07a4: 0x7e282828
0x07a8: 0x7e727e7e
0x07ac: 0x000060f6
0x07b0: 0x6a6a0000
0x07b4: 0x22816468
0x07b8: 0xc200fe80
0x07bc: 0x00003c3e
0x07c0: 0x1b880000
0x07c4: 0xffffffff
0x07c8: 0x600d8850
0x07cc: 0x4017171b
0x07d0: 0x00000002
0x07d4: 0x008000c0
0x07d8: 0x00000000
0x07dc: 0x33007f7f
0x07e0: 0x08000000
0x07e4: 0x1c0b0550
0x07e8: 0x18174800
0x07ec: 0x00000004
0x07f0: 0x28282820
0x07f4: 0x00000000
0x07f8: 0x00000100
*
0x0800: 0x80000100
0x0804: 0x00000044
0x0808: 0x00000000
*
0x0810: 0x723f0000
0x0814: 0x11000511
0x0818: 0x0209003c
0x081c: 0x60000000
0x0820: 0x0d071622
0x0824: 0xa40b0a10
0x0828: 0x010201e0
0x082c: 0x00000000
0x0830: 0x80808080
0x0834: 0x30303030
0x0838: 0x00000017
0x083c: 0x00008f02
0x0840: 0xff027f04
0x0844: 0x00004096
0x0848: 0x005a0001
0x084c: 0x001e0001
0x0850: 0x00000001
0x0854: 0x000f0000
0x0858: 0x2001030f
0x085c: 0x1f1f0001
0x0860: 0x18090e40
0x0864: 0x00000000
*
0x0880: 0x18183030
0x0884: 0x18180000
0x0888: 0x28003930
0x088c: 0x28282828
0x0890: 0x00000000
0x0894: 0x28292a00
0x0898: 0x151f2020
0x089c: 0x202a0000
0x08a0: 0x00000014
0x08a4: 0x4c4c4c4c
0x08a8: 0x200a1414
0x08ac: 0x000016e4
0x08b0: 0x080c0a10
0x08b4: 0x0c000000
0x08b8: 0x00140008
0x08bc: 0x00000000
0x08c0: 0x06080600
0x08c4: 0x00000a08
0x08c8: 0x5e4188e3
0x08cc: 0x201f0000
0x08d0: 0x00817eaa
0x08d4: 0x0f0fb400
0x08d8: 0x883d0cff
0x08dc: 0x287a0c00
0x08e0: 0x06060400
0x08e4: 0x00000000
*
0x08f0: 0x00200000
0x08f4: 0x00000000
*
0x0900: 0x0952a810
0x0904: 0x00050989
0x0908: 0xffe01840
0x090c: 0x00529b1f
0x0910: 0x00b40155
0x0914: 0x0330631f
0x0918: 0x300070bf
0x091c: 0x003b0808
0x0920: 0x00004c00
0x0924: 0xaa3360f8
0x0928: 0x08102000
0x092c: 0x0008105a
0x0930: 0xbe46c050
0x0934: 0x00000000
0x0938: 0x000d0097
0x093c: 0x000099e0
0x0940: 0x0102cf36
*
0x094c: 0x0102c907
0x0950: 0x003f3f3f
0x0954: 0x80c00000
0x0958: 0x8131a408
0x095c: 0x0060082a
0x0960: 0x00000000
0x0964: 0x0008a008
0x0968: 0x88188206
0x096c: 0x48042400
0x0970: 0x33402158
0x0974: 0x80808040
0x0978: 0x40804060
0x097c: 0x40181818
0x0980: 0xc0a81760
0x0984: 0xe0174000
0x0988: 0x24740020
0x098c: 0x00080058
0x0990: 0x75503044
0x0994: 0x00000000
0x0998: 0x787a7872
0x099c: 0x00ac0000
0x09a0: 0x280010ec
0x09a4: 0x00282828
0x09a8: 0x7e727e74
0x09ac: 0x000060f6
0x09b0: 0x22240000
0x09b4: 0x22811216
0x09b8: 0xf800f880
0x09bc: 0x00003c04
0x09c0: 0x1b880000
0x09c4: 0xffffffff
0x09c8: 0x600d8850
0x09cc: 0x4017171b
0x09d0: 0x00000002
0x09d4: 0x008000c0
0x09d8: 0x26000000
0x09dc: 0x03223424
0x09e0: 0x08000000
0x09e4: 0x1c0b0550
0x09e8: 0x18174800
0x09ec: 0x00000004
0x09f0: 0x28282820
0x09f4: 0x00000000
0x09f8: 0x00000100
*
0x0a00: 0x80000100
0x0a04: 0x00000044
0x0a08: 0x00000000
*
0x0a10: 0x723f0000
0x0a14: 0x11000511
0x0a18: 0x0209003c
0x0a1c: 0x60000000
0x0a20: 0x0d071622
0x0a24: 0xa40b0a10
0x0a28: 0x010201e0
0x0a2c: 0x00000000
0x0a30: 0x80808080
0x0a34: 0x31313131
0x0a38: 0x00000018
0x0a3c: 0x00008f02
0x0a40: 0xff027f04
0x0a44: 0x00004096
0x0a48: 0x005a0001
0x0a4c: 0x001e0001
0x0a50: 0x00000001
0x0a54: 0x000f0000
0x0a58: 0x2001030f
0x0a5c: 0x1f1f0001
0x0a60: 0x18090e40
0x0a64: 0x00000000
*
0x0a80: 0x19193131
0x0a84: 0x18180000
0x0a88: 0x28003a31
0x0a8c: 0x28282828
0x0a90: 0x00000000
0x0a94: 0x28292a00
0x0a98: 0x151f2020
0x0a9c: 0x202a0000
0x0aa0: 0x00000014
0x0aa4: 0x4c4c4c4c
0x0aa8: 0x200a1414
0x0aac: 0x000016e4
0x0ab0: 0x080c0a10
0x0ab4: 0x0c000000
0x0ab8: 0x00140008
0x0abc: 0x00000000
0x0ac0: 0x06080600
0x0ac4: 0x00000a08
0x0ac8: 0x5e4188e3
0x0acc: 0x201f0000
0x0ad0: 0x00817eaa
0x0ad4: 0x0f0fb400
0x0ad8: 0x88410cff
0x0adc: 0x287a0c00
0x0ae0: 0x06060400
0x0ae4: 0x00000000
*
0x0af0: 0x00200000
0x0af4: 0x00000000
*
0x0b00: 0x0952a810
0x0b04: 0x00050989
0x0b08: 0xffe01840
0x0b0c: 0x00529b1f
0x0b10: 0x00be0155
0x0b14: 0x03306317
0x0b18: 0x310071bf
0x0b1c: 0x003b0208
0x0b20: 0x00004c00
0x0b24: 0xaa3360f8
0x0b28: 0x08102000
0x0b2c: 0x0008105a
0x0b30: 0xbe46c050
0x0b34: 0x00000000
0x0b38: 0x000d00c9
0x0b3c: 0x0000cbe0
0x0b40: 0x0102cf36
*
0x0b4c: 0x0102c907
0x0b50: 0x003f3f3f
0x0b54: 0x80c00000
0x0b58: 0x8131a408
0x0b5c: 0x0060082a
0x0b60: 0x00000000
0x0b64: 0x0008a008
0x0b68: 0x88188206
0x0b6c: 0x48042400
0x0b70: 0x33402158
0x0b74: 0x80808040
0x0b78: 0x40804060
0x0b7c: 0x40181818
0x0b80: 0xc0a81760
0x0b84: 0xe0174000
0x0b88: 0x24740020
0x0b8c: 0x00080058
0x0b90: 0x75503044
0x0b94: 0x00000000
0x0b98: 0x7800767a
0x0b9c: 0x00ac0000
0x0ba0: 0x280010ec
0x0ba4: 0x00282828
0x0ba8: 0x007e0076
0x0bac: 0x000060f6
0x0bb0: 0x22320000
0x0bb4: 0x22812214
0x0bb8: 0xf400fe80
0x0bbc: 0x00000002
0x0bc0: 0x1b880000
0x0bc4: 0xffffffff
0x0bc8: 0x600d8850
0x0bcc: 0x4017171b
0x0bd0: 0x00000000
0x0bd4: 0x008000c0
0x0bd8: 0x24000000
0x0bdc: 0x13203426
0x0be0: 0x08000000
0x0be4: 0x1c0b0550
0x0be8: 0x18174800
0x0bec: 0x00000004
0x0bf0: 0x28282820
0x0bf4: 0x00000000
0x0bf8: 0x00000100
*
0x0c00: 0x80000100
0x0c04: 0x00000044
0x0c08: 0x00000000
*
0x0c10: 0x723f0000
0x0c14: 0x11000511
0x0c18: 0x0209003c
0x0c1c: 0x60000000
0x0c20: 0x0d071622
0x0c24: 0xa40b0a10
0x0c28: 0x010201e0
0x0c2c: 0x00000000
0x0c30: 0x80808080
0x0c34: 0x31313131
0x0c38: 0x00000018
0x0c3c: 0x00008f02
0x0c40: 0xff027f04
0x0c44: 0x00004096
0x0c48: 0x005a0001
0x0c4c: 0x001e0001
0x0c50: 0x00000001
0x0c54: 0x000f0000
0x0c58: 0x2001030f
0x0c5c: 0x1f1f0001
0x0c60: 0x18090e40
0x0c64: 0x00000000
*
0x0c80: 0x19193131
0x0c84: 0x18180000
0x0c88: 0x28003a31
0x0c8c: 0x28282828
0x0c90: 0x00000000
0x0c94: 0x28292a00
0x0c98: 0x151f2020
0x0c9c: 0x202a0000
0x0ca0: 0x00000014
0x0ca4: 0x4c4c4c4c
0x0ca8: 0x200a1414
0x0cac: 0x000016e4
0x0cb0: 0x080c0a10
0x0cb4: 0x0c000000
0x0cb8: 0x00140008
0x0cbc: 0x00000000
0x0cc0: 0x06080600
0x0cc4: 0x00000a08
0x0cc8: 0x5e4188e3
0x0ccc: 0x201f0000
0x0cd0: 0x00817eaa
0x0cd4: 0x0f0fb400
0x0cd8: 0x88410eff
0x0cdc: 0x287a0c00
0x0ce0: 0x06060400
0x0ce4: 0x00000000
*
0x0cf0: 0x00200000
0x0cf4: 0x00000000
*
0x0d00: 0x0952a810
0x0d04: 0x00050989
0x0d08: 0xffe01840
0x0d0c: 0x00529b1f
0x0d10: 0x00bc0155
0x0d14: 0x0330631b
0x0d18: 0x310071bf
0x0d1c: 0x003b0208
0x0d20: 0x00004c00
0x0d24: 0xaa3360f8
0x0d28: 0x08102000
0x0d2c: 0x0008105a
0x0d30: 0xbe46c050
0x0d34: 0x00000000
0x0d38: 0x000d004b
0x0d3c: 0x000043e0
0x0d40: 0x0102cf36
*
0x0d4c: 0x0102c907
0x0d50: 0x003f3f3f
0x0d54: 0x80c00000
0x0d58: 0x8131a408
0x0d5c: 0x0060082a
0x0d60: 0x00000000
0x0d64: 0x0008a008
0x0d68: 0x88188206
0x0d6c: 0x48042400
0x0d70: 0x33402158
0x0d74: 0x80808040
0x0d78: 0x40804060
0x0d7c: 0x40181818
0x0d80: 0xc0a81760
0x0d84: 0xe0174000
0x0d88: 0x24740020
0x0d8c: 0x00080058
0x0d90: 0x75503044
0x0d94: 0x00000000
0x0d98: 0x767a7c7e
0x0d9c: 0x00ac0000
0x0da0: 0x280010ec
0x0da4: 0x00282828
0x0da8: 0x7c707c7e
0x0dac: 0x000060f6
0x0db0: 0x32260000
0x0db4: 0x22811824
0x0db8: 0xfcfefe80
0x0dbc: 0x00000004
0x0dc0: 0x1b880000
0x0dc4: 0xffffffff
0x0dc8: 0x600d8850
0x0dcc: 0x4017171b
0x0dd0: 0x0000003c
0x0dd4: 0x008000c0
0x0dd8: 0x24000000
0x0ddc: 0x13223632
0x0de0: 0x08000000
0x0de4: 0x1c0b0550
0x0de8: 0x18174800
0x0dec: 0x00000004
0x0df0: 0x28282820
0x0df4: 0x00000000
0x0df8: 0x00000100
*
0x0e00: 0x80000100
0x0e04: 0x00000044
0x0e08: 0x00000000
*
0x0e10: 0x723f0000
0x0e14: 0x11000511
0x0e18: 0x0209003c
0x0e1c: 0x60000000
0x0e20: 0x0d071622
0x0e24: 0xa40b0a10
0x0e28: 0x010201e0
0x0e2c: 0x00000000
0x0e30: 0x80808080
0x0e34: 0x31313131
0x0e38: 0x00000018
0x0e3c: 0x00008f02
0x0e40: 0xff027f04
0x0e44: 0x00004096
0x0e48: 0x005a0001
0x0e4c: 0x001e0001
0x0e50: 0x00000001
0x0e54: 0x000f0000
0x0e58: 0x2001030f
0x0e5c: 0x1f1f0001
0x0e60: 0x18090e40
0x0e64: 0x00000000
*
0x0e80: 0x19193131
0x0e84: 0x18180000
0x0e88: 0x28003a31
0x0e8c: 0x28282828
0x0e90: 0x00000000
0x0e94: 0x28292a00
0x0e98: 0x151f2020
0x0e9c: 0x202a0000
0x0ea0: 0x00000014
0x0ea4: 0x4c4c4c4c
0x0ea8: 0x200a1414
0x0eac: 0x000016e4
0x0eb0: 0x080c0a10
0x0eb4: 0x0c000000
0x0eb8: 0x00140008
0x0ebc: 0x00000000
0x0ec0: 0x06080600
0x0ec4: 0x00000a08
0x0ec8: 0x5e4188e3
0x0ecc: 0x201f0000
0x0ed0: 0x00817eaa
0x0ed4: 0x0f0fb400
0x0ed8: 0x884110ff
0x0edc: 0x287a0c00
0x0ee0: 0x06060400
0x0ee4: 0x00000000
*
0x0ef0: 0x00200000
0x0ef4: 0x00000000
*
0x0f00: 0x0952a810
0x0f04: 0x00050989
0x0f08: 0xffe01840
0x0f0c: 0x00529b1f
0x0f10: 0x00b80155
0x0f14: 0x0330631b
0x0f18: 0x310071bf
0x0f1c: 0x003b0008
0x0f20: 0x00004c00
0x0f24: 0xaa3360f8
0x0f28: 0x08102000
0x0f2c: 0x0008105a
0x0f30: 0xbe46c050
0x0f34: 0x00000000
0x0f38: 0x000d00c7
0x0f3c: 0x0000cde0
0x0f40: 0x0102cf36
*
0x0f4c: 0x0102c907
0x0f50: 0x003f3f3f
0x0f54: 0x80c00000
0x0f58: 0x8131a408
0x0f5c: 0x0060082a
0x0f60: 0x00000000
0x0f64: 0x0008a008
0x0f68: 0x88188206
0x0f6c: 0x48042400
0x0f70: 0x33402158
0x0f74: 0x80808040
0x0f78: 0x40804060
0x0f7c: 0x40181818
0x0f80: 0xc0a81760
0x0f84: 0xe0174000
0x0f88: 0x24740020
0x0f8c: 0x00080058
0x0f90: 0x75503044
0x0f94: 0x00000000
0x0f98: 0x747e7878
0x0f9c: 0x00ac0000
0x0fa0: 0x280010ec
0x0fa4: 0x00282828
0x0fa8: 0x767a7678
0x0fac: 0x000060f6
0x0fb0: 0x32320000
0x0fb4: 0x22812222
0x0fb8: 0xf200fc80
0x0fbc: 0x00003e00
0x0fc0: 0x1b880000
0x0fc4: 0xffffffff
0x0fc8: 0x600d8850
0x0fcc: 0x4017171b
0x0fd0: 0x00000002
0x0fd4: 0x008000c0
0x0fd8: 0x22000000
0x0fdc: 0x13163224
0x0fe0: 0x08000000
0x0fe4: 0x1c0b0550
0x0fe8: 0x18174800
0x0fec: 0x00000004
0x0ff0: 0x28282820
0x0ff4: 0x00000000
0x0ff8: 0x00000100
*
0x1000: 0xffffffff
*
0x8000: 0x00130040
0x8004: 0x200000c0
0x8008: 0x00000001
0x800c: 0xbcbc0000
0x8010: 0x80008000
0x8014: 0x000280bc
0x8018: 0x21000001
0x801c: 0x00000000
0x8020: 0x052583e8
0x8024: 0x00000000
0x8028: 0x05000000
0x802c: 0x00000000
0x8030: 0x00300401
0x8034: 0x00000000
0x8038: 0x00001fff
0x803c: 0x00000006
0x8040: 0xffffffff
*
0x8070: 0xe5a70000
0x8074: 0x00000000
*
0x8080: 0x003a3a00
0x8084: 0x00000500
0x8088: 0x00060040
0x808c: 0x00000000
0x8090: 0x25000300
0x8094: 0x00008000
0x8098: 0x00000000
0x809c: 0x80000080
0x80a0: 0x8670cc16
0x80a4: 0xc1382e05
0x80a8: 0x3c460880
0x80ac: 0x050f8240
0x80b0: 0x01c29044
0x80b4: 0x4050a015
0x80b8: 0xb00c1903
0x80bc: 0x000004c0
0x80c0: 0x00202000
0x80c4: 0x40000000
0x80c8: 0x00000000
*
0x80d0: 0x00001f70
0x80d4: 0x00000000
*
0x80dc: 0x00002000
0x80e0: 0x00000000
0x80e4: 0x00000500
0x80e8: 0x00403f7f
0x80ec: 0x40788007
0x80f0: 0x00403f7f
0x80f4: 0x00788007
0x80f8: 0x0000c4c4
0x80fc: 0x00000000
0x8100: 0x00000028
0x8104: 0x00000000
*
0x8110: 0x0a010803
0x8114: 0x00000000
*
0x8120: 0x00000200
0x8124: 0x00000202
0x8128: 0x001f000a
0x812c: 0x0000030b
0x8130: 0x70000000
0x8134: 0x00000000
*
0x815c: 0x00000028
0x8160: 0x00000000
0x8164: 0x00003000
0x8168: 0x02150000
0x816c: 0x00000000
0x8170: 0x5b400800
0x8174: 0x1228a825
0x8178: 0x01f501f3
0x817c: 0x2d08096f
0x8180: 0x00000028
0x8184: 0x00000000
*
0x8190: 0x0a010803
0x8194: 0x00000000
*
0x81a0: 0x00000200
0x81a4: 0x00000202
0x81a8: 0x001f000a
0x81ac: 0x0000030b
0x81b0: 0x70000000
0x81b4: 0x00000000
*
0x81dc: 0x00000028
0x81e0: 0x00000000
0x81e4: 0x00003000
0x81e8: 0x020a0000
0x81ec: 0x00000000
0x81f0: 0x5b400800
0x81f4: 0x1228a825
0x81f8: 0x01f501f3
0x81fc: 0x2d08096f
0x8200: 0xffffffff
*
CPU: ID 0x906e9, Processor Type 0x0, Family 0x6, Model 0x9e, Stepping 0x9
Northbridge: 8086:5918 (7th generation (Kaby Lake family) Core Processor Xeon E3-1200)
Southbridge: 8086:a149 (C236)
Trying to reveal Primary to Sideband Bridge (P2SB),
let's hope the OS doesn't mind... done.
SBREG_BAR = 0xfd000000 (MEM)

Hiding Primary to Sideband Bridge (P2SB).

========== PCR 0xac ==========

PCR port offset: 0xac0000

0x0000: 0x00900000
0x0004: 0x00000000
0x0008: 0xffffffff
0x000c: 0x00000400
0x0010: 0x00043603
0x0014: 0xffffffff
0x0018: 0x00000000
*
0x00d0: 0x00000078
0x00d4: 0x00000000
*
0x01e0: 0x0000000f
0x01e4: 0x00000000
*
0x0300: 0xffffffff
*
0x0310: 0x00000000
*
0x0400: 0x84060500
0x0404: 0x0000006d
0x0408: 0x84060500
0x040c: 0x0000006e
0x0410: 0x84060500
0x0414: 0x0000006f
0x0418: 0x84060100
0x041c: 0x00000070
0x0420: 0x84000100
0x0424: 0x00000071
0x0428: 0x84000200
0x042c: 0x00000072
0x0430: 0x84000102
0x0434: 0x00001073
0x0438: 0x84000500
0x043c: 0x00000074
0x0440: 0x84000500
0x0444: 0x00001075
0x0448: 0x84000500
0x044c: 0x00000076
0x0450: 0x84000500
0x0454: 0x00001077
0x0458: 0x00000000
*
CPU: ID 0x906e9, Processor Type 0x0, Family 0x6, Model 0x9e, Stepping 0x9
Northbridge: 8086:5918 (7th generation (Kaby Lake family) Core Processor Xeon E3-1200)
Southbridge: 8086:a149 (C236)
Trying to reveal Primary to Sideband Bridge (P2SB),
let's hope the OS doesn't mind... done.
SBREG_BAR = 0xfd000000 (MEM)

Hiding Primary to Sideband Bridge (P2SB).

========== PCR 0xad ==========

PCR port offset: 0xad0000

0x0000: 0x00900000
0x0004: 0x00000000
0x0008: 0xffffffff
0x000c: 0x00000400
0x0010: 0x00043603
0x0014: 0xffffffff
0x0018: 0x00000000
*
0x00d0: 0x00000282
0x00d4: 0x00000000
*
0x0160: 0x00000004
0x0164: 0x00000000
*
0x0300: 0xffffffff
*
0x0308: 0x00000000
*
0x0400: 0x84000502
0x0404: 0x00000018
0x0408: 0x04000602
0x040c: 0x00000019
0x0410: 0x00080502
0x0414: 0x0000101a
0x0418: 0x04000502
0x041c: 0x0000301b
0x0420: 0x04000600
0x0424: 0x0000001c
0x0428: 0x04000600
0x042c: 0x0000001d
0x0430: 0x04000600
0x0434: 0x0000001e
0x0438: 0x04000200
0x043c: 0x0000001f
0x0440: 0x04000600
0x0444: 0x00000020
0x0448: 0x04000600
0x044c: 0x00000021
0x0450: 0x04000600
0x0454: 0x00000022
0x0458: 0x04000600
0x045c: 0x00000023
0x0460: 0x00000000
*
CPU: ID 0x906e9, Processor Type 0x0, Family 0x6, Model 0x9e, Stepping 0x9
Northbridge: 8086:5918 (7th generation (Kaby Lake family) Core Processor Xeon E3-1200)
Southbridge: 8086:a149 (C236)
Trying to reveal Primary to Sideband Bridge (P2SB),
let's hope the OS doesn't mind... done.
SBREG_BAR = 0xfd000000 (MEM)

Hiding Primary to Sideband Bridge (P2SB).

========== PCR 0xae ==========

PCR port offset: 0xae0000

0x0000: 0x00900000
0x0004: 0x00000200
0x0008: 0xffffffff
0x000c: 0x00000400
0x0010: 0x00043603
0x0014: 0xffffffff
0x0018: 0x00000000
*
0x0020: 0x11000000
0x0024: 0x00000000
*
0x00d0: 0x00fff624
0x00d4: 0x00fdffff
0x00d8: 0x000000df
0x00dc: 0x00f83f9f
0x00e0: 0x00f7ffff
0x00e4: 0x00ffffff
0x00e8: 0x00000000
*
0x0168: 0x00000020
0x016c: 0x000000a0
0x0170: 0x00080000
0x0174: 0x00000000
*
0x01e0: 0x00c00000
0x01e4: 0x0000001d
0x01e8: 0x000000df
0x01ec: 0x00000000
*
0x0200: 0x00010208
0x0204: 0x00000000
0x0208: 0x00020218
0x020c: 0x00000000
0x0210: 0x00080000
0x0214: 0x00000000
0x0218: 0x00030000
0x021c: 0x00000000
*
0x0224: 0x00012000
0x0228: 0x00000000
*
0x0300: 0xffffffff
*
0x03a0: 0x00000000
*
0x0400: 0x44000502
0x0404: 0x00000048
0x0408: 0x44000502
0x040c: 0x00000049
0x0410: 0x44000502
0x0414: 0x0000004a
0x0418: 0x44000502
0x041c: 0x0000004b
0x0420: 0x44000502
0x0424: 0x0000004c
0x0428: 0x84000500
0x042c: 0x0000004d
0x0430: 0xffffffff
*
0x0440: 0x84000102
0x0444: 0x00000050
0x0448: 0x84000200
0x044c: 0x00000051
0x0450: 0x84000200
0x0454: 0x00000052
0x0458: 0x84000102
0x045c: 0x00000053
0x0460: 0x84000201
0x0464: 0x00000054
0x0468: 0x84000201
0x046c: 0x00000055
0x0470: 0x84000102
0x0474: 0x00000056
0x0478: 0x84000201
0x047c: 0x00000057
0x0480: 0x84000200
0x0484: 0x00000058
0x0488: 0x84000200
0x048c: 0x00000059
0x0490: 0x84000200
0x0494: 0x0000005a
0x0498: 0x84000200
0x049c: 0x0000005b
0x04a0: 0x84000200
0x04a4: 0x0000005c
0x04a8: 0x84000200
0x04ac: 0x0000005d
0x04b0: 0x84060200
0x04b4: 0x0000005e
0x04b8: 0x84060200
0x04bc: 0x0000005f
0x04c0: 0x84060200
0x04c4: 0x00000060
0x04c8: 0x84000201
0x04cc: 0x00000061
0x04d0: 0x84060500
0x04d4: 0x00000062
0x04d8: 0x84060500
0x04dc: 0x00000063
0x04e0: 0x04060201
0x04e4: 0x00000064
0x04e8: 0x04000200
0x04ec: 0x00000065
0x04f0: 0x04000200
0x04f4: 0x00000066
0x04f8: 0x04000200
0x04fc: 0x00000067
0x0500: 0x04000200
0x0504: 0x00000068
0x0508: 0x04000200
0x050c: 0x00000069
0x0510: 0x04000200
0x0514: 0x0000006a
0x0518: 0x84000102
0x051c: 0x0000006b
0x0520: 0x84000102
0x0524: 0x0000006c
0x0528: 0x84000102
0x052c: 0x0000006d
0x0530: 0x84000102
0x0534: 0x0000006e
0x0538: 0x84000102
0x053c: 0x0000006f
0x0540: 0x84000200
0x0544: 0x00000070
0x0548: 0x84000102
0x054c: 0x00000071
0x0550: 0x84000102
0x0554: 0x00000072
0x0558: 0x84000200
0x055c: 0x00000073
0x0560: 0x84000200
0x0564: 0x00000074
0x0568: 0x84000200
0x056c: 0x00000075
0x0570: 0x84000200
0x0574: 0x00000076
0x0578: 0x84000200
0x057c: 0x00000077
0x0580: 0x84060200
0x0584: 0x00003018
0x0588: 0x84060200
0x058c: 0x00003019
0x0590: 0x84060200
0x0594: 0x0000301a
0x0598: 0x84060201
0x059c: 0x0000001b
0x05a0: 0x84060201
0x05a4: 0x0000001c
0x05a8: 0x80880102
0x05ac: 0x0000001d
0x05b0: 0x84060200
0x05b4: 0x0000001e
0x05b8: 0x84060200
0x05bc: 0x0000001f
0x05c0: 0x84000600
0x05c4: 0x00000020
0x05c8: 0x44000502
0x05cc: 0x00000021
0x05d0: 0x44000502
0x05d4: 0x00000022
0x05d8: 0x44000502
0x05dc: 0x00000023
0x05e0: 0x44000502
0x05e4: 0x00000024
0x05e8: 0x84000200
0x05ec: 0x00000025
0x05f0: 0x84000600
0x05f4: 0x00000026
0x05f8: 0x84000600
0x05fc: 0x00000027
0x0600: 0x84000200
0x0604: 0x00000028
0x0608: 0x84000200
0x060c: 0x00000029
0x0610: 0x02080500
0x0614: 0x0000002a
0x0618: 0x44000102
0x061c: 0x0000002b
0x0620: 0x42080200
0x0624: 0x0000002c
0x0628: 0x84000200
0x062c: 0x0000002d
0x0630: 0x84000102
0x0634: 0x0000002e
0x0638: 0x80100600
0x063c: 0x0000002f
0x0640: 0x84000600
0x0644: 0x00000030
0x0648: 0x80100600
0x064c: 0x00000031
0x0650: 0x80100600
0x0654: 0x00000032
0x0658: 0x40100100
0x065c: 0x00000033
0x0660: 0x44000502
0x0664: 0x00000034
0x0668: 0x44000502
0x066c: 0x00000035
0x0670: 0x44000502
0x0674: 0x00000036
0x0678: 0x84000502
0x067c: 0x00000037
0x0680: 0x84000200
0x0684: 0x00000038
0x0688: 0x84000200
0x068c: 0x00000039
0x0690: 0x84000200
0x0694: 0x0000003a
0x0698: 0x84000201
0x069c: 0x0000003b
0x06a0: 0x84000200
0x06a4: 0x0000003c
0x06a8: 0x84000100
0x06ac: 0x0000003d
0x06b0: 0x84000100
0x06b4: 0x0000003e
0x06b8: 0x84000201
0x06bc: 0x0000003f
0x06c0: 0x84000201
0x06c4: 0x00000040
0x06c8: 0x84000200
0x06cc: 0x00000041
0x06d0: 0x84000200
0x06d4: 0x00000042
0x06d8: 0x84000200
0x06dc: 0x00000043
0x06e0: 0x84000200
0x06e4: 0x00000044
0x06e8: 0x84000200
0x06ec: 0x00000045
0x06f0: 0x84000200
0x06f4: 0x00000046
0x06f8: 0x84000200
0x06fc: 0x00000047
0x0700: 0x84000201
0x0704: 0x00000048
0x0708: 0x84000100
0x070c: 0x00000049
0x0710: 0x84000100
0x0714: 0x0000004a
0x0718: 0x84000100
0x071c: 0x0000004b
0x0720: 0x84000102
0x0724: 0x0000004c
0x0728: 0x84000100
0x072c: 0x0000004d
0x0730: 0x84000102
0x0734: 0x0000004e
0x0738: 0x80100201
0x073c: 0x0000004f
0x0740: 0x84800102
0x0744: 0x00000050
0x0748: 0x84000102
0x074c: 0x00000051
0x0750: 0x84000102
0x0754: 0x00000052
0x0758: 0x84000102
0x075c: 0x00000053
0x0760: 0x84000201
0x0764: 0x00000054
0x0768: 0x84000102
0x076c: 0x00000055
0x0770: 0x04000201
0x0774: 0x00000056
0x0778: 0x84000102
0x077c: 0x00000057
0x0780: 0x84000102
0x0784: 0x00000058
0x0788: 0x84000200
0x078c: 0x00000059
0x0790: 0x84000200
0x0794: 0x0000005a
0x0798: 0x84000200
0x079c: 0x0000005b
0x07a0: 0x84000200
0x07a4: 0x0000005c
0x07a8: 0x84000200
0x07ac: 0x0000005d
0x07b0: 0x84000200
0x07b4: 0x0000005e
0x07b8: 0x84000201
0x07bc: 0x0000005f
0x07c0: 0x84000201
0x07c4: 0x00000060
0x07c8: 0x84000200
0x07cc: 0x00000061
0x07d0: 0x84000200
0x07d4: 0x00000062
0x07d8: 0x84000200
0x07dc: 0x00000063
0x07e0: 0x84000201
0x07e4: 0x00000064
0x07e8: 0x84000200
0x07ec: 0x00000065
0x07f0: 0x84000200
0x07f4: 0x00000066
0x07f8: 0x84000201
0x07fc: 0x00000067
0x0800: 0x84000200
0x0804: 0x00000068
0x0808: 0x84000200
0x080c: 0x00000069
0x0810: 0x84000200
0x0814: 0x0000006a
0x0818: 0x84000200
0x081c: 0x0000006b
0x0820: 0x84000200
0x0824: 0x0000006c
0x0828: 0x00000000
*
CPU: ID 0x906e9, Processor Type 0x0, Family 0x6, Model 0x9e, Stepping 0x9
Northbridge: 8086:5918 (7th generation (Kaby Lake family) Core Processor Xeon E3-1200)
Southbridge: 8086:a149 (C236)
Trying to reveal Primary to Sideband Bridge (P2SB),
let's hope the OS doesn't mind... done.
SBREG_BAR = 0xfd000000 (MEM)

Hiding Primary to Sideband Bridge (P2SB).

========== PCR 0xaf ==========

PCR port offset: 0xaf0000

0x0000: 0x00900000
0x0004: 0x00000000
0x0008: 0xffffffff
0x000c: 0x00000400
0x0010: 0x00043603
0x0014: 0xffffffff
0x0018: 0x00000000
*
0x00d0: 0x00fd0000
0x00d4: 0x00ff8bfb
0x00d8: 0x00000000
*
0x01e4: 0x00904000
0x01e8: 0x00000000
*
0x0300: 0xffffffff
*
0x0330: 0x00000000
*
0x0400: 0x84000502
0x0404: 0x00000018
0x0408: 0x84000402
0x040c: 0x00003019
0x0410: 0x84000402
0x0414: 0x0000301a
0x0418: 0x84000402
0x041c: 0x0000301b
0x0420: 0x84000402
0x0424: 0x0000301c
0x0428: 0x84000600
0x042c: 0x0000001d
0x0430: 0x84000402
0x0434: 0x0000001e
0x0438: 0x84000502
0x043c: 0x0000001f
0x0440: 0x84000500
0x0444: 0x00000020
0x0448: 0x84000600
0x044c: 0x00001021
0x0450: 0x84000600
0x0454: 0x00001022
0x0458: 0x84000502
0x045c: 0x00000023
0x0460: 0x84000502
0x0464: 0x00000024
0x0468: 0x44000600
0x046c: 0x00000025
0x0470: 0x44000600
0x0474: 0x00000026
0x0478: 0x44000502
0x047c: 0x00003027
0x0480: 0x44000200
0x0484: 0x00003028
0x0488: 0x84000201
0x048c: 0x00000029
0x0490: 0x84000200
0x0494: 0x0000002a
0x0498: 0x44000200
0x049c: 0x0000302b
0x04a0: 0x84000200
0x04a4: 0x0000002c
0x04a8: 0x84000100
0x04ac: 0x0000002d
0x04b0: 0x84000102
0x04b4: 0x0000002e
0x04b8: 0x84000102
0x04bc: 0x0000002f
0x04c0: 0x84000200
0x04c4: 0x00000030
0x04c8: 0x84000200
0x04cc: 0x00000031
0x04d0: 0x84000502
0x04d4: 0x00000032
0x04d8: 0x84000200
0x04dc: 0x00000033
0x04e0: 0x84000200
0x04e4: 0x00000034
0x04e8: 0x84000102
0x04ec: 0x00000035
0x04f0: 0x84000200
0x04f4: 0x00000036
0x04f8: 0x84000100
0x04fc: 0x00000037
0x0500: 0x84000102
0x0504: 0x00000038
0x0508: 0x84000500
0x050c: 0x00000039
0x0510: 0x44000702
0x0514: 0x0000003a
0x0518: 0x84000200
0x051c: 0x0000003b
0x0520: 0x44000600
0x0524: 0x0000003c
0x0528: 0x44000600
0x052c: 0x0000003d
0x0530: 0x84060600
0x0534: 0x0000103e
0x0538: 0x84000201
0x053c: 0x0000003f
0x0540: 0x84000102
0x0544: 0x00000040
0x0548: 0x84000200
0x054c: 0x00000041
0x0550: 0x84000500
0x0554: 0x00000042
0x0558: 0x84000200
0x055c: 0x00000043
0x0560: 0x84060102
0x0564: 0x00000044
0x0568: 0x84000200
0x056c: 0x00000045
0x0570: 0x84000500
0x0574: 0x00000046
0x0578: 0x84060500
0x057c: 0x00001047
0x0580: 0x00000000
*
CPU: ID 0x906e9, Processor Type 0x0, Family 0x6, Model 0x9e, Stepping 0x9
Northbridge: 8086:5918 (7th generation (Kaby Lake family) Core Processor Xeon E3-1200)
Southbridge: 8086:a149 (C236)
Trying to reveal Primary to Sideband Bridge (P2SB),
let's hope the OS doesn't mind... done.
SBREG_BAR = 0xfd000000 (MEM)

Hiding Primary to Sideband Bridge (P2SB).

========== PCR 0xb8 ==========

PCR port offset: 0xb80000

0x0000: 0xffffffff
0x0004: 0x00000001
0x0008: 0x04000018
0x000c: 0xffffffff
*
0x0014: 0x00500000
0x0018: 0x00000020
*
0x0020: 0x00000000
*
0x0028: 0xffffffff
*
0x0030: 0x00000028
0x0034: 0xffffffff
*
0x0040: 0x00000000
0x0044: 0xffffffff
0x0048: 0x00000000
0x004c: 0xffffffff
0x0050: 0x00000206
0x0054: 0xffffffff
*
CPU: ID 0x906e9, Processor Type 0x0, Family 0x6, Model 0x9e, Stepping 0x9
Northbridge: 8086:5918 (7th generation (Kaby Lake family) Core Processor Xeon E3-1200)
Southbridge: 8086:a149 (C236)
Trying to reveal Primary to Sideband Bridge (P2SB),
let's hope the OS doesn't mind... done.
SBREG_BAR = 0xfd000000 (MEM)

Hiding Primary to Sideband Bridge (P2SB).

========== PCR 0xba ==========

PCR port offset: 0xba0000

0x0000: 0x00000000
*
0x0300: 0xfed1c000
0x0304: 0x00000000
*
0x031c: 0x00000100
0x0320: 0x00000000
*
0x0400: 0xfed1b000
0x0404: 0x00000000
*
0x041c: 0x00000100
0x0420: 0x00000000
*
0x0600: 0xfed1a000
0x0604: 0x00000000
*
0x061c: 0x00000100
0x0620: 0x00000000
*
0x071c: 0x00000100
0x0720: 0x00000003
0x0724: 0x00000000
*
0x081c: 0x00000100
0x0820: 0x00000003
0x0824: 0x00000000
*
0x0c00: 0xdff24000
0x0c04: 0xdff27000
0x0c08: 0x00000000
*
0x0c10: 0x0000f020
0x0c14: 0xdff26000
0x0c18: 0x00000000
0x0c1c: 0x00000003
0x0c20: 0x00000000
0x0c24: 0x000f0000
0x0c28: 0x00000010
0x0c2c: 0x80000000
0x0c30: 0x0000003f
0x0c34: 0x00000000
*
0x200c: 0x000000f0
0x2010: 0x0000fff0
*
0x2018: 0xffffffff
0x201c: 0x00000000
*
0x203c: 0x00000100
0x2040: 0x00000000
*
0x210c: 0x000000f0
0x2110: 0x0000fff0
*
0x2118: 0xffffffff
0x211c: 0x00000000
*
0x213c: 0x00000100
0x2140: 0x00000000
*
0x220c: 0x000000f0
0x2210: 0x0000fff0
*
0x2218: 0xffffffff
0x221c: 0x00000000
*
0x223c: 0x00000100
0x2240: 0x00000000
*
0x230c: 0x000000f0
0x2310: 0x0000fff0
*
0x2318: 0xffffffff
0x231c: 0x00000000
*
0x233c: 0x00000100
0x2340: 0x00000000
*
0x240c: 0x000000f0
0x2410: 0x0000fff0
*
0x2418: 0xffffffff
0x241c: 0x00000000
*
0x243c: 0x00000100
0x2440: 0x00000000
*
0x250c: 0x000000f0
0x2510: 0x0000fff0
*
0x2518: 0xffffffff
0x251c: 0x00000000
*
0x253c: 0x00000100
0x2540: 0x00000000
*
0x260c: 0x000000f0
0x2610: 0x0000fff0
*
0x2618: 0xffffffff
0x261c: 0x00000000
*
0x263c: 0x00000100
0x2640: 0x00000000
*
0x270c: 0x000000f0
0x2710: 0x0000fff0
*
0x2718: 0xffffffff
0x271c: 0x00000000
*
0x273c: 0x00000100
0x2740: 0x00000000
*
0x280c: 0x000000f0
0x2810: 0x0000fff0
*
0x2818: 0xffffffff
0x281c: 0x00000000
*
0x283c: 0x00000100
0x2840: 0x00000000
*
0x290c: 0x000000f0
0x2910: 0x0000fff0
*
0x2918: 0xffffffff
0x291c: 0x00000000
*
0x293c: 0x00000100
0x2940: 0x00000000
*
0x2a0c: 0x000000f0
0x2a10: 0x0000fff0
*
0x2a18: 0xffffffff
0x2a1c: 0x00000000
*
0x2a3c: 0x00000100
0x2a40: 0x00000000
*
0x2b08: 0x00030300
0x2b0c: 0x0000d0d0
0x2b10: 0xdfd0dfb0
0x2b14: 0x0000fff0
0x2b18: 0x00000000
*
0x2b28: 0x00100000
0x2b2c: 0x00000000
0x2b30: 0x00000002
0x2b34: 0x00000000
*
0x2b3c: 0x00000003
0x2b40: 0x00000000
*
0x2c0c: 0x000000f0
0x2c10: 0x0000fff0
*
0x2c18: 0xffffffff
0x2c1c: 0x00000000
*
0x2c3c: 0x00000100
0x2c40: 0x00000000
*
0x2d0c: 0x000000f0
0x2d10: 0x0000fff0
*
0x2d18: 0xffffffff
0x2d1c: 0x00000000
*
0x2d3c: 0x00000100
0x2d40: 0x00000000
*
0x2e0c: 0x000000f0
0x2e10: 0x0000fff0
*
0x2e18: 0xffffffff
0x2e1c: 0x00000000
*
0x2e3c: 0x00000100
0x2e40: 0x00000000
*
0x2f08: 0x00020200
0x2f0c: 0x0000e0e0
0x2f10: 0xdfe0dfe0
0x2f14: 0x0000fff0
0x2f18: 0x00000000
*
0x2f28: 0x00100000
0x2f2c: 0x00000000
0x2f30: 0x00000002
0x2f34: 0x00000000
*
0x2f3c: 0x00000003
0x2f40: 0x00000000
*
0x300c: 0x000000f0
0x3010: 0x0000fff0
*
0x3018: 0xffffffff
0x301c: 0x00000000
*
0x303c: 0x00000100
0x3040: 0x00000000
*
0x310c: 0x000000f0
0x3110: 0x0000fff0
*
0x3118: 0xffffffff
0x311c: 0x00000000
*
0x313c: 0x00000100
0x3140: 0x00000000
*
0x320c: 0x000000f0
0x3210: 0x0000fff0
*
0x3218: 0xffffffff
0x321c: 0x00000000
*
0x323c: 0x00000100
0x3240: 0x00000000
*
0x3308: 0x00010100
0x330c: 0x000000f0
0x3310: 0x0000fff0
*
0x3318: 0x00000000
*
0x3328: 0x00100000
0x332c: 0x00000003
0x3330: 0x00000000
*
0x333c: 0x00000003
0x3340: 0x00000000
*
0x4000: 0x00000370
0x4004: 0x00000000
*
0x4010: 0x00000001
0x4014: 0x00000000
0x4018: 0x00000023
0x401c: 0x00000039
*
0x403c: 0x00000029
*
0x4044: 0x00000039
0x4048: 0x00000003
0x404c: 0x00000000
*
0x4058: 0x00038b00
0x405c: 0x00000000
*
0x4118: 0x00000002
0x411c: 0x00000000
0x4120: 0x00000080
0x4124: 0x00000000
*
0x4130: 0x00000002
0x4134: 0x00000000
0x4138: 0x00000080
0x413c: 0x00000000
*
0x4144: 0x00000001
0x4148: 0x00000000
*
0x4164: 0x02000000
0x4168: 0x00000202
0x416c: 0x00000000
*
0x4180: 0x00000080
0x4184: 0x00000000
*
0x418c: 0x00000001
0x4190: 0x00000170
0x4194: 0x00000120
0x4198: 0x00000124
0x419c: 0x00000122
0x41a0: 0x00000164
0x41a4: 0x00000166
0x41a8: 0x00000160
0x41ac: 0x00000126
0x41b0: 0x00000162
0x41b4: 0x00000168
0x41b8: 0x0000016e
0x41bc: 0x00000128
0x41c0: 0x000001c0
0x41c4: 0x000001c2
0x41c8: 0x000001c4
0x41cc: 0x000001c6
0x41d0: 0x000001c8
0x41d4: 0x000001ca
0x41d8: 0x000001cc
0x41dc: 0x000001ce
0x41e0: 0x000001d0
0x41e4: 0x000001d2
0x41e8: 0x000001d4
0x41ec: 0x000001d6
0x41f0: 0x000001d8
0x41f4: 0x000001da
0x41f8: 0x000001dc
0x41fc: 0x000001de
0x4200: 0x000001b0
0x4204: 0x000001b2
0x4208: 0x000001b4
0x420c: 0x000001b6
0x4210: 0x00000000
0x4214: 0x00000004
*
0x4240: 0x00000001
*
0x4248: 0x00000004
0x424c: 0x00000001
*
0x4254: 0x00000004
0x4258: 0x00000001
*
0x4260: 0x00000004
0x4264: 0x00000001
*
0x426c: 0x00000004
*
0x4274: 0x00000001
*
0x427c: 0x00000004
0x4280: 0x00000001
*
0x4288: 0x00000004
0x428c: 0x00000001
*
0x4294: 0x00000004
0x4298: 0x00000001
*
0x42a0: 0x00000004
*
0x42dc: 0x00000001
*
0x42e4: 0x00000004
0x42e8: 0x00000001
*
0x42f0: 0x00000004
0x42f4: 0x00000001
*
0x42fc: 0x00000004
0x4300: 0x00000001
*
0x4308: 0x00000004
*
0x43b8: 0x00000001
0x43bc: 0x00000004
*
0x4420: 0x00000002
0x4424: 0x00000004
*
0x44e8: 0x00000001
0x44ec: 0x00000004
*
0x4510: 0x00000001
*
0x451c: 0x00000004
*
0x46c0: 0x00000001
*
0x46cc: 0x00000008
0x46d0: 0x00000010
0x46d4: 0x00000008
0x46d8: 0x00000001
*
0x46fc: 0x00000004
0x4700: 0x00000002
0x4704: 0x00000004
*
0x472c: 0x00000001
*
0x473c: 0x00000004
*
0x4748: 0x00000020
0x474c: 0x00000004
*
0x4768: 0x00000001
*
0x4778: 0x00000002
0x477c: 0x00000010
*
0x4784: 0x00000004
*
0x478c: 0x00000006
*
0x4798: 0x00000004
*
0x47a0: 0x00000006
0x47a4: 0x00000004
*
0x47bc: 0x00000006
0x47c0: 0x00000004
*
0x47c8: 0x00000006
0x47cc: 0x00000004
*
0x47dc: 0x00000006
0x47e0: 0x00000004
*
0x47f0: 0x00000006
0x47f4: 0x00000004
*
0x47fc: 0x00000006
0x4800: 0x00000004
*
0x4818: 0x00000006
*
0x4824: 0x00000004
*
0x482c: 0x00000006
0x4830: 0x00000004
*
0x4838: 0x00000006
*
0x4840: 0x00000004
*
0x4848: 0x00000006
*
0x4850: 0x00000004
*
0x4858: 0x00000006
0x485c: 0x00000002
0x4860: 0x00000008
0x4864: 0x00000002
*
0x486c: 0x0000000c
0x4870: 0x00000002
*
0x4878: 0x00000004
0x487c: 0x00000002
*
0x4890: 0x00000008
0x4894: 0x00000002
*
0x489c: 0x0000000c
0x48a0: 0x00000002
*
0x48a8: 0x00000004
0x48ac: 0x00000002
*
0x48bc: 0x00000004
*
0x48c8: 0xffffffff
*
0xb000: 0x00000002
0xb004: 0x00000000
*
0xff00: 0xffffffff
*
CPU: ID 0x906e9, Processor Type 0x0, Family 0x6, Model 0x9e, Stepping 0x9
Northbridge: 8086:5918 (7th generation (Kaby Lake family) Core Processor Xeon E3-1200)
Southbridge: 8086:a149 (C236)
Trying to reveal Primary to Sideband Bridge (P2SB),
let's hope the OS doesn't mind... done.
SBREG_BAR = 0xfd000000 (MEM)

Hiding Primary to Sideband Bridge (P2SB).

========== PCR 0xbb ==========

PCR port offset: 0xbb0000

0x0000: 0x00000000
*
0x0100: 0xfff19000
0x0104: 0x0000002f
0x0108: 0x00000000
*
0x011c: 0x00000002
0x0120: 0x00000000
*
0x021c: 0x00000100
0x0220: 0x00000003
0x0224: 0x00000000
*
0x0300: 0xfff00000
0x0304: 0x0000002f
0x0308: 0x00000000
*
0x031c: 0x00000002
0x0320: 0x00000000
*
0x4000: 0x00000378
0x4004: 0x00000000
*
0x4010: 0x00000001
0x4014: 0x00000000
0x4018: 0x00000039
0x401c: 0x00000031
0x4020: 0x00000029
0x4024: 0x00000039
*
0x402c: 0x00000029
0x4030: 0x00000000
*
0x4038: 0x00000002
0x403c: 0x00000000
0x4040: 0x00000080
0x4044: 0x00000000
*
0x404c: 0x00000001
0x4050: 0x00000000
*
0x4058: 0x00000002
0x405c: 0x00000000
0x4060: 0x00000080
0x4064: 0x00000000
*
0x406c: 0x00000001
0x4070: 0x00000140
0x4074: 0x00000142
0x4078: 0x00000144
0x407c: 0x00000000
0x4080: 0x00000004
*
0x40f0: 0x00000001
*
0x40f8: 0x00000004
*
0x4138: 0x00000001
0x413c: 0x00000004
*
0x41cc: 0x00000001
*
0x41d8: 0x0000000a
0x41dc: 0x00000020
0x41e0: 0x0000000a
*
0x41e8: 0x00000004
0x41ec: 0x00000002
*
0x41f8: 0x00000004
0x41fc: 0x00000020
0x4200: 0x00000004
*
0x4208: 0x00000001
*
0x4218: 0x00000002
0x421c: 0x00000010
*
0x4224: 0x00000001
*
0x4264: 0x00000004
*
0x426c: 0x00000006
0x4270: 0x00000004
*
0x4288: 0x00000006
0x428c: 0x00000001
*
0x42c4: 0x00000004
*
0x42cc: 0x00000006
*
0x42d8: 0x00000004
*
0x42e0: 0x00000006
0x42e4: 0x00000001
*
0x42fc: 0x00000002
0x4300: 0x0000000c
0x4304: 0x00000002
*
0x430c: 0x00000001
*
0x4324: 0x00000002
0x4328: 0x0000000c
0x432c: 0x00000002
*
0x4334: 0xffffffff
*
0xb000: 0x00000000
*
CPU: ID 0x906e9, Processor Type 0x0, Family 0x6, Model 0x9e, Stepping 0x9
Northbridge: 8086:5918 (7th generation (Kaby Lake family) Core Processor Xeon E3-1200)
Southbridge: 8086:a149 (C236)
Trying to reveal Primary to Sideband Bridge (P2SB),
let's hope the OS doesn't mind... done.
SBREG_BAR = 0xfd000000 (MEM)

Hiding Primary to Sideband Bridge (P2SB).

========== PCR 0xbc ==========

PCR port offset: 0xbc0000

0x0000: 0x00000000
*
0x0100: 0xfd000000
0x0104: 0x00000000
*
0x011c: 0x00000002
0x0120: 0x00000000
*
0x0238: 0x00000001
0x023c: 0x00000000
*
0x031c: 0x00000100
0x0320: 0x00000000
*
0x0338: 0x00000001
0x033c: 0x00000000
*
0x041c: 0x00000003
0x0420: 0x00000000
*
0x0500: 0xfff18000
0x0504: 0x0000002f
0x0508: 0x00000000
*
0x0510: 0x0000f000
0x0514: 0x00000000
*
0x051c: 0x00000003
0x0520: 0x00000000
*
0x0600: 0xf461a000
0x0604: 0xf4628000
0x0608: 0x00000000
*
0x061c: 0x00000002
0x0620: 0x00000000
*
0x0700: 0xdff20000
0x0704: 0x00000000
*
0x1300: 0xf461e000
0x1304: 0xf3000000
0x1308: 0xf2000000
0x130c: 0x00000000
*
0x131c: 0x00000002
0x1320: 0x00000000
*
0x1400: 0xfe010000
0x1404: 0x00000000
*
0x141c: 0x00000002
0x1420: 0x00000000
*
0x1700: 0xdff00000
0x1704: 0x00000000
*
0x171c: 0x00000002
0x1720: 0x00000000
*
0x1800: 0xf4630000
0x1804: 0x00000000
*
0x181c: 0x00000102
0x1820: 0x00000000
*
0x191c: 0x00000100
0x1920: 0x00000003
0x1924: 0x00000000
*
0x4000: 0x00000378
0x4004: 0x00000000
*
0x4010: 0x00000001
0x4014: 0x00000000
0x4018: 0x00000039
*
0x4020: 0x00000019
0x4024: 0x00000039
*
0x404c: 0x00000003
0x4050: 0x00000000
0x4054: 0x00038b00
0x4058: 0x00000000
*
0x4064: 0x00000002
0x4068: 0x00000000
0x406c: 0x00000080
0x4070: 0x00000000
*
0x4078: 0x00000001
0x407c: 0x00000000
*
0x4084: 0x00000002
0x4088: 0x00000000
*
0x409c: 0x00000080
0x40a0: 0x00000000
0x40a4: 0x000001f6
0x40a8: 0x00000180
0x40ac: 0x000001fc
0x40b0: 0x000001b0
0x40b4: 0x000001f0
0x40b8: 0x000001fa
0x40bc: 0x00000190
0x40c0: 0x00000192
0x40c4: 0x00000150
0x40c8: 0x00000152
0x40cc: 0x00000154
0x40d0: 0x00000156
0x40d4: 0x00000190
0x40d8: 0x000001e0
0x40dc: 0x000001e2
0x40e0: 0x000001e4
0x40e4: 0x000001e6
0x40e8: 0x00000130
0x40ec: 0x000001f4
0x40f0: 0x000001a0
0x40f4: 0x000001f8
0x40f8: 0x000001f0
0x40fc: 0x000001fe
0x4100: 0x00000148
0x4104: 0x000001f2
0x4108: 0x00000000
0x410c: 0x00000004
*
0x4128: 0x00000002
*
0x4154: 0x00000001
*
0x4168: 0x00000002
*
0x4174: 0x00000001
*
0x41ac: 0x00000004
*
0x4258: 0x00000001
0x425c: 0x00000004
*
0x4364: 0x00000001
*
0x4370: 0x0000000a
0x4374: 0x00000020
0x4378: 0x0000000a
*
0x4380: 0x00000004
0x4384: 0x00000020
0x4388: 0x00000004
*
0x43a8: 0x00000002
*
0x43c8: 0x00000001
*
0x43d8: 0x00000002
0x43dc: 0x00000010
*
0x43e4: 0x00000001
*
0x444c: 0xffffffff
*
0xb000: 0x00000002
0xb004: 0x00000000
*
CPU: ID 0x906e9, Processor Type 0x0, Family 0x6, Model 0x9e, Stepping 0x9
Northbridge: 8086:5918 (7th generation (Kaby Lake family) Core Processor Xeon E3-1200)
Southbridge: 8086:a149 (C236)
Trying to reveal Primary to Sideband Bridge (P2SB),
let's hope the OS doesn't mind... done.
SBREG_BAR = 0xfd000000 (MEM)

Hiding Primary to Sideband Bridge (P2SB).

========== PCR 0xbd ==========

PCR port offset: 0xbd0000

0x0000: 0x00000000
*
0x4000: 0x00000378
0x4004: 0x00000000
*
0x4010: 0x00000001
0x4014: 0x00000000
0x4018: 0x00000039
*
0x4044: 0x00000000
*
0x4054: 0x00800000
0x4058: 0x00000000
*
0x4064: 0x00000001
*
0x4150: 0x00000004
*
0x41ec: 0x00000001
*
0x41f8: 0x00000008
0x41fc: 0x00000002
*
0x422c: 0x00000001
*
0x4240: 0x00000010
*
0x4248: 0x00000001
*
0x427c: 0xffffffff
*
0xb000: 0x00000000
*
CPU: ID 0x906e9, Processor Type 0x0, Family 0x6, Model 0x9e, Stepping 0x9
Northbridge: 8086:5918 (7th generation (Kaby Lake family) Core Processor Xeon E3-1200)
Southbridge: 8086:a149 (C236)
Trying to reveal Primary to Sideband Bridge (P2SB),
let's hope the OS doesn't mind... done.
SBREG_BAR = 0xfd000000 (MEM)

Hiding Primary to Sideband Bridge (P2SB).

========== PCR 0xbf ==========

PCR port offset: 0xbf0000

0x0000: 0xffffffff
*
CPU: ID 0x906e9, Processor Type 0x0, Family 0x6, Model 0x9e, Stepping 0x9
Northbridge: 8086:5918 (7th generation (Kaby Lake family) Core Processor Xeon E3-1200)
Southbridge: 8086:a149 (C236)
Trying to reveal Primary to Sideband Bridge (P2SB),
let's hope the OS doesn't mind... done.
SBREG_BAR = 0xfd000000 (MEM)

Hiding Primary to Sideband Bridge (P2SB).

========== PCR 0xc3 ==========

PCR port offset: 0xc30000

0x0000: 0xffffffff
*
0x3400: 0x8000001c
0x3404: 0xffffffff
*
0x3414: 0x00000000
0x3418: 0x00000003
0x341c: 0xffffffff
*
0x3f00: 0x0000010b
0x3f04: 0x00000000
0x3f08: 0xffffffff
*
CPU: ID 0x906e9, Processor Type 0x0, Family 0x6, Model 0x9e, Stepping 0x9
Northbridge: 8086:5918 (7th generation (Kaby Lake family) Core Processor Xeon E3-1200)
Southbridge: 8086:a149 (C236)
Trying to reveal Primary to Sideband Bridge (P2SB),
let's hope the OS doesn't mind... done.
SBREG_BAR = 0xfd000000 (MEM)

Hiding Primary to Sideband Bridge (P2SB).

========== PCR 0xc4 ==========

PCR port offset: 0xc40000

0x0000: 0x00000000
*
0x3100: 0x8b8b8a8b
0x3104: 0x8b8b8b8b
0x3108: 0x00000000
*
0x3140: 0x32103210
*
0x3158: 0x00003210
0x315c: 0x00000000
*
0x3200: 0x00ff4000
0x3204: 0x00000001
0x3208: 0x00000000
*
0x3300: 0x0000001b
0x3304: 0x00330033
0x3308: 0x00000003
0x330c: 0x00000000
*
0x3328: 0x00002000
0x332c: 0x00000000
*
0x3334: 0x00000001
0x3338: 0x00000000
*
0x3400: 0x0b71a7ff
0x3404: 0x00000000
*
CPU: ID 0x906e9, Processor Type 0x0, Family 0x6, Model 0x9e, Stepping 0x9
Northbridge: 8086:5918 (7th generation (Kaby Lake family) Core Processor Xeon E3-1200)
Southbridge: 8086:a149 (C236)
Trying to reveal Primary to Sideband Bridge (P2SB),
let's hope the OS doesn't mind... done.
SBREG_BAR = 0xfd000000 (MEM)

Hiding Primary to Sideband Bridge (P2SB).

========== PCR 0xc6 ==========

PCR port offset: 0xc60000

0x0000: 0x00000000
*
0x000c: 0x00000002
0x0010: 0x00000028
0x0014: 0x00000000
*
CPU: ID 0x906e9, Processor Type 0x0, Family 0x6, Model 0x9e, Stepping 0x9
Northbridge: 8086:5918 (7th generation (Kaby Lake family) Core Processor Xeon E3-1200)
Southbridge: 8086:a149 (C236)
Trying to reveal Primary to Sideband Bridge (P2SB),
let's hope the OS doesn't mind... done.
SBREG_BAR = 0xfd000000 (MEM)

Hiding Primary to Sideband Bridge (P2SB).

========== PCR 0xc7 ==========

PCR port offset: 0xc70000

0x0000: 0x00000000
*
0x341c: 0x0000280f
0x3420: 0x00000444
*
0x342c: 0x00000000
*
CPU: ID 0x906e9, Processor Type 0x0, Family 0x6, Model 0x9e, Stepping 0x9
Northbridge: 8086:5918 (7th generation (Kaby Lake family) Core Processor Xeon E3-1200)
Southbridge: 8086:a149 (C236)
Trying to reveal Primary to Sideband Bridge (P2SB),
let's hope the OS doesn't mind... done.
SBREG_BAR = 0xfd000000 (MEM)

Hiding Primary to Sideband Bridge (P2SB).

========== PCR 0xca ==========

PCR port offset: 0xca0000

0x0000: 0xffffffff
*
0x4000: 0x00000000
*
0x400c: 0x00007ff8
0x4010: 0x00fe00c7
0x4014: 0x00000000
*
0x4024: 0x00007f11
0x4028: 0x00000000
0x402c: 0x01e25000
0x4030: 0xffffffff
*
0x4038: 0x81690f80
0x403c: 0x00000000
*
0x4100: 0xfc05f801
0x4104: 0x00000000
0x4108: 0x00001ad0
0x410c: 0x00000000
*
0x411c: 0x20406928
0x4120: 0x00000000
*
0x4200: 0xfc05f801
0x4204: 0x00000000
0x4208: 0x00001ad0
0x420c: 0x00000000
*
0x421c: 0x20407118
0x4220: 0x00000000
*
0x4300: 0xfc05f801
0x4304: 0x00000000
0x4308: 0x00001ad0
0x430c: 0x00000000
*
0x431c: 0x20406138
0x4320: 0x00000000
*
0x4400: 0xfc05f801
0x4404: 0x00000000
0x4408: 0x00001ad0
0x440c: 0x00000000
*
0x441c: 0x20407118
0x4420: 0x00000000
*
0x4500: 0xfc05f801
0x4504: 0x00000000
0x4508: 0x00001ad0
0x450c: 0x00000000
*
0x451c: 0x20406148
0x4520: 0x00000000
*
0x4600: 0xfc05f801
0x4604: 0x00000000
0x4608: 0x00001ad0
0x460c: 0x00000000
*
0x461c: 0x20407918
0x4620: 0x00000000
*
0x4700: 0xfc05f801
0x4704: 0x00000000
0x4708: 0x00001ad0
0x470c: 0x00000000
*
0x471c: 0x20407918
0x4720: 0x00000000
*
0x4800: 0xfc05f801
0x4804: 0x00000000
0x4808: 0x00001ad0
0x480c: 0x00000000
*
0x481c: 0x20407918
0x4820: 0x00000000
*
0x4900: 0xfc05f801
0x4904: 0x00000000
0x4908: 0x00001ad0
0x490c: 0x00000000
*
0x491c: 0x20407128
0x4920: 0x00000000
*
0x4a00: 0xfc05f801
0x4a04: 0x00000000
0x4a08: 0x00001ad0
0x4a0c: 0x00000000
*
0x4a1c: 0x204088f8
0x4a20: 0x00000000
*
0x4b00: 0xfc05f801
0x4b04: 0x00000000
0x4b08: 0x00001ad0
0x4b0c: 0x00000000
*
0x4b1c: 0x20407118
0x4b20: 0x00000000
*
0x4c00: 0xfc05f801
0x4c04: 0x00000000
0x4c08: 0x00001ad0
0x4c0c: 0x00000000
*
0x4c1c: 0x20407918
0x4c20: 0x00000000
*
0x4d00: 0xfc05f801
0x4d04: 0x00000000
0x4d08: 0x00001ad0
0x4d0c: 0x00000000
*
0x4d1c: 0x20406928
0x4d20: 0x00000000
*
0x4e00: 0xfc05f801
0x4e04: 0x00000000
0x4e08: 0x00001ad0
0x4e0c: 0x00000000
*
0x4e1c: 0x20407118
0x4e20: 0x00000000
*
0x4f00: 0xffffffff
*
0x7000: 0x00000000
*
0x7034: 0x50000000
0x7038: 0x0a70fcf6
0x703c: 0x1fbbc000
0x7040: 0x00000000
0x7044: 0x80020800
0x7048: 0x00080800
0x704c: 0x00000800
0x7050: 0x0004e180
0x7054: 0x00060000
0x7058: 0xffc00000
0x705c: 0x245a0000
0x7060: 0x00040400
0x7064: 0x00000000
*
0x7080: 0xffffffff
*
0x7f00: 0x00000000
0x7f04: 0x00000600
0x7f08: 0x00000000
*
0x7f14: 0x00000783
0x7f18: 0x00000000
*
0x8000: 0xffffffff
*
CPU: ID 0x906e9, Processor Type 0x0, Family 0x6, Model 0x9e, Stepping 0x9
Northbridge: 8086:5918 (7th generation (Kaby Lake family) Core Processor Xeon E3-1200)
Southbridge: 8086:a149 (C236)
Trying to reveal Primary to Sideband Bridge (P2SB),
let's hope the OS doesn't mind... done.
SBREG_BAR = 0xfd000000 (MEM)

Hiding Primary to Sideband Bridge (P2SB).

========== PCR 0xcb ==========

PCR port offset: 0xcb0000

0x0000: 0xffffffff
*
CPU: ID 0x906e9, Processor Type 0x0, Family 0x6, Model 0x9e, Stepping 0x9
Northbridge: 8086:5918 (7th generation (Kaby Lake family) Core Processor Xeon E3-1200)
Southbridge: 8086:a149 (C236)
Trying to reveal Primary to Sideband Bridge (P2SB),
let's hope the OS doesn't mind... done.
SBREG_BAR = 0xfd000000 (MEM)

Hiding Primary to Sideband Bridge (P2SB).

========== PCR 0xd7 ==========

PCR port offset: 0xd70000

0x0000: 0x00000fff
0x0004: 0x00000000
*
0x0010: 0x00000001
0x0014: 0x00000000
*
0x0068: 0x00000001
0x006c: 0x00000000
*
0x00e0: 0x00000010
0x00e4: 0x00000000
*
0x0500: 0x00001080
0x0504: 0x00000000
*
0x0530: 0x00000007
0x0534: 0x00000000
*
0x0610: 0x54056508
0x0614: 0x00000820
0x0618: 0x070f001c
0x061c: 0x0c000004
0x0620: 0x3fffffff
0x0624: 0x00000003
0x0628: 0x00000005
0x062c: 0x00000000
*
0x1000: 0x00000fff
0x1004: 0x00000000
*
0x1010: 0x00000001
0x1014: 0x00000000
*
0x1068: 0x00000001
0x106c: 0x00000000
*
0x10e0: 0x00000010
0x10e4: 0x00000000
*
0x1500: 0x00001080
0x1504: 0x00000000
*
0x1530: 0x00000007
0x1534: 0x00000000
*
0x1610: 0x54056508
0x1614: 0x00000820
0x1618: 0x070f001c
0x161c: 0x0c000004
0x1620: 0x3fffffff
0x1624: 0x00000003
0x1628: 0x00000005
0x162c: 0x00000000
*
0x2000: 0x00000fff
0x2004: 0x00000000
*
0x2010: 0x00000001
0x2014: 0x00000000
*
0x2068: 0x00000001
0x206c: 0x00000000
*
0x20e0: 0x00000010
0x20e4: 0x00000000
*
0x2500: 0x00001080
0x2504: 0x00000000
*
0x2530: 0x00000007
0x2534: 0x00000000
*
0x2610: 0x54056508
0x2614: 0x00000820
0x2618: 0x070f001c
0x261c: 0x0c000004
0x2620: 0x3fffffff
0x2624: 0x00000003
0x2628: 0x00000005
0x262c: 0x00000000
*
0x3000: 0x00000fff
0x3004: 0x00000000
*
0x3010: 0x00000001
0x3014: 0x00000000
*
0x3068: 0x00000001
0x306c: 0x00000000
*
0x30e0: 0x00000010
0x30e4: 0x00000000
*
0x3500: 0x00001080
0x3504: 0x00000000
*
0x3530: 0x00000007
0x3534: 0x00000000
*
0x3610: 0x54056508
0x3614: 0x00000820
0x3618: 0x070f001c
0x361c: 0x0c000004
0x3620: 0x3fffffff
0x3624: 0x00000003
0x3628: 0x00000005
0x362c: 0x00000000
*
0x4000: 0x00000fff
0x4004: 0x00000000
*
0x4010: 0x00000001
0x4014: 0x00000000
*
0x4068: 0x00000001
0x406c: 0x00000000
*
0x40e0: 0x00000010
0x40e4: 0x00000000
*
0x4500: 0x00001080
0x4504: 0x00000000
*
0x4530: 0x00000007
0x4534: 0x00000000
*
0x4610: 0x54056508
0x4614: 0x00000820
0x4618: 0x070f001c
0x461c: 0x0c000004
0x4620: 0x3fffffff
0x4624: 0x00000003
0x4628: 0x00000005
0x462c: 0x00000000
*
0x5000: 0x00000fff
0x5004: 0x00000000
*
0x5010: 0x00000001
0x5014: 0x00000000
*
0x5068: 0x00000001
0x506c: 0x00000000
*
0x50e0: 0x00000010
0x50e4: 0x00000000
*
0x5500: 0x00001080
0x5504: 0x00000000
*
0x5530: 0x00000007
0x5534: 0x00000000
*
0x5610: 0x54056508
0x5614: 0x00000820
0x5618: 0x070f001c
0x561c: 0x0c000004
0x5620: 0x3fffffff
0x5624: 0x00000003
0x5628: 0x00000005
0x562c: 0x00000000
*
0x6000: 0x00000fff
0x6004: 0x00000000
*
0x6010: 0x00000001
0x6014: 0x00000000
*
0x6068: 0x00000001
0x606c: 0x00000000
*
0x60e0: 0x00000010
0x60e4: 0x00000000
*
0x6500: 0x00001080
0x6504: 0x00000000
*
0x6530: 0x00000007
0x6534: 0x00000000
*
0x6610: 0x54056508
0x6614: 0x00000820
0x6618: 0x070f001c
0x661c: 0x0c000004
0x6620: 0x3fffffff
0x6624: 0x00000003
0x6628: 0x00000005
0x662c: 0x00000000
*
0x7000: 0x00000fff
0x7004: 0x00000000
*
0x7010: 0x00000001
0x7014: 0x00000000
*
0x7068: 0x00000001
0x706c: 0x00000000
*
0x70e0: 0x00000010
0x70e4: 0x00000000
*
0x7500: 0x00001080
0x7504: 0x00000000
*
0x7530: 0x00000007
0x7534: 0x00000000
*
0x7610: 0x54056508
0x7614: 0x00000820
0x7618: 0x070f001c
0x761c: 0x0c000004
0x7620: 0x3fffffff
0x7624: 0x00000003
0x7628: 0x00000005
0x762c: 0x00000000
*
0x8000: 0x00000fff
0x8004: 0x00000000
*
0x8010: 0x00000001
0x8014: 0x00000000
*
0x8068: 0x00000001
0x806c: 0x00000000
*
0x80e0: 0x00000010
0x80e4: 0x00000000
*
0x8500: 0x00001080
0x8504: 0x00000000
*
0x8530: 0x00000007
0x8534: 0x00000000
*
0x8610: 0x54056508
0x8614: 0x00000820
0x8618: 0x070f001c
0x861c: 0x0c000004
0x8620: 0x3fffffff
0x8624: 0x00000003
0x8628: 0x00000005
0x862c: 0x00000000
*
0x9000: 0x00000fff
0x9004: 0x00000000
*
0x9010: 0x00000001
0x9014: 0x00000000
*
0x9068: 0x00000001
0x906c: 0x00000000
*
0x90e0: 0x00000010
0x90e4: 0x00000000
*
0x9500: 0x00001080
0x9504: 0x00000000
*
0x9530: 0x00000007
0x9534: 0x00000000
*
0x9610: 0x54056508
0x9614: 0x00000820
0x9618: 0x070f001c
0x961c: 0x0c000004
0x9620: 0x3fffffff
0x9624: 0x00000003
0x9628: 0x00000005
0x962c: 0x00000000
*
0xa000: 0x00000fff
0xa004: 0x00000000
*
0xa010: 0x00000001
0xa014: 0x00000000
*
0xa068: 0x00000001
0xa06c: 0x00000000
*
0xa0e0: 0x00000010
0xa0e4: 0x00000000
*
0xa500: 0x00001080
0xa504: 0x00000000
*
0xa530: 0x00000007
0xa534: 0x00000000
*
0xa610: 0x54056508
0xa614: 0x00000820
0xa618: 0x070f001c
0xa61c: 0x0c000004
0xa620: 0x3fffffff
0xa624: 0x00000003
0xa628: 0x00000005
0xa62c: 0x00000000
*
0xb000: 0x00000fff
0xb004: 0x00000000
*
0xb010: 0x00000001
0xb014: 0x00000000
*
0xb068: 0x00000001
0xb06c: 0x00000000
*
0xb0e0: 0x00000010
0xb0e4: 0x00000000
*
0xb500: 0x00001080
0xb504: 0x00000000
*
0xb530: 0x00000007
0xb534: 0x00000000
*
0xb610: 0x54056508
0xb614: 0x00000820
0xb618: 0x070f001c
0xb61c: 0x0c000004
0xb620: 0x3fffffff
0xb624: 0x00000003
0xb628: 0x00000005
0xb62c: 0x00000000
*
0xc000: 0x00000fff
0xc004: 0x00000000
*
0xc010: 0x00000001
0xc014: 0x00000000
*
0xc068: 0x00000001
0xc06c: 0x00000000
*
0xc0e0: 0x00000010
0xc0e4: 0x00000000
*
0xc500: 0x00001080
0xc504: 0x00000000
*
0xc530: 0x00000007
0xc534: 0x00000000
*
0xc610: 0x54056508
0xc614: 0x00000820
0xc618: 0x070f001c
0xc61c: 0x0c000004
0xc620: 0x3fffffff
0xc624: 0x00000003
0xc628: 0x00000005
0xc62c: 0x00000000
*
0xd000: 0x00000fff
0xd004: 0x00000000
*
0xd010: 0x00000001
0xd014: 0x00000000
*
0xd068: 0x00000001
0xd06c: 0x00000000
*
0xd0e0: 0x00000010
0xd0e4: 0x00000000
*
0xd500: 0x00001080
0xd504: 0x00000000
*
0xd530: 0x00000007
0xd534: 0x00000000
*
0xd610: 0x54056508
0xd614: 0x00000820
0xd618: 0x070f001c
0xd61c: 0x0c000004
0xd620: 0x3fffffff
0xd624: 0x00000003
0xd628: 0x00000005
0xd62c: 0x00000000
*
0xe000: 0x00000fff
0xe004: 0x00000000
*
0xe010: 0x00000001
0xe014: 0x00000000
*
0xe068: 0x00000001
0xe06c: 0x00000000
*
0xe0e0: 0x00000010
0xe0e4: 0x00000000
*
0xe500: 0x00001080
0xe504: 0x00000000
*
0xe530: 0x00000007
0xe534: 0x00000000
*
0xe610: 0x54056508
0xe614: 0x00000820
0xe618: 0x070f001c
0xe61c: 0x0c000004
0xe620: 0x3fffffff
0xe624: 0x00000003
0xe628: 0x00000005
0xe62c: 0x00000000
*
0xf000: 0x00000fff
0xf004: 0x00000000
*
0xf010: 0x00000001
0xf014: 0x00000000
*
0xf068: 0x00000001
0xf06c: 0x00000000
*
0xf0e0: 0x00000010
0xf0e4: 0x00000000
*
0xf500: 0x00001080
0xf504: 0x00000000
*
0xf530: 0x00000007
0xf534: 0x00000000
*
0xf610: 0x54056508
0xf614: 0x00000820
0xf618: 0x070f001c
0xf61c: 0x0c000004
0xf620: 0x3fffffff
0xf624: 0x00000003
0xf628: 0x00000005
0xf62c: 0x00000000
*
CPU: ID 0x906e9, Processor Type 0x0, Family 0x6, Model 0x9e, Stepping 0x9
Northbridge: 8086:5918 (7th generation (Kaby Lake family) Core Processor Xeon E3-1200)
Southbridge: 8086:a149 (C236)
Trying to reveal Primary to Sideband Bridge (P2SB),
let's hope the OS doesn't mind... done.
SBREG_BAR = 0xfd000000 (MEM)

Hiding Primary to Sideband Bridge (P2SB).

========== PCR 0xd9 ==========

PCR port offset: 0xd90000

0x0000: 0xffffffff
*
CPU: ID 0x906e9, Processor Type 0x0, Family 0x6, Model 0x9e, Stepping 0x9
Northbridge: 8086:5918 (7th generation (Kaby Lake family) Core Processor Xeon E3-1200)
Southbridge: 8086:a149 (C236)
Trying to reveal Primary to Sideband Bridge (P2SB),
let's hope the OS doesn't mind... done.
SBREG_BAR = 0xfd000000 (MEM)

Hiding Primary to Sideband Bridge (P2SB).

========== PCR 0xdc ==========

PCR port offset: 0xdc0000

0x0000: 0xffffffff
*
0x1000: 0x99999999
*
0x1008: 0x0000ffff
0x100c: 0x00000000
0x1010: 0xffffffff
*
0x1024: 0x76543210
*
0x102c: 0xffffffff
*
0x1038: 0x00030000
0x103c: 0xffffffff
*
CPU: ID 0x906e9, Processor Type 0x0, Family 0x6, Model 0x9e, Stepping 0x9
Northbridge: 8086:5918 (7th generation (Kaby Lake family) Core Processor Xeon E3-1200)
Southbridge: 8086:a149 (C236)
Trying to reveal Primary to Sideband Bridge (P2SB),
let's hope the OS doesn't mind... done.
SBREG_BAR = 0xfd000000 (MEM)

Hiding Primary to Sideband Bridge (P2SB).

========== PCR 0xe0 ==========

PCR port offset: 0xe00000

0x0000: 0x800e3210
0x0004: 0x00000000
*
0x1000: 0x800e3210
0x1004: 0x00000000
*
0x2000: 0x800e3210
0x2004: 0x00000000
*
0x3000: 0x800e3210
0x3004: 0x00000000
*
0x4000: 0x800e3210
0x4004: 0x00000000
*
0x5000: 0x800e3210
0x5004: 0x00000000
*
0x6000: 0x800e3210
0x6004: 0x00000000
*
0x7000: 0x800e3210
0x7004: 0x00000000
*
0x8000: 0x800e3210
0x8004: 0x00000000
*
0x9000: 0x800e3210
0x9004: 0x00000000
*
0xa000: 0x800e3210
0xa004: 0x00000000
*
0xb000: 0x800e3210
0xb004: 0x00000000
*
0xc000: 0x800e3210
0xc004: 0x00000000
*
0xd000: 0x800e3210
0xd004: 0x00000000
*
0xe000: 0x800e3210
0xe004: 0x00000000
*
0xf000: 0x800e3210
0xf004: 0x00000000
*
CPU: ID 0x906e9, Processor Type 0x0, Family 0x6, Model 0x9e, Stepping 0x9
Northbridge: 8086:5918 (7th generation (Kaby Lake family) Core Processor Xeon E3-1200)
Southbridge: 8086:a149 (C236)
Trying to reveal Primary to Sideband Bridge (P2SB),
let's hope the OS doesn't mind... done.
SBREG_BAR = 0xfd000000 (MEM)

Hiding Primary to Sideband Bridge (P2SB).

========== PCR 0xe1 ==========

PCR port offset: 0xe10000

0x0000: 0x800e7654
0x0004: 0x00000000
*
0x1000: 0x800e7654
0x1004: 0x00000000
*
0x2000: 0x800e7654
0x2004: 0x00000000
*
0x3000: 0x800e7654
0x3004: 0x00000000
*
0x4000: 0x800e7654
0x4004: 0x00000000
*
0x5000: 0x800e7654
0x5004: 0x00000000
*
0x6000: 0x800e7654
0x6004: 0x00000000
*
0x7000: 0x800e7654
0x7004: 0x00000000
*
0x8000: 0x800e7654
0x8004: 0x00000000
*
0x9000: 0x800e7654
0x9004: 0x00000000
*
0xa000: 0x800e7654
0xa004: 0x00000000
*
0xb000: 0x800e7654
0xb004: 0x00000000
*
0xc000: 0x800e7654
0xc004: 0x00000000
*
0xd000: 0x800e7654
0xd004: 0x00000000
*
0xe000: 0x800e7654
0xe004: 0x00000000
*
0xf000: 0x800e7654
0xf004: 0x00000000
*
CPU: ID 0x906e9, Processor Type 0x0, Family 0x6, Model 0x9e, Stepping 0x9
Northbridge: 8086:5918 (7th generation (Kaby Lake family) Core Processor Xeon E3-1200)
Southbridge: 8086:a149 (C236)
Trying to reveal Primary to Sideband Bridge (P2SB),
let's hope the OS doesn't mind... done.
SBREG_BAR = 0xfd000000 (MEM)

Hiding Primary to Sideband Bridge (P2SB).

========== PCR 0xe2 ==========

PCR port offset: 0xe20000

0x0000: 0x800e3210
0x0004: 0x00000000
*
0x1000: 0x800e3210
0x1004: 0x00000000
*
0x2000: 0x800e3210
0x2004: 0x00000000
*
0x3000: 0x800e3210
0x3004: 0x00000000
*
0x4000: 0x800e3210
0x4004: 0x00000000
*
0x5000: 0x800e3210
0x5004: 0x00000000
*
0x6000: 0x800e3210
0x6004: 0x00000000
*
0x7000: 0x800e3210
0x7004: 0x00000000
*
0x8000: 0x800e3210
0x8004: 0x00000000
*
0x9000: 0x800e3210
0x9004: 0x00000000
*
0xa000: 0x800e3210
0xa004: 0x00000000
*
0xb000: 0x800e3210
0xb004: 0x00000000
*
0xc000: 0x800e3210
0xc004: 0x00000000
*
0xd000: 0x800e3210
0xd004: 0x00000000
*
0xe000: 0x800e3210
0xe004: 0x00000000
*
0xf000: 0x800e3210
0xf004: 0x00000000
*
CPU: ID 0x906e9, Processor Type 0x0, Family 0x6, Model 0x9e, Stepping 0x9
Northbridge: 8086:5918 (7th generation (Kaby Lake family) Core Processor Xeon E3-1200)
Southbridge: 8086:a149 (C236)
Trying to reveal Primary to Sideband Bridge (P2SB),
let's hope the OS doesn't mind... done.
SBREG_BAR = 0xfd000000 (MEM)

Hiding Primary to Sideband Bridge (P2SB).

========== PCR 0xe3 ==========

PCR port offset: 0xe30000

0x0000: 0x800f7654
0x0004: 0x00000000
*
0x1000: 0x800f7654
0x1004: 0x00000000
*
0x2000: 0x800f7654
0x2004: 0x00000000
*
0x3000: 0x800f7654
0x3004: 0x00000000
*
0x4000: 0x800f7654
0x4004: 0x00000000
*
0x5000: 0x800f7654
0x5004: 0x00000000
*
0x6000: 0x800f7654
0x6004: 0x00000000
*
0x7000: 0x800f7654
0x7004: 0x00000000
*
0x8000: 0x800f7654
0x8004: 0x00000000
*
0x9000: 0x800f7654
0x9004: 0x00000000
*
0xa000: 0x800f7654
0xa004: 0x00000000
*
0xb000: 0x800f7654
0xb004: 0x00000000
*
0xc000: 0x800f7654
0xc004: 0x00000000
*
0xd000: 0x800f7654
0xd004: 0x00000000
*
0xe000: 0x800f7654
0xe004: 0x00000000
*
0xf000: 0x800f7654
0xf004: 0x00000000
*
CPU: ID 0x906e9, Processor Type 0x0, Family 0x6, Model 0x9e, Stepping 0x9
Northbridge: 8086:5918 (7th generation (Kaby Lake family) Core Processor Xeon E3-1200)
Southbridge: 8086:a149 (C236)
Trying to reveal Primary to Sideband Bridge (P2SB),
let's hope the OS doesn't mind... done.
SBREG_BAR = 0xfd000000 (MEM)

Hiding Primary to Sideband Bridge (P2SB).

========== PCR 0xe4 ==========

PCR port offset: 0xe40000

0x0000: 0x800f3210
0x0004: 0x00000000
*
0x1000: 0x800f3210
0x1004: 0x00000000
*
0x2000: 0x800f3210
0x2004: 0x00000000
*
0x3000: 0x800f3210
0x3004: 0x00000000
*
0x4000: 0x800f3210
0x4004: 0x00000000
*
0x5000: 0x800f3210
0x5004: 0x00000000
*
0x6000: 0x800f3210
0x6004: 0x00000000
*
0x7000: 0x800f3210
0x7004: 0x00000000
*
0x8000: 0x800f3210
0x8004: 0x00000000
*
0x9000: 0x800f3210
0x9004: 0x00000000
*
0xa000: 0x800f3210
0xa004: 0x00000000
*
0xb000: 0x800f3210
0xb004: 0x00000000
*
0xc000: 0x800f3210
0xc004: 0x00000000
*
0xd000: 0x800f3210
0xd004: 0x00000000
*
0xe000: 0x800f3210
0xe004: 0x00000000
*
0xf000: 0x800f3210
0xf004: 0x00000000
*
CPU: ID 0x906e9, Processor Type 0x0, Family 0x6, Model 0x9e, Stepping 0x9
Northbridge: 8086:5918 (7th generation (Kaby Lake family) Core Processor Xeon E3-1200)
Southbridge: 8086:a149 (C236)
Trying to reveal Primary to Sideband Bridge (P2SB),
let's hope the OS doesn't mind... done.
SBREG_BAR = 0xfd000000 (MEM)

Hiding Primary to Sideband Bridge (P2SB).

========== PCR 0xe5 ==========

PCR port offset: 0xe50000

0x0000: 0x00000007
0x0004: 0x00000000
*
0x0010: 0x000000f1
0x0014: 0x00000000
*
0x0068: 0x00000001
0x006c: 0x00000000
*
0x0074: 0x00000001
0x0078: 0x00000000
*
0x01d0: 0x0000003f
0x01d4: 0x00000000
*
0x0200: 0x01111200
0x0204: 0x00000000
*
0x1000: 0xffffffff
*
CPU: ID 0x906e9, Processor Type 0x0, Family 0x6, Model 0x9e, Stepping 0x9
Northbridge: 8086:5918 (7th generation (Kaby Lake family) Core Processor Xeon E3-1200)
Southbridge: 8086:a149 (C236)
Trying to reveal Primary to Sideband Bridge (P2SB),
let's hope the OS doesn't mind... done.
SBREG_BAR = 0xfd000000 (MEM)

Hiding Primary to Sideband Bridge (P2SB).

========== PCR 0xe6 ==========

PCR port offset: 0xe60000

0x0000: 0x00000000
*
0x000c: 0xffffffff
*
0x0080: 0x00000000
*
CPU: ID 0x906e9, Processor Type 0x0, Family 0x6, Model 0x9e, Stepping 0x9
Northbridge: 8086:5918 (7th generation (Kaby Lake family) Core Processor Xeon E3-1200)
Southbridge: 8086:a149 (C236)
Trying to reveal Primary to Sideband Bridge (P2SB),
let's hope the OS doesn't mind... done.
SBREG_BAR = 0xfd000000 (MEM)

Hiding Primary to Sideband Bridge (P2SB).

========== PCR 0xcf ==========

PCR port offset: 0xcf0000

0x0000: 0x80038000
0x0004: 0x00000000
*
0x0010: 0x041001d0
0x0014: 0x11411442
0x0018: 0x00000000
*
0x0020: 0xc0000000
0x0024: 0x00000000
*
0x0108: 0x50000000
0x010c: 0x00000000
*
0x0200: 0x80004000
0x0204: 0x000aaaaa
0x0208: 0x00050005
0x020c: 0x00500000
0x0210: 0x00000000
*
0x0250: 0x11111111
0x0254: 0x00000030
0x0258: 0x22000000
0x025c: 0x00002222
0x0260: 0x00000000
*
0x1000: 0x80038000
0x1004: 0x00000000
*
0x1010: 0x041001d0
0x1014: 0x11411442
0x1018: 0x00000000
*
0x1020: 0xc0000000
0x1024: 0x00000000
*
0x1108: 0x50000000
0x110c: 0x00000000
*
0x1200: 0x80004000
0x1204: 0x000aaaaa
0x1208: 0x00050005
0x120c: 0x00500000
0x1210: 0x00000000
*
0x1250: 0x11111111
0x1254: 0x00000030
0x1258: 0x22000000
0x125c: 0x00002222
0x1260: 0x00000000
*
0x2000: 0x80038000
0x2004: 0x00000000
*
0x2010: 0x041001d0
0x2014: 0x11411442
0x2018: 0x00000000
*
0x2020: 0xc0000000
0x2024: 0x00000000
*
0x2108: 0x50000000
0x210c: 0x00000000
*
0x2200: 0x80004000
0x2204: 0x000aaaaa
0x2208: 0x00050005
0x220c: 0x00500000
0x2210: 0x00000000
*
0x2250: 0x11111111
0x2254: 0x00000030
0x2258: 0x22000000
0x225c: 0x00002222
0x2260: 0x00000000
*
0x3000: 0x80038000
0x3004: 0x00000000
*
0x3010: 0x041001d0
0x3014: 0x11411442
0x3018: 0x00000000
*
0x3020: 0xc0000000
0x3024: 0x00000000
*
0x3108: 0x50000000
0x310c: 0x00000000
*
0x3200: 0x80004000
0x3204: 0x000aaaaa
0x3208: 0x00050005
0x320c: 0x00500000
0x3210: 0x00000000
*
0x3250: 0x11111111
0x3254: 0x00000030
0x3258: 0x22000000
0x325c: 0x00002222
0x3260: 0x00000000
*
0x4000: 0x80038000
0x4004: 0x00000000
*
0x4010: 0x041001d0
0x4014: 0x11411442
0x4018: 0x00000000
*
0x4020: 0xc0000000
0x4024: 0x00000000
*
0x4108: 0x50000000
0x410c: 0x00000000
*
0x4200: 0x80004000
0x4204: 0x000aaaaa
0x4208: 0x00050005
0x420c: 0x00500000
0x4210: 0x00000000
*
0x4250: 0x11111111
0x4254: 0x00000030
0x4258: 0x22000000
0x425c: 0x00002222
0x4260: 0x00000000
*
0x5000: 0x80038000
0x5004: 0x00000000
*
0x5010: 0x041001d0
0x5014: 0x11411442
0x5018: 0x00000000
*
0x5020: 0xc0000000
0x5024: 0x00000000
*
0x5108: 0x50000000
0x510c: 0x00000000
*
0x5200: 0x80004000
0x5204: 0x000aaaaa
0x5208: 0x00050005
0x520c: 0x00500000
0x5210: 0x00000000
*
0x5250: 0x11111111
0x5254: 0x00000030
0x5258: 0x22000000
0x525c: 0x00002222
0x5260: 0x00000000
*
0x6000: 0x80038000
0x6004: 0x00000000
*
0x6010: 0x041001d0
0x6014: 0x11411442
0x6018: 0x00000000
*
0x6020: 0xc0000000
0x6024: 0x00000000
*
0x6108: 0x50000000
0x610c: 0x00000000
*
0x6200: 0x80004000
0x6204: 0x000aaaaa
0x6208: 0x00050005
0x620c: 0x00500000
0x6210: 0x00000000
*
0x6250: 0x11111111
0x6254: 0x00000030
0x6258: 0x22000000
0x625c: 0x00002222
0x6260: 0x00000000
*
0x7000: 0x80038000
0x7004: 0x00000000
*
0x7010: 0x041001d0
0x7014: 0x11411442
0x7018: 0x00000000
*
0x7020: 0xc0000000
0x7024: 0x00000000
*
0x7108: 0x50000000
0x710c: 0x00000000
*
0x7200: 0x80004000
0x7204: 0x000aaaaa
0x7208: 0x00050005
0x720c: 0x00500000
0x7210: 0x00000000
*
0x7250: 0x11111111
0x7254: 0x00000030
0x7258: 0x22000000
0x725c: 0x00002222
0x7260: 0x00000000
-- <abort>
CPU: ID 0x906e9, Processor Type 0x0, Family 0x6, Model 0x9e, Stepping 0x9
Northbridge: 8086:5918 (7th generation (Kaby Lake family) Core Processor Xeon E3-1200)
Southbridge: 8086:a149 (C236)
Trying to reveal Primary to Sideband Bridge (P2SB),
let's hope the OS doesn't mind... done.
SBREG_BAR = 0xfd000000 (MEM)

Hiding Primary to Sideband Bridge (P2SB).

========== PCR 0xee ==========

PCR port offset: 0xee0000

0x0000: 0x00000000
0x0004: 0x8000000d
0x0008: 0xffffffff
*
0x4000: 0x00000000
*
0x4050: 0x0000ff00
*
0x4058: 0x00000000
-- <abort>
CPU: ID 0x906e9, Processor Type 0x0, Family 0x6, Model 0x9e, Stepping 0x9
Northbridge: 8086:5918 (7th generation (Kaby Lake family) Core Processor Xeon E3-1200)
Southbridge: 8086:a149 (C236)
Trying to reveal Primary to Sideband Bridge (P2SB),
let's hope the OS doesn't mind... done.
SBREG_BAR = 0xfd000000 (MEM)

Hiding Primary to Sideband Bridge (P2SB).

========== PCR 0xef ==========

PCR port offset: 0xef0000

0x0000: 0x00000000
*
0x2014: 0x80000003
0x2018: 0x00000000
*
0x2040: 0x87000080
0x2044: 0x00000000
*
0x2050: 0x000c2805
*
0x205c: 0x00000000
*
0x2088: 0x00109000
0x208c: 0x00000000
*
0x2094: 0x00002000
0x2098: 0x00000000
*
0x20ac: 0x40000000
0x20b0: 0x00000000
*
0x21a4: 0x00024c43
0x21a8: 0x40430003
0x21ac: 0x0000000e
0x21b0: 0x001f0003
0x21b4: 0x00000000
*
0x21bc: 0x77007f00
*
0x21c4: 0x00000000
*
0x2230: 0x00010000
0x2234: 0x8003001f
0x2238: 0x00000000
0x223c: 0x00600000
0x2240: 0x001a064a
0x2244: 0x003506bf
0x2248: 0x008b0718
0x224c: 0x00c90000
0x2250: 0x00e40000
0x2254: 0x003e059c
0x2258: 0x003d0bee
0x225c: 0x00000000
0x2260: 0x002a0cc9
0x2264: 0x00000000
*
0x2274: 0x002000b0
0x2278: 0x00000000
*
0x2298: 0x0012003c
0x229c: 0x00000000
0x22a0: 0x00110000
0x22a4: 0x002000b0
0x22a8: 0x00000000
*
0x2304: 0xc08b8400
0x2308: 0x2a000016
0x230c: 0x4abcb5bc
0x2310: 0x680960db
0x2314: 0x8a2800a8
0x2318: 0x3448f58e
0x231c: 0x101e0593
0x2320: 0x00000012
0x2324: 0x00a64f96
0x2328: 0x056a23d9
0x232c: 0x00100000
0x2330: 0x1b000b86
0x2334: 0x00000553
0x2338: 0x00009372
0x233c: 0x00000000
0x2340: 0x005b002d
0x2344: 0x14140000
0x2348: 0x00000000
0x234c: 0x00000028
0x2350: 0x14155555
0x2354: 0x00000054
0x2358: 0x00000000
*
0x2450: 0x00011100
0x2454: 0x00000000
*
0x2468: 0xa0080e00
0x246c: 0x00000000
*
0x2478: 0x2800002c
0x247c: 0x0000a001
0x2480: 0x00000000
*
0x2500: 0x006c8018
0x2504: 0x1c180685
0x2508: 0x00020100
0x250c: 0x047000dd
0x2510: 0x181835c0
0x2514: 0x0015b104
0x2518: 0x0000a016
0x251c: 0x1808200a
0x2520: 0x006c8018
0x2524: 0x1c180685
0x2528: 0x00020100
0x252c: 0x047000dd
0x2530: 0x181835c0
0x2534: 0x0015b104
0x2538: 0x0000a016
0x253c: 0x1808200a
0x2540: 0x006c8018
0x2544: 0x1c180685
0x2548: 0x00020100
0x254c: 0x047000dd
0x2550: 0x181835c0
0x2554: 0x0015b104
0x2558: 0x0000a016
0x255c: 0x1808200a
0x2560: 0x006c8018
0x2564: 0x1c180685
0x2568: 0x00020100
0x256c: 0x047000dd
0x2570: 0x181835c0
0x2574: 0x0015b104
0x2578: 0x0000a016
0x257c: 0x1808200a
0x2580: 0x00000000
*
0x2604: 0x0000000f
0x2608: 0x00000002
0x260c: 0x000000c8
0x2610: 0x00000000
0x2614: 0x00001000
0x2618: 0x00330031
0x261c: 0x00000000
*
0x2720: 0x00fc0000
0x2724: 0x00000004
0x2728: 0x00000000
*
0x2730: 0x00fc0201
0x2734: 0x003c0a01
0x2738: 0x00040069
0x273c: 0x000c0081
0x2740: 0x00000000
0x2744: 0x0000ffcf
0x2748: 0x00000000
0x274c: 0x00000001
0x2750: 0x00fcff01
0x2754: 0x000200f0
0x2758: 0x00000061
0x275c: 0x00010020
0x2760: 0x00000000
*
0x2770: 0x00000070
0x2774: 0x00000007
0x2778: 0x00000403
0x277c: 0x00000000
*
0x27ac: 0xfe00fe00
0x27b0: 0x800023a8
0x27b4: 0x00fc1801
0x27b8: 0x000023a8
0x27bc: 0x00000000
*
CPU: ID 0x906e9, Processor Type 0x0, Family 0x6, Model 0x9e, Stepping 0x9
Northbridge: 8086:5918 (7th generation (Kaby Lake family) Core Processor Xeon E3-1200)
Southbridge: 8086:a149 (C236)
Trying to reveal Primary to Sideband Bridge (P2SB),
let's hope the OS doesn't mind... done.
SBREG_BAR = 0xfd000000 (MEM)

Hiding Primary to Sideband Bridge (P2SB).

========== PCR 0xe9 ==========

PCR port offset: 0xe90000

0x0000: 0x80000100
0x0004: 0x00000044
0x0008: 0x00000000
*
0x0010: 0x723f0000
0x0014: 0x11000511
0x0018: 0x0209003c
0x001c: 0x60000000
0x0020: 0x0d071622
0x0024: 0xa40c0c0f
0x0028: 0x010201e0
0x002c: 0x00000000
0x0030: 0x80808080
0x0034: 0x2e2e2e2e
0x0038: 0x00000015
0x003c: 0x00008f02
0x0040: 0xff027f04
0x0044: 0x00004096
0x0048: 0x005a0001
0x004c: 0x001e0001
0x0050: 0x00000001
0x0054: 0x000f0000
0x0058: 0x2001030f
0x005c: 0x1f1f0000
0x0060: 0x18090e40
0x0064: 0xa0150009
0x0068: 0x00000000
*
0x0080: 0x00002e2e
0x0084: 0x00000000
0x0088: 0x2802372e
0x008c: 0x28282828
0x0090: 0x00000000
0x0094: 0x28292a00
0x0098: 0x151f2020
0x009c: 0x202a0000
0x00a0: 0x00000014
0x00a4: 0x4c4c4c4c
0x00a8: 0x200a1414
0x00ac: 0x000006e4
0x00b0: 0x080c0a10
0x00b4: 0x0c000000
0x00b8: 0x00140008
0x00bc: 0x00000000
0x00c0: 0x06080600
0x00c4: 0x00000a08
0x00c8: 0x5e4188e3
0x00cc: 0x201f0000
0x00d0: 0x00817eaa
0x00d4: 0x0f0fb400
0x00d8: 0x884b0eff
0x00dc: 0x284a0c00
0x00e0: 0x06060400
0x00e4: 0x00000000
*
0x00f0: 0x00200000
0x00f4: 0x00000000
*
0x0100: 0x0952550c
0x0104: 0x00050989
0x0108: 0xffe01840
0x010c: 0x00529b1f
0x0110: 0x00ba0155
0x0114: 0x0330631f
0x0118: 0x2e006ebf
0x011c: 0x003b0808
0x0120: 0x00004000
0x0124: 0xaa3360f8
0x0128: 0x08102000
0x012c: 0x000a200a
0x0130: 0xb6468050
0x0134: 0x00000000
0x0138: 0x000d0000
0x013c: 0x000000e0
0x0140: 0x0102cf36
*
0x014c: 0x0102cf37
0x0150: 0x003f3f3f
0x0154: 0x80c00000
0x0158: 0x8131a009
0x015c: 0x0060082a
0x0160: 0x00000000
0x0164: 0x00005400
0x0168: 0xb800822a
0x016c: 0x48042400
0x0170: 0x4040255a
0x0174: 0x80808040
0x0178: 0x40804060
0x017c: 0x40181818
0x0180: 0x00a80760
0x0184: 0xe0174000
0x0188: 0x24743000
0x018c: 0x0088887c
0x0190: 0x75503044
0x0194: 0x00000000
0x0198: 0x787c0000
0x019c: 0x00302e04
0x01a0: 0x1b000cec
0x01a4: 0x001b1b1b
0x01a8: 0x7e747e78
0x01ac: 0x000060f6
0x01b0: 0x24240000
0x01b4: 0x22811424
0x01b8: 0x06020080
0x01bc: 0x0000000c
0x01c0: 0x1b880000
0x01c4: 0xffffffff
0x01c8: 0x608d8850
0x01cc: 0x4017171b
0x01d0: 0x0000003c
0x01d4: 0x008000c0
0x01d8: 0x34000000
0x01dc: 0x13223824
0x01e0: 0x08000000
0x01e4: 0x4b0b0540
0x01e8: 0x18174800
0x01ec: 0x00000000
*
0x01f8: 0x00000100
*
0x0200: 0x80000100
0x0204: 0x00000044
0x0208: 0x00000000
*
0x0210: 0x723f0000
0x0214: 0x11000511
0x0218: 0x0209003c
0x021c: 0x60000000
0x0220: 0x0d071622
0x0224: 0xa40c0c0f
0x0228: 0x010201e0
0x022c: 0x00000000
0x0230: 0x80808080
0x0234: 0x2c2c2c2c
0x0238: 0x00000013
0x023c: 0x00008f02
0x0240: 0xff027f04
0x0244: 0x00004096
0x0248: 0x005a0001
0x024c: 0x001e0001
0x0250: 0x00000001
0x0254: 0x000f0000
0x0258: 0x2001030f
0x025c: 0x1f1f0000
0x0260: 0x18090e40
0x0264: 0xa0150009
0x0268: 0x00000000
*
0x0280: 0x00002c2c
0x0284: 0x00000000
0x0288: 0x2802342c
0x028c: 0x28282828
0x0290: 0x00000000
0x0294: 0x28292a00
0x0298: 0x151f2020
0x029c: 0x202a0000
0x02a0: 0x00000014
0x02a4: 0x4c4c4c4c
0x02a8: 0x200a1414
0x02ac: 0x000000e4
0x02b0: 0x080c0a10
0x02b4: 0x0c000000
0x02b8: 0x00140008
0x02bc: 0x00000000
0x02c0: 0x06080600
0x02c4: 0x00000a08
0x02c8: 0x5e4188e3
0x02cc: 0x201f0000
0x02d0: 0x00817eaa
0x02d4: 0x0f0fb400
0x02d8: 0x884b0cff
0x02dc: 0x284a0c00
0x02e0: 0x06060400
0x02e4: 0x00000000
*
0x02f0: 0x00200000
0x02f4: 0x00000000
*
0x0300: 0x0952550c
0x0304: 0x00050989
0x0308: 0xffe01840
0x030c: 0x00529b1f
0x0310: 0x00b80155
0x0314: 0x0330631b
0x0318: 0x2c006cbf
0x031c: 0x003b0608
0x0320: 0x00004000
0x0324: 0xaa3360f8
0x0328: 0x08102000
0x032c: 0x000a200a
0x0330: 0xbe468050
0x0334: 0x00000000
0x0338: 0x000d0000
0x033c: 0x000000e0
0x0340: 0x0102cf36
*
0x034c: 0x0102cf37
0x0350: 0x003f3f3f
0x0354: 0x80c00000
0x0358: 0x8131a009
0x035c: 0x0060082a
0x0360: 0x00000000
0x0364: 0x00005400
0x0368: 0xb800822a
0x036c: 0x48042400
0x0370: 0x4040255a
0x0374: 0x80808040
0x0378: 0x40804060
0x037c: 0x40181818
0x0380: 0x00a80760
0x0384: 0xe0174000
0x0388: 0x24743000
0x038c: 0x0088887c
0x0390: 0x75503044
0x0394: 0x00000000
0x0398: 0x7e7a7c7a
0x039c: 0x00302c00
0x03a0: 0x1b000aec
0x03a4: 0x7c1b1b1b
0x03a8: 0x7c787c7c
0x03ac: 0x000060f6
0x03b0: 0x36340000
0x03b4: 0x22813434
0x03b8: 0xf6fefc80
0x03bc: 0x00003e08
0x03c0: 0x1b880000
0x03c4: 0xffffffff
0x03c8: 0x608d8850
0x03cc: 0x4017171b
0x03d0: 0x0000003e
0x03d4: 0x008000c0
0x03d8: 0x32000000
0x03dc: 0x01263636
0x03e0: 0x08000000
0x03e4: 0x4b0b0540
0x03e8: 0x18174800
0x03ec: 0x00000000
*
0x03f8: 0x00000100
*
0x0400: 0x80000100
0x0404: 0x00000044
0x0408: 0x00000000
*
0x0410: 0x723f0000
0x0414: 0x11000511
0x0418: 0x0209003c
0x041c: 0x60000000
0x0420: 0x0d071622
0x0424: 0xa40b0a10
0x0428: 0x010201e0
0x042c: 0x00000000
0x0430: 0x80808080
0x0434: 0x2c2c2c2c
0x0438: 0x00000013
0x043c: 0x00008f02
0x0440: 0xff027f04
0x0444: 0x00004096
0x0448: 0x005a0001
0x044c: 0x001e0001
0x0450: 0x00000001
0x0454: 0x000f0000
0x0458: 0x2001030f
0x045c: 0x1f1f0001
0x0460: 0x18090e40
0x0464: 0x00000000
*
0x0488: 0x2802002c
0x048c: 0x28282828
0x0490: 0x00000000
0x0494: 0x28292a00
0x0498: 0x151f2020
0x049c: 0x202a0000
0x04a0: 0x00000014
0x04a4: 0x4c4c4c4c
0x04a8: 0x200a1414
0x04ac: 0x000016e4
0x04b0: 0x080c0a10
0x04b4: 0x0c000000
0x04b8: 0x00140008
0x04bc: 0x00000000
0x04c0: 0x06080600
0x04c4: 0x00000a08
0x04c8: 0x5e4188e3
0x04cc: 0x201f0000
0x04d0: 0x00817eaa
0x04d4: 0x0f0fb400
0x04d8: 0x884210ff
0x04dc: 0x284a0c00
0x04e0: 0x06060400
0x04e4: 0x00000000
*
0x04f0: 0x00200000
0x04f4: 0x00000000
*
0x0500: 0x0952a810
0x0504: 0x00050989
0x0508: 0xffe01840
0x050c: 0x00529b1f
0x0510: 0x00be0155
0x0514: 0x03306317
0x0518: 0x2c006cbf
0x051c: 0x003b0808
0x0520: 0x00004c00
0x0524: 0xaa3360f8
0x0528: 0x08102000
0x052c: 0x0008105a
0x0530: 0xbe46c050
0x0534: 0x00000000
0x0538: 0x000d0000
0x053c: 0x000000e0
0x0540: 0x0102cf36
*
0x054c: 0x0102c907
0x0550: 0x003f3f3f
0x0554: 0x80c00000
0x0558: 0x8131a408
0x055c: 0x0060082a
0x0560: 0x00000000
0x0564: 0x0008a008
0x0568: 0x88188206
0x056c: 0x48042400
0x0570: 0x33402158
0x0574: 0x80808040
0x0578: 0x40804060
0x057c: 0x40181818
0x0580: 0xc0a81760
0x0584: 0xe0174000
0x0588: 0x24740020
0x058c: 0x00080058
0x0590: 0x75503044
0x0594: 0x00000000
0x0598: 0x7a767800
0x059c: 0x00ac0000
0x05a0: 0x280010ec
0x05a4: 0x00282828
0x05a8: 0x7e767e7c
0x05ac: 0x000060f6
0x05b0: 0x36340000
0x05b4: 0x22813236
0x05b8: 0xf8fc0080
0x05bc: 0x00000006
0x05c0: 0x1b880000
0x05c4: 0xffffffff
0x05c8: 0x600d8850
0x05cc: 0x4017171b
0x05d0: 0x0000003c
0x05d4: 0x008000c0
0x05d8: 0x26000000
0x05dc: 0x13223426
0x05e0: 0x08000000
0x05e4: 0x1c0b0550
0x05e8: 0x18174800
0x05ec: 0x00000004
0x05f0: 0x28282820
0x05f4: 0x00000000
0x05f8: 0x00000100
*
0x0600: 0x80000100
0x0604: 0x00000044
0x0608: 0x00000000
*
0x0610: 0x723f0000
0x0614: 0x11000511
0x0618: 0x0209003c
0x061c: 0x60000000
0x0620: 0x0d071622
0x0624: 0xa40b0a10
0x0628: 0x010201e0
0x062c: 0x00000000
0x0630: 0x80808080
0x0634: 0x2e2e2e2e
0x0638: 0x00000015
0x063c: 0x00008f02
0x0640: 0xff027f0c
0x0644: 0x00004096
0x0648: 0x005a0001
0x064c: 0x001e0001
0x0650: 0x00000001
0x0654: 0x000f0000
0x0658: 0x2001030f
0x065c: 0x1f1f0001
0x0660: 0x18090e40
0x0664: 0xa0150007
0x0668: 0x00000000
*
0x0680: 0x1e1e2e2e
0x0684: 0x10100000
0x0688: 0x2802372e
0x068c: 0x28282828
0x0690: 0x00000000
0x0694: 0x28292a00
0x0698: 0x151f2020
0x069c: 0x202a0000
0x06a0: 0x00000014
0x06a4: 0x4c4c4c4c
0x06a8: 0x200a1414
0x06ac: 0x000010e4
0x06b0: 0x080c0a10
0x06b4: 0x0c000000
0x06b8: 0x00140008
0x06bc: 0x00000000
0x06c0: 0x06080600
0x06c4: 0x00000a08
0x06c8: 0x5e4188e3
0x06cc: 0x201f0000
0x06d0: 0x00817eaa
0x06d4: 0x0f0fb400
0x06d8: 0x884210ff
0x06dc: 0x204a0c00
0x06e0: 0x06060400
0x06e4: 0x00000000
*
0x06f0: 0x00200000
0x06f4: 0x00000000
*
0x0700: 0x09525910
0x0704: 0x00050989
0x0708: 0xffe01840
0x070c: 0x00529b1f
0x0710: 0x00b80155
0x0714: 0x0330631d
0x0718: 0x2e006ebf
0x071c: 0x003b0608
0x0720: 0x00004000
0x0724: 0xaa3360f8
0x0728: 0x08102000
0x072c: 0x000a200a
0x0730: 0xbe468050
0x0734: 0x00000000
0x0738: 0x000d0010
0x073c: 0x000000e0
0x0740: 0x0102cf36
*
0x0748: 0x0105194c
0x074c: 0x0102cf37
0x0750: 0x003f3f3f
0x0754: 0x80c00000
0x0758: 0x8131a009
0x075c: 0x0060082a
0x0760: 0x00000000
0x0764: 0x00005400
0x0768: 0xb800822a
0x076c: 0x48042400
0x0770: 0x3340255a
0x0774: 0x80808040
0x0778: 0x40804060
0x077c: 0x40181818
0x0780: 0x00a80760
0x0784: 0xe0174000
0x0788: 0x24743000
0x078c: 0x0008887c
0x0790: 0x75503044
0x0794: 0x00000000
0x0798: 0x767a7e7a
0x079c: 0x00302a7e
0x07a0: 0x1b000eec
0x07a4: 0x7e1b1b1b
0x07a8: 0x7e7a7e7c
0x07ac: 0x000060f6
0x07b0: 0x34360000
0x07b4: 0x22812630
0x07b8: 0xfefe0080
0x07bc: 0x00003c06
0x07c0: 0x1b880000
0x07c4: 0xffffffff
0x07c8: 0x608d8850
0x07cc: 0x4017171b
0x07d0: 0x0000003a
0x07d4: 0x008000c0
0x07d8: 0x36000000
0x07dc: 0x33323e36
0x07e0: 0x08000000
0x07e4: 0x4b0b0540
0x07e8: 0x18174800
0x07ec: 0x00000000
*
0x07f8: 0x00000100
*
0x0800: 0x80000100
0x0804: 0x00000044
0x0808: 0x00000000
*
0x0810: 0x723f0000
0x0814: 0x11000511
0x0818: 0x0209003c
0x081c: 0x60000000
0x0820: 0x0d071622
0x0824: 0xa40b0a10
0x0828: 0x010201e0
0x082c: 0x00000000
0x0830: 0x80808080
0x0834: 0x2e2e2e2e
0x0838: 0x00000015
0x083c: 0x00008f02
0x0840: 0xff027f04
0x0844: 0x00004096
0x0848: 0x005a0001
0x084c: 0x001e0001
0x0850: 0x00000001
0x0854: 0x000f0000
0x0858: 0x2001030f
0x085c: 0x1f1f0001
0x0860: 0x18090e40
0x0864: 0x00000000
*
0x0880: 0x1e1e2e2e
0x0884: 0x10100000
0x0888: 0x2802372e
0x088c: 0x28282828
0x0890: 0x00000000
0x0894: 0x28292a00
0x0898: 0x151f2020
0x089c: 0x202a0000
0x08a0: 0x00000014
0x08a4: 0x4c4c4c4c
0x08a8: 0x200a1414
0x08ac: 0x000016e4
0x08b0: 0x080c0a10
0x08b4: 0x0c000000
0x08b8: 0x00140008
0x08bc: 0x00000000
0x08c0: 0x06080600
0x08c4: 0x00000a08
0x08c8: 0x5e4188e3
0x08cc: 0x201f0000
0x08d0: 0x00817eaa
0x08d4: 0x0f0fb400
0x08d8: 0x884210ff
0x08dc: 0x287a0c00
0x08e0: 0x06060400
0x08e4: 0x00000000
*
0x08f0: 0x00200000
0x08f4: 0x00000000
*
0x0900: 0x0952a810
0x0904: 0x00050989
0x0908: 0xffe01840
0x090c: 0x00529b1f
0x0910: 0x00ba0155
0x0914: 0x0330631d
0x0918: 0x2e006ebf
0x091c: 0x003b0608
0x0920: 0x00004c00
0x0924: 0xaa3360f8
0x0928: 0x08102000
0x092c: 0x0008105a
0x0930: 0xbe44c050
0x0934: 0x00000000
0x0938: 0x000d0096
0x093c: 0x000099e0
0x0940: 0x0102cf36
*
0x094c: 0x0102c907
0x0950: 0x003f3f3f
0x0954: 0x80c00000
0x0958: 0x8131a408
0x095c: 0x0060082a
0x0960: 0x00000000
0x0964: 0x0008a008
0x0968: 0x88188206
0x096c: 0x48042400
0x0970: 0x33402158
0x0974: 0x80808040
0x0978: 0x40804060
0x097c: 0x40181818
0x0980: 0xc0a81760
0x0984: 0xe0174000
0x0988: 0x24740020
0x098c: 0x00080058
0x0990: 0x75503044
0x0994: 0x00000000
0x0998: 0x767c7a76
0x099c: 0x00ac0000
0x09a0: 0x280010ec
0x09a4: 0x00282828
0x09a8: 0x0276027c
0x09ac: 0x000060f6
0x09b0: 0x34360000
0x09b4: 0x22812232
0x09b8: 0xf402f680
0x09bc: 0x00003c06
0x09c0: 0x1b880000
0x09c4: 0xffffffff
0x09c8: 0x600d8850
0x09cc: 0x4017171b
0x09d0: 0x0000003e
0x09d4: 0x008000c0
0x09d8: 0x32000000
0x09dc: 0x13243c34
0x09e0: 0x08000000
0x09e4: 0x1c0b0550
0x09e8: 0x18174800
0x09ec: 0x00000004
0x09f0: 0x28282820
0x09f4: 0x00000000
0x09f8: 0x00000100
*
0x0a00: 0x80000100
0x0a04: 0x00000044
0x0a08: 0x00000000
*
0x0a10: 0x723f0000
0x0a14: 0x11000511
0x0a18: 0x0209003c
0x0a1c: 0x60000000
0x0a20: 0x0d071622
0x0a24: 0xa40b0a10
0x0a28: 0x010201e0
0x0a2c: 0x00000000
0x0a30: 0x80808080
0x0a34: 0x30303030
0x0a38: 0x00000017
0x0a3c: 0x00008f02
0x0a40: 0xff027f04
0x0a44: 0x00004096
0x0a48: 0x005a0001
0x0a4c: 0x001e0001
0x0a50: 0x00000001
0x0a54: 0x000f0000
0x0a58: 0x2001030f
0x0a5c: 0x1f1f0001
0x0a60: 0x18090e40
0x0a64: 0x00000000
*
0x0a88: 0x28020030
0x0a8c: 0x28282828
0x0a90: 0x00000000
0x0a94: 0x28292a00
0x0a98: 0x151f2020
0x0a9c: 0x202a0000
0x0aa0: 0x00000014
0x0aa4: 0x4c4c4c4c
0x0aa8: 0x200a1414
0x0aac: 0x000019e4
0x0ab0: 0x080c0a10
0x0ab4: 0x0c000000
0x0ab8: 0x00140008
0x0abc: 0x00000000
0x0ac0: 0x06080600
0x0ac4: 0x00000a08
0x0ac8: 0x5e4188e3
0x0acc: 0x201f0000
0x0ad0: 0x00817eaa
0x0ad4: 0x0f0fb400
0x0ad8: 0x884210ff
0x0adc: 0x284a0c00
0x0ae0: 0x06060400
0x0ae4: 0x00000000
*
0x0af0: 0x00200000
0x0af4: 0x00000000
*
0x0b00: 0x0952a810
0x0b04: 0x00050989
0x0b08: 0xffe01840
0x0b0c: 0x00529b1f
0x0b10: 0x00bc0155
0x0b14: 0x0330631b
0x0b18: 0x300070bf
0x0b1c: 0x003b0008
0x0b20: 0x00004c00
0x0b24: 0xaa3360f8
0x0b28: 0x08102000
0x0b2c: 0x0008105a
0x0b30: 0xbe46c050
0x0b34: 0x00000000
0x0b38: 0x000d0000
0x0b3c: 0x000000e0
0x0b40: 0x0102cf36
*
0x0b4c: 0x0102c907
0x0b50: 0x003f3f3f
0x0b54: 0x80c00000
0x0b58: 0x8131a408
0x0b5c: 0x0060082a
0x0b60: 0x00000000
0x0b64: 0x0008a008
0x0b68: 0x88188206
0x0b6c: 0x48042400
0x0b70: 0x33402158
0x0b74: 0x80808040
0x0b78: 0x40804060
0x0b7c: 0x40181818
0x0b80: 0xc0a81760
0x0b84: 0xe0174000
0x0b88: 0x24740020
0x0b8c: 0x00080058
0x0b90: 0x75503044
0x0b94: 0x00000000
0x0b98: 0x7e7e787a
0x0b9c: 0x00ac0000
0x0ba0: 0x280010ec
0x0ba4: 0x00282828
0x0ba8: 0x007e007a
0x0bac: 0x000060f6
0x0bb0: 0x26260000
0x0bb4: 0x22812226
0x0bb8: 0xf600fa80
0x0bbc: 0x00003c06
0x0bc0: 0x1b880000
0x0bc4: 0xffffffff
0x0bc8: 0x600d8850
0x0bcc: 0x4017171b
0x0bd0: 0x0000003e
0x0bd4: 0x008000c0
0x0bd8: 0x24000000
0x0bdc: 0x13222626
0x0be0: 0x08000000
0x0be4: 0x1c0b0550
0x0be8: 0x18174800
0x0bec: 0x00000004
0x0bf0: 0x28282820
0x0bf4: 0x00000000
0x0bf8: 0x00000100
*
0x0c00: 0x80000100
0x0c04: 0x00000044
0x0c08: 0x00000000
*
0x0c10: 0x723f0000
0x0c14: 0x11000511
0x0c18: 0x0209003c
0x0c1c: 0x60000000
0x0c20: 0x0d071622
0x0c24: 0xa40b0a10
0x0c28: 0x010201e0
0x0c2c: 0x00000000
0x0c30: 0x80808080
0x0c34: 0x2f2f2f2f
0x0c38: 0x00000016
0x0c3c: 0x00008f02
0x0c40: 0xff027f04
0x0c44: 0x00004096
0x0c48: 0x005a0001
0x0c4c: 0x001e0001
0x0c50: 0x00000001
0x0c54: 0x000f0000
0x0c58: 0x2001030f
0x0c5c: 0x1f1f0001
0x0c60: 0x18090e40
0x0c64: 0x00000000
*
0x0c88: 0x2802002f
0x0c8c: 0x28282828
0x0c90: 0x00000000
0x0c94: 0x28292a00
0x0c98: 0x151f2020
0x0c9c: 0x202a0000
0x0ca0: 0x00000014
0x0ca4: 0x4c4c4c4c
0x0ca8: 0x200a1414
0x0cac: 0x00001ae4
0x0cb0: 0x080c0a10
0x0cb4: 0x0c000000
0x0cb8: 0x00140008
0x0cbc: 0x00000000
0x0cc0: 0x06080600
0x0cc4: 0x00000a08
0x0cc8: 0x5e4188e3
0x0ccc: 0x201f0000
0x0cd0: 0x00817eaa
0x0cd4: 0x0f0fb400
0x0cd8: 0x884210ff
0x0cdc: 0x284a0c00
0x0ce0: 0x06060400
0x0ce4: 0x00000000
*
0x0cf0: 0x00200000
0x0cf4: 0x00000000
*
0x0d00: 0x0952a810
0x0d04: 0x00050989
0x0d08: 0xffe01840
0x0d0c: 0x00529b1f
0x0d10: 0x00b80155
0x0d14: 0x0330631d
0x0d18: 0x2f006fbf
0x0d1c: 0x003b0008
0x0d20: 0x00004c00
0x0d24: 0xaa3360f8
0x0d28: 0x08102000
0x0d2c: 0x0008105a
0x0d30: 0xbe46c050
0x0d34: 0x00000000
0x0d38: 0x000d0000
0x0d3c: 0x000000e0
0x0d40: 0x0102cf36
*
0x0d4c: 0x0102c907
0x0d50: 0x003f3f3f
0x0d54: 0x80c00000
0x0d58: 0x8131a408
0x0d5c: 0x0060082a
0x0d60: 0x00000000
0x0d64: 0x0008a008
0x0d68: 0x88188206
0x0d6c: 0x48042400
0x0d70: 0x33402158
0x0d74: 0x80808040
0x0d78: 0x40804060
0x0d7c: 0x40181818
0x0d80: 0xc0a81760
0x0d84: 0xe0174000
0x0d88: 0x24740020
0x0d8c: 0x00080058
0x0d90: 0x75503044
0x0d94: 0x00000000
0x0d98: 0x787c7878
0x0d9c: 0x00ac0000
0x0da0: 0x280010ec
0x0da4: 0x00282828
0x0da8: 0x007a007a
0x0dac: 0x000060f6
0x0db0: 0x26260000
0x0db4: 0x22812222
0x0db8: 0xf6fefc80
0x0dbc: 0x00003c0a
0x0dc0: 0x1b880000
0x0dc4: 0xffffffff
0x0dc8: 0x600d8850
0x0dcc: 0x4017171b
0x0dd0: 0x0000003e
0x0dd4: 0x008000c0
0x0dd8: 0x22000000
0x0ddc: 0x01143424
0x0de0: 0x08000000
0x0de4: 0x1c0b0550
0x0de8: 0x18174800
0x0dec: 0x00000004
0x0df0: 0x28282820
0x0df4: 0x00000000
0x0df8: 0x00000100
*
0x0e00: 0x80000100
0x0e04: 0x00000044
0x0e08: 0x00000000
*
0x0e10: 0x723f0000
0x0e14: 0x11000511
0x0e18: 0x0209003c
0x0e1c: 0x60000000
0x0e20: 0x0d071622
0x0e24: 0xa40b0a10
0x0e28: 0x010201e0
0x0e2c: 0x00000000
0x0e30: 0x80808080
0x0e34: 0x2e2e2e2e
0x0e38: 0x00000015
0x0e3c: 0x00008f02
0x0e40: 0xff027f04
0x0e44: 0x00004096
0x0e48: 0x005a0001
0x0e4c: 0x001e0001
0x0e50: 0x00000001
0x0e54: 0x000f0000
0x0e58: 0x2001030f
0x0e5c: 0x1f1f0001
0x0e60: 0x18090e40
0x0e64: 0x00000000
*
0x0e88: 0x2802002e
0x0e8c: 0x28282828
0x0e90: 0x00000000
0x0e94: 0x28292a00
0x0e98: 0x151f2020
0x0e9c: 0x202a0000
0x0ea0: 0x00000014
0x0ea4: 0x4c4c4c4c
0x0ea8: 0x200a1414
0x0eac: 0x00001ee4
0x0eb0: 0x080c0a10
0x0eb4: 0x0c000000
0x0eb8: 0x00140008
0x0ebc: 0x00000000
0x0ec0: 0x06080600
0x0ec4: 0x00000a08
0x0ec8: 0x5e4188e3
0x0ecc: 0x201f0000
0x0ed0: 0x00817eaa
0x0ed4: 0x0f0fb400
0x0ed8: 0x884210ff
0x0edc: 0x284a0c00
0x0ee0: 0x06060400
0x0ee4: 0x00000000
*
0x0ef0: 0x00200000
0x0ef4: 0x00000000
*
0x0f00: 0x0952a810
0x0f04: 0x00050989
0x0f08: 0xffe01840
0x0f0c: 0x00529b1f
0x0f10: 0x00bc0155
0x0f14: 0x0330631d
0x0f18: 0x2e006ebf
0x0f1c: 0x003b0208
0x0f20: 0x00004c00
0x0f24: 0xaa3360f8
0x0f28: 0x08102000
0x0f2c: 0x0008105a
0x0f30: 0xbe46c050
0x0f34: 0x00000000
0x0f38: 0x000d0000
0x0f3c: 0x000000e0
0x0f40: 0x0102cf36
*
0x0f4c: 0x0102c907
0x0f50: 0x003f3f3f
0x0f54: 0x80c00000
0x0f58: 0x8131a408
0x0f5c: 0x0060082a
0x0f60: 0x00000000
0x0f64: 0x0008a008
0x0f68: 0x88188206
0x0f6c: 0x48042400
0x0f70: 0x33402158
0x0f74: 0x80808040
0x0f78: 0x40804060
0x0f7c: 0x40181818
0x0f80: 0xc0a81760
0x0f84: 0xe0174000
0x0f88: 0x24740020
0x0f8c: 0x00080058
0x0f90: 0x75503044
0x0f94: 0x00000000
0x0f98: 0x787c7a7c
0x0f9c: 0x00ac0000
0x0fa0: 0x280010ec
0x0fa4: 0x00282828
0x0fa8: 0x7c707c70
0x0fac: 0x000060f6
0x0fb0: 0x36360000
0x0fb4: 0x22812434
0x0fb8: 0xfe02fe80
0x0fbc: 0x0000040c
0x0fc0: 0x1b880000
0x0fc4: 0xffffffff
0x0fc8: 0x600d8850
0x0fcc: 0x4017171b
0x0fd0: 0x0000003c
0x0fd4: 0x008000c0
0x0fd8: 0x28000000
0x0fdc: 0x13143624
0x0fe0: 0x08000000
0x0fe4: 0x1c0b0550
0x0fe8: 0x18174800
0x0fec: 0x00000004
0x0ff0: 0x28282820
0x0ff4: 0x00000000
0x0ff8: 0x00000100
*
0x1000: 0xffffffff
*
0x8000: 0x00130040
0x8004: 0x200000c0
0x8008: 0x00000000
0x800c: 0xa6a60000
0x8010: 0x80008000
0x8014: 0x000280a6
0x8018: 0x21958a01
0x801c: 0x00000246
0x8020: 0x050961f4
0x8024: 0x00000000
0x8028: 0x05000000
0x802c: 0x00000000
0x8030: 0x00300401
0x8034: 0x00000000
0x8038: 0x00001fff
0x803c: 0x00000006
0x8040: 0xffffffff
*
0x8070: 0x73f30000
0x8074: 0x00000000
*
0x8080: 0x003a3a00
0x8084: 0x18000500
0x8088: 0x00070040
0x808c: 0x01800000
0x8090: 0x25000300
0x8094: 0x00008000
0x8098: 0x00081000
0x809c: 0x80000080
0x80a0: 0x8670cc16
0x80a4: 0xc1382e05
0x80a8: 0x3c460880
0x80ac: 0x050f8240
0x80b0: 0x01c29044
0x80b4: 0x4050a015
0x80b8: 0xb00c1903
0x80bc: 0x000004c0
0x80c0: 0x00202000
0x80c4: 0x40000000
0x80c8: 0x00000000
*
0x80d0: 0x00001f70
0x80d4: 0x00000000
*
0x80dc: 0x00002000
0x80e0: 0x00000000
0x80e4: 0x00000500
0x80e8: 0x00403f7f
0x80ec: 0x40788007
0x80f0: 0x00403f7f
0x80f4: 0x00788007
0x80f8: 0x191cd4ac
0x80fc: 0x001a1000
0x8100: 0x555555d0
0x8104: 0x00000000
0x8108: 0x0021051c
0x810c: 0x00000000
0x8110: 0x08010804
0x8114: 0x00000000
*
0x8120: 0x000c0205
0x8124: 0x00000202
0x8128: 0x000f000e
0x812c: 0x0000030a
0x8130: 0x70000000
0x8134: 0x00000000
*
0x815c: 0x155555d0
0x8160: 0x0000211c
0x8164: 0x00000e31
0x8168: 0x02050000
0x816c: 0x00000000
0x8170: 0x6f401300
0x8174: 0x3428a8ce
0x8178: 0x01d401d2
0x817c: 0x0d070865
0x8180: 0x555555d0
0x8184: 0x00000000
0x8188: 0x0021051c
0x818c: 0x00000000
0x8190: 0x08010804
0x8194: 0x00000000
*
0x81a0: 0x000c0205
0x81a4: 0x00000202
0x81a8: 0x000f000e
0x81ac: 0x0000030a
0x81b0: 0x70000000
0x81b4: 0x00000000
*
0x81dc: 0x155555d0
0x81e0: 0x0000211c
0x81e4: 0x00000def
0x81e8: 0x01e90000
0x81ec: 0x00000000
0x81f0: 0x6c401100
0x81f4: 0x3428a8cc
0x81f8: 0x01d401d2
0x81fc: 0x0d070865
0x8200: 0xffffffff
*
CPU: ID 0x906e9, Processor Type 0x0, Family 0x6, Model 0x9e, Stepping 0x9
Northbridge: 8086:5918 (7th generation (Kaby Lake family) Core Processor Xeon E3-1200)
Southbridge: 8086:a149 (C236)
Trying to reveal Primary to Sideband Bridge (P2SB),
let's hope the OS doesn't mind... done.
SBREG_BAR = 0xfd000000 (MEM)

Hiding Primary to Sideband Bridge (P2SB).

========== PCR 0xea ==========

PCR port offset: 0xea0000

0x0000: 0x80000100
0x0004: 0x00000044
0x0008: 0x00000000
*
0x0010: 0x723f0000
0x0014: 0x11000511
0x0018: 0x0209003c
0x001c: 0x60000000
0x0020: 0x0d071622
0x0024: 0xa40c0c0f
0x0028: 0x010201e0
0x002c: 0x00000000
0x0030: 0x80808080
0x0034: 0x2f2f2f2f
0x0038: 0x00000016
0x003c: 0x00008f02
0x0040: 0xff027f04
0x0044: 0x00004096
0x0048: 0x005a0001
0x004c: 0x001e0001
0x0050: 0x00000001
0x0054: 0x000f0000
0x0058: 0x2001030f
0x005c: 0x1f1f0000
0x0060: 0x18090e40
0x0064: 0xa0150009
0x0068: 0x00000000
*
0x0080: 0x00002f2f
0x0084: 0x00000000
0x0088: 0x2802382f
0x008c: 0x28282828
0x0090: 0x00000000
0x0094: 0x28292a00
0x0098: 0x151f2020
0x009c: 0x202a0000
0x00a0: 0x00000014
0x00a4: 0x4c4c4c4c
0x00a8: 0x200a1414
0x00ac: 0x00000ee4
0x00b0: 0x080c0a10
0x00b4: 0x0c000000
0x00b8: 0x00140008
0x00bc: 0x00000000
0x00c0: 0x06080600
0x00c4: 0x00000a08
0x00c8: 0x5e4188e3
0x00cc: 0x201f0000
0x00d0: 0x00817eaa
0x00d4: 0x0f0fb400
0x00d8: 0x884310ff
0x00dc: 0x284a0c00
0x00e0: 0x06060400
0x00e4: 0x00000000
*
0x00f0: 0x00200000
0x00f4: 0x00000000
*
0x0100: 0x0952550c
0x0104: 0x00050989
0x0108: 0xffe01840
0x010c: 0x00529b1f
0x0110: 0x00b40155
0x0114: 0x0330631d
0x0118: 0x2f006fbf
0x011c: 0x003b0608
0x0120: 0x00004000
0x0124: 0xaa3360f8
0x0128: 0x08102000
0x012c: 0x000a200a
0x0130: 0xb6468050
0x0134: 0x00000000
0x0138: 0x000d0000
0x013c: 0x000000e0
0x0140: 0x0102cf36
*
0x014c: 0x0102cf37
0x0150: 0x003f3f3f
0x0154: 0x80c00000
0x0158: 0x8131a009
0x015c: 0x0060082a
0x0160: 0x00000000
0x0164: 0x00005400
0x0168: 0xb800822a
0x016c: 0x48042400
0x0170: 0x4040255a
0x0174: 0x80808040
0x0178: 0x40804060
0x017c: 0x40181818
0x0180: 0x00a80760
0x0184: 0xe0174000
0x0188: 0x24743000
0x018c: 0x0088887c
0x0190: 0x75503044
0x0194: 0x00000000
0x0198: 0x7a767c7e
0x019c: 0x00302600
0x01a0: 0x1b000cec
0x01a4: 0x7e1b1b1b
0x01a8: 0x7e707e7c
0x01ac: 0x000060f6
0x01b0: 0x32320000
0x01b4: 0x22812426
0x01b8: 0xfefa0080
0x01bc: 0x00000004
0x01c0: 0x1b880000
0x01c4: 0xffffffff
0x01c8: 0x608d8850
0x01cc: 0x4017171b
0x01d0: 0x0000003e
0x01d4: 0x008000c0
0x01d8: 0x26000000
0x01dc: 0x13223424
0x01e0: 0x08000000
0x01e4: 0x4b0b0540
0x01e8: 0x18174800
0x01ec: 0x00000000
*
0x01f8: 0x00000100
*
0x0200: 0x80000100
0x0204: 0x00000044
0x0208: 0x00000000
*
0x0210: 0x723f0000
0x0214: 0x11000511
0x0218: 0x0209003c
0x021c: 0x60000000
0x0220: 0x0d071622
0x0224: 0xa40c0c0f
0x0228: 0x010201e0
0x022c: 0x00000000
0x0230: 0x80808080
0x0234: 0x2e2e2e2e
0x0238: 0x00000015
0x023c: 0x00008f02
0x0240: 0xff027f04
0x0244: 0x00004096
0x0248: 0x005a0001
0x024c: 0x001e0001
0x0250: 0x00000001
0x0254: 0x000f0000
0x0258: 0x2001030f
0x025c: 0x1f1f0000
0x0260: 0x18090e40
0x0264: 0xa0150009
0x0268: 0x00000000
*
0x0280: 0x00002e2e
0x0284: 0x00000000
0x0288: 0x2802372e
0x028c: 0x28282828
0x0290: 0x00000000
0x0294: 0x28292a00
0x0298: 0x151f2020
0x029c: 0x202a0000
0x02a0: 0x00000014
0x02a4: 0x4c4c4c4c
0x02a8: 0x200a1414
0x02ac: 0x00000ae4
0x02b0: 0x080c0a10
0x02b4: 0x0c000000
0x02b8: 0x00140008
0x02bc: 0x00000000
0x02c0: 0x06080600
0x02c4: 0x00000a08
0x02c8: 0x5e4188e3
0x02cc: 0x201f0000
0x02d0: 0x00817eaa
0x02d4: 0x0f0fb400
0x02d8: 0x884710ff
0x02dc: 0x284a0c00
0x02e0: 0x06060400
0x02e4: 0x00000000
*
0x02f0: 0x00200000
0x02f4: 0x00000000
*
0x0300: 0x0952550c
0x0304: 0x00050989
0x0308: 0xffe01840
0x030c: 0x00529b1f
0x0310: 0x00b80155
0x0314: 0x0330631b
0x0318: 0x2e006ebf
0x031c: 0x003b0408
0x0320: 0x00004000
0x0324: 0xaa3360f8
0x0328: 0x08102000
0x032c: 0x000a200a
0x0330: 0xba468050
0x0334: 0x00000000
0x0338: 0x000d0000
0x033c: 0x000000e0
0x0340: 0x0102cf36
*
0x034c: 0x0102cf37
0x0350: 0x003f3f3f
0x0354: 0x80c00000
0x0358: 0x8131a009
0x035c: 0x0060082a
0x0360: 0x00000000
0x0364: 0x00005400
0x0368: 0xb800822a
0x036c: 0x48042400
0x0370: 0x4040255a
0x0374: 0x80808040
0x0378: 0x40804060
0x037c: 0x40181818
0x0380: 0x00a80760
0x0384: 0xe0174000
0x0388: 0x24743000
0x038c: 0x0088887c
0x0390: 0x75503044
0x0394: 0x00000000
0x0398: 0x727e7878
0x039c: 0x00302802
0x03a0: 0x1b000cec
0x03a4: 0x761b1b1b
0x03a8: 0x7e7c7e78
0x03ac: 0x000060f6
0x03b0: 0x26320000
0x03b4: 0x22812216
0x03b8: 0xf4fefc80
0x03bc: 0x00003c00
0x03c0: 0x1b880000
0x03c4: 0xffffffff
0x03c8: 0x608d8850
0x03cc: 0x4017171b
0x03d0: 0x0000003c
0x03d4: 0x008000c0
0x03d8: 0x32000000
0x03dc: 0x03263834
0x03e0: 0x08000000
0x03e4: 0x4b0b0540
0x03e8: 0x18174800
0x03ec: 0x00000000
*
0x03f8: 0x00000100
*
0x0400: 0x80000100
0x0404: 0x00000044
0x0408: 0x00000000
*
0x0410: 0x723f0000
0x0414: 0x11000511
0x0418: 0x0209003c
0x041c: 0x60000000
0x0420: 0x0d071622
0x0424: 0xa40c0c0f
0x0428: 0x010201e0
0x042c: 0x00000000
0x0430: 0x80808080
0x0434: 0x2f2f2f2f
0x0438: 0x00000016
0x043c: 0x00008f02
0x0440: 0xff027f04
0x0444: 0x00004096
0x0448: 0x005a0001
0x044c: 0x001e0001
0x0450: 0x00000001
0x0454: 0x000f0000
0x0458: 0x2001030f
0x045c: 0x1f1f0000
0x0460: 0x18090e40
0x0464: 0xa0150009
0x0468: 0x00000000
*
0x0480: 0x00002f2f
0x0484: 0x00000000
0x0488: 0x2802382f
0x048c: 0x28282828
0x0490: 0x00000000
0x0494: 0x28292a00
0x0498: 0x151f2020
0x049c: 0x202a0000
0x04a0: 0x00000014
0x04a4: 0x4c4c4c4c
0x04a8: 0x200a1414
0x04ac: 0x000016e4
0x04b0: 0x080c0a10
0x04b4: 0x0c000000
0x04b8: 0x00140008
0x04bc: 0x00000000
0x04c0: 0x06080600
0x04c4: 0x00000a08
0x04c8: 0x5e4188e3
0x04cc: 0x201f0000
0x04d0: 0x00817eaa
0x04d4: 0x0f0fb400
0x04d8: 0x88410eff
0x04dc: 0x284a0c00
0x04e0: 0x06060400
0x04e4: 0x00000000
*
0x04f0: 0x00200000
0x04f4: 0x00000000
*
0x0500: 0x0952550c
0x0504: 0x00050989
0x0508: 0xffe01840
0x050c: 0x00529b1f
0x0510: 0x00b80155
0x0514: 0x0330631f
0x0518: 0x2f006fbf
0x051c: 0x003b0a08
0x0520: 0x00004000
0x0524: 0xaa3360f8
0x0528: 0x08102000
0x052c: 0x000a200a
0x0530: 0xba468050
0x0534: 0x00000000
0x0538: 0x000d0000
0x053c: 0x000000e0
0x0540: 0x0102cf36
*
0x054c: 0x0102cf37
0x0550: 0x003f3f3f
0x0554: 0x80c00000
0x0558: 0x8131a009
0x055c: 0x0060082a
0x0560: 0x00000000
0x0564: 0x00005400
0x0568: 0xb800822a
0x056c: 0x48042400
0x0570: 0x4040255a
0x0574: 0x80808040
0x0578: 0x40804060
0x057c: 0x40181818
0x0580: 0x00a80760
0x0584: 0xe0174000
0x0588: 0x24743000
0x058c: 0x0088887c
0x0590: 0x75503044
0x0594: 0x00000000
0x0598: 0x78767678
0x059c: 0x00302802
0x05a0: 0x1b000eec
0x05a4: 0x741b1b1b
0x05a8: 0x7c747c7a
0x05ac: 0x000060f6
0x05b0: 0x34260000
0x05b4: 0x22812426
0x05b8: 0xfafcf680
0x05bc: 0x00003e0a
0x05c0: 0x1b880000
0x05c4: 0xffffffff
0x05c8: 0x608d8850
0x05cc: 0x4017171b
0x05d0: 0x00000002
0x05d4: 0x008000c0
0x05d8: 0x32000000
0x05dc: 0x03163626
0x05e0: 0x08000000
0x05e4: 0x4b0b0540
0x05e8: 0x18174800
0x05ec: 0x00000000
*
0x05f8: 0x00000100
*
0x0600: 0x80000100
0x0604: 0x00000044
0x0608: 0x00000000
*
0x0610: 0x723f0000
0x0614: 0x11000511
0x0618: 0x0209003c
0x061c: 0x60000000
0x0620: 0x0d071622
0x0624: 0xa40c0c0f
0x0628: 0x010201e0
0x062c: 0x00000000
0x0630: 0x80808080
0x0634: 0x2f2f2f2f
0x0638: 0x00000016
0x063c: 0x00008f02
0x0640: 0xff027f04
0x0644: 0x00004096
0x0648: 0x005a0001
0x064c: 0x001e0001
0x0650: 0x00000001
0x0654: 0x000f0000
0x0658: 0x2001030f
0x065c: 0x1f1f0000
0x0660: 0x18090e40
0x0664: 0xa0150009
0x0668: 0x00000000
*
0x0680: 0x00002f2f
0x0684: 0x00000000
0x0688: 0x2802382f
0x068c: 0x28282828
0x0690: 0x00000000
0x0694: 0x28292a00
0x0698: 0x151f2020
0x069c: 0x202a0000
0x06a0: 0x00000014
0x06a4: 0x4c4c4c4c
0x06a8: 0x200a1414
0x06ac: 0x000009e4
0x06b0: 0x080c0a10
0x06b4: 0x0c000000
0x06b8: 0x00140008
0x06bc: 0x00000000
0x06c0: 0x06080600
0x06c4: 0x00000a08
0x06c8: 0x5e4188e3
0x06cc: 0x201f0000
0x06d0: 0x00817eaa
0x06d4: 0x0f0fb400
0x06d8: 0x88470eff
0x06dc: 0x284a0c00
0x06e0: 0x06060400
0x06e4: 0x00000000
*
0x06f0: 0x00200000
0x06f4: 0x00000000
*
0x0700: 0x0952550c
0x0704: 0x00050989
0x0708: 0xffe01840
0x070c: 0x00529b1f
0x0710: 0x00ba0155
0x0714: 0x0330631f
0x0718: 0x2f006fbf
0x071c: 0x003b0208
0x0720: 0x00004000
0x0724: 0xaa3360f8
0x0728: 0x08102000
0x072c: 0x000a200a
0x0730: 0xbe468050
0x0734: 0x00000000
0x0738: 0x000d0000
0x073c: 0x000000e0
0x0740: 0x0102cf36
*
0x074c: 0x0102cf37
0x0750: 0x003f3f3f
0x0754: 0x80c00000
0x0758: 0x8131a009
0x075c: 0x0060082a
0x0760: 0x00000000
0x0764: 0x00005400
0x0768: 0xb800822a
0x076c: 0x48042400
0x0770: 0x4040255a
0x0774: 0x80808040
0x0778: 0x40804060
0x077c: 0x40181818
0x0780: 0x00a80760
0x0784: 0xe0174000
0x0788: 0x24743000
0x078c: 0x0088887c
0x0790: 0x75503044
0x0794: 0x00000000
0x0798: 0x7c7c7c76
0x079c: 0x00302604
0x07a0: 0x1b000aec
0x07a4: 0x761b1b1b
0x07a8: 0x7a007a7e
0x07ac: 0x000060f6
0x07b0: 0x26320000
0x07b4: 0x22812426
0x07b8: 0xfafefc80
0x07bc: 0x00003e06
0x07c0: 0x1b880000
0x07c4: 0xffffffff
0x07c8: 0x608d8850
0x07cc: 0x4017171b
0x07d0: 0x00000002
0x07d4: 0x008000c0
0x07d8: 0x26000000
0x07dc: 0x11223432
0x07e0: 0x08000000
0x07e4: 0x4b0b0540
0x07e8: 0x18174800
0x07ec: 0x00000000
*
0x07f8: 0x00000100
*
0x0800: 0x80000100
0x0804: 0x00000044
0x0808: 0x00000000
*
0x0810: 0x723f0000
0x0814: 0x11000511
0x0818: 0x0209003c
0x081c: 0x60000000
0x0820: 0x0d071622
0x0824: 0xa40c0c0f
0x0828: 0x010201e0
0x082c: 0x00000000
0x0830: 0x80808080
0x0834: 0x2e2e2e2e
0x0838: 0x00000015
0x083c: 0x00008f02
0x0840: 0xff027f04
0x0844: 0x00004096
0x0848: 0x005a0001
0x084c: 0x001e0001
0x0850: 0x00000001
0x0854: 0x000f0000
0x0858: 0x2001030f
0x085c: 0x1f1f0000
0x0860: 0x18090e40
0x0864: 0xa0150009
0x0868: 0x00000000
*
0x0880: 0x00002e2e
0x0884: 0x00000000
0x0888: 0x2802372e
0x088c: 0x28282828
0x0890: 0x00000000
0x0894: 0x28292a00
0x0898: 0x151f2020
0x089c: 0x202a0000
0x08a0: 0x00000014
0x08a4: 0x4c4c4c4c
0x08a8: 0x200a1414
0x08ac: 0x000009e4
0x08b0: 0x080c0a10
0x08b4: 0x0c000000
0x08b8: 0x00140008
0x08bc: 0x00000000
0x08c0: 0x06080600
0x08c4: 0x00000a08
0x08c8: 0x5e4188e3
0x08cc: 0x201f0000
0x08d0: 0x00817eaa
0x08d4: 0x0f0fb400
0x08d8: 0x884711ff
0x08dc: 0x284a0c00
0x08e0: 0x06060400
0x08e4: 0x00000000
*
0x08f0: 0x00200000
0x08f4: 0x00000000
*
0x0900: 0x0952550c
0x0904: 0x00050989
0x0908: 0xffe01840
0x090c: 0x00529b1f
0x0910: 0x00ba0155
0x0914: 0x0330631b
0x0918: 0x2e006ebf
0x091c: 0x003b0608
0x0920: 0x00004000
0x0924: 0xaa3360f8
0x0928: 0x08102000
0x092c: 0x000a200a
0x0930: 0xbe468050
0x0934: 0x00000000
0x0938: 0x000d0000
0x093c: 0x000000e0
0x0940: 0x0102cf36
*
0x094c: 0x0102cf37
0x0950: 0x003f3f3f
0x0954: 0x80c00000
0x0958: 0x8131a009
0x095c: 0x0060082a
0x0960: 0x00000000
0x0964: 0x00005400
0x0968: 0xb800822a
0x096c: 0x48042400
0x0970: 0x4040255a
0x0974: 0x80808040
0x0978: 0x40804060
0x097c: 0x40181818
0x0980: 0x00a80760
0x0984: 0xe0174000
0x0988: 0x24743000
0x098c: 0x0088887c
0x0990: 0x75503044
0x0994: 0x00000000
0x0998: 0x767c787c
0x099c: 0x00302802
0x09a0: 0x1b000cec
0x09a4: 0x7e1b1b1b
0x09a8: 0x0072007a
0x09ac: 0x000060f6
0x09b0: 0x36320000
0x09b4: 0x22812232
0x09b8: 0xf600f880
0x09bc: 0x00003e04
0x09c0: 0x1b880000
0x09c4: 0xffffffff
0x09c8: 0x608d8850
0x09cc: 0x4017171b
0x09d0: 0x0000003e
0x09d4: 0x008000c0
0x09d8: 0x26000000
0x09dc: 0x33223832
0x09e0: 0x08000000
0x09e4: 0x4b0b0540
0x09e8: 0x18174800
0x09ec: 0x00000000
*
0x09f8: 0x00000100
*
0x0a00: 0x80000100
0x0a04: 0x00000044
0x0a08: 0x00000000
*
0x0a10: 0x723f0000
0x0a14: 0x11000511
0x0a18: 0x0209003c
0x0a1c: 0x60000000
0x0a20: 0x0d071622
0x0a24: 0xa40c0c0f
0x0a28: 0x010201e0
0x0a2c: 0x00000000
0x0a30: 0x80808080
0x0a34: 0x2e2e2e2e
0x0a38: 0x00000015
0x0a3c: 0x00008f02
0x0a40: 0xff027f04
0x0a44: 0x00004096
0x0a48: 0x005a0001
0x0a4c: 0x001e0001
0x0a50: 0x00000001
0x0a54: 0x000f0000
0x0a58: 0x2001030f
0x0a5c: 0x1f1f0000
0x0a60: 0x18090e40
0x0a64: 0xa0150009
0x0a68: 0x00000000
*
0x0a80: 0x00002e2e
0x0a84: 0x00000000
0x0a88: 0x2802372e
0x0a8c: 0x28282828
0x0a90: 0x00000000
0x0a94: 0x28292a00
0x0a98: 0x151f2020
0x0a9c: 0x202a0000
0x0aa0: 0x00000014
0x0aa4: 0x4c4c4c4c
0x0aa8: 0x200a1414
0x0aac: 0x000018e4
0x0ab0: 0x080c0a10
0x0ab4: 0x0c000000
0x0ab8: 0x00140008
0x0abc: 0x00000000
0x0ac0: 0x06080600
0x0ac4: 0x00000a08
0x0ac8: 0x5e4188e3
0x0acc: 0x201f0000
0x0ad0: 0x00817eaa
0x0ad4: 0x0f0fb400
0x0ad8: 0x88470fff
0x0adc: 0x284a0c00
0x0ae0: 0x06060400
0x0ae4: 0x00000000
*
0x0af0: 0x00200000
0x0af4: 0x00000000
*
0x0b00: 0x0952550c
0x0b04: 0x00050989
0x0b08: 0xffe01840
0x0b0c: 0x00529b1f
0x0b10: 0x00b80155
0x0b14: 0x0330631f
0x0b18: 0x2e006ebf
0x0b1c: 0x003b0608
0x0b20: 0x00004000
0x0b24: 0xaa3360f8
0x0b28: 0x08102000
0x0b2c: 0x000a200a
0x0b30: 0xbe468050
0x0b34: 0x00000000
0x0b38: 0x000d0000
0x0b3c: 0x000000e0
0x0b40: 0x0102cf36
*
0x0b4c: 0x0102cf37
0x0b50: 0x003f3f3f
0x0b54: 0x80c00000
0x0b58: 0x8131a009
0x0b5c: 0x0060082a
0x0b60: 0x00000000
0x0b64: 0x00005400
0x0b68: 0xb800822a
0x0b6c: 0x48042400
0x0b70: 0x4040255a
0x0b74: 0x80808040
0x0b78: 0x40804060
0x0b7c: 0x40181818
0x0b80: 0x00a80760
0x0b84: 0xe0174000
0x0b88: 0x24743000
0x0b8c: 0x0088887c
0x0b90: 0x75503044
0x0b94: 0x00000000
0x0b98: 0x747e747c
0x0b9c: 0x00302c00
0x0ba0: 0x1b000cec
0x0ba4: 0x7e1b1b1b
0x0ba8: 0x787e787e
0x0bac: 0x000060f6
0x0bb0: 0x34340000
0x0bb4: 0x22812426
0x0bb8: 0xee00fe80
0x0bbc: 0x00003a00
0x0bc0: 0x1b880000
0x0bc4: 0xffffffff
0x0bc8: 0x608d8850
0x0bcc: 0x4017171b
0x0bd0: 0x0000003a
0x0bd4: 0x008000c0
0x0bd8: 0x26000000
0x0bdc: 0x13243634
0x0be0: 0x08000000
0x0be4: 0x4b0b0540
0x0be8: 0x18174800
0x0bec: 0x00000000
*
0x0bf8: 0x00000100
*
0x0c00: 0xffffffff
*
0x8000: 0x00130034
0x8004: 0x200000e0
0x8008: 0x00000000
0x800c: 0xbcbc0000
0x8010: 0x80008000
0x8014: 0x000280bc
0x8018: 0x21000001
0x801c: 0x00000000
0x8020: 0x050961f4
0x8024: 0x00000000
0x8028: 0x05000000
0x802c: 0x00000000
0x8030: 0x00300401
0x8034: 0x00000000
0x8038: 0x00001fff
0x803c: 0x00000006
0x8040: 0xffffffff
*
0x8070: 0x716b0000
0x8074: 0x00000000
*
0x8080: 0x003a3a00
0x8084: 0x00000500
0x8088: 0x00000068
0x808c: 0x00000000
0x8090: 0x25000300
0x8094: 0x00008000
0x8098: 0x00000000
0x809c: 0x80000080
0x80a0: 0x8670cc16
0x80a4: 0xc1382e05
0x80a8: 0x3c460880
0x80ac: 0x050f8240
0x80b0: 0x01c29044
0x80b4: 0x4050a015
0x80b8: 0xb00c1903
0x80bc: 0x000004c0
0x80c0: 0x00202000
0x80c4: 0x40000000
0x80c8: 0x00000000
*
0x80d0: 0x00001f70
0x80d4: 0x00000000
*
0x80dc: 0x00002000
0x80e0: 0x00000000
0x80e4: 0x00000500
0x80e8: 0x00403f7f
0x80ec: 0x40788007
0x80f0: 0x00403f7f
0x80f4: 0x00788007
0x80f8: 0x4100d4ac
0x80fc: 0x00000000
0x8100: 0x55555579
0x8104: 0x00000000
0x8108: 0x0000011f
0x810c: 0x00000000
0x8110: 0x0a010703
0x8114: 0x00000000
*
0x8120: 0x00000200
0x8124: 0x00000202
0x8128: 0x000f0009
0x812c: 0x0000030a
0x8130: 0x78003c00
0x8134: 0x00000000
*
0x815c: 0x00000079
0x8160: 0x00000000
*
0x8168: 0x01ff0000
0x816c: 0x00000000
0x8170: 0x01400000
0x8174: 0xff303c76
0x8178: 0x00000000
0x817c: 0x2000000f
0x8180: 0x55555579
0x8184: 0x00000000
0x8188: 0x0000011f
0x818c: 0x00000000
0x8190: 0x0a010703
0x8194: 0x00000000
*
0x81a0: 0x00000200
0x81a4: 0x00000202
0x81a8: 0x000f0009
0x81ac: 0x0000030a
0x81b0: 0x78003c00
0x81b4: 0x00000000
*
0x81dc: 0x00000079
0x81e0: 0x00000000
*
0x81e8: 0x01ff0000
0x81ec: 0x00000000
0x81f0: 0x01400000
0x81f4: 0xff303c76
0x81f8: 0x00000000
0x81fc: 0x2000000f
0x8200: 0xffffffff
*
