CPU: ID 0x906e9, Processor Type 0x0, Family 0x6, Model 0x9e, Stepping 0x9
Northbridge: 8086:5918 (7th generation (Kaby Lake family) Core Processor Xeon E3-1200)
Southbridge: 8086:a149 (C236)
Trying to reveal Primary to Sideband Bridge (P2SB),
let's hope the OS doesn't mind... done.
SBREG_BAR = 0xfd000000 (MEM)

Hiding Primary to Sideband Bridge (P2SB).

============= GPIOS =============

------- GPIO Community 0 -------

PCR Port ID: 0xaf0000

------- GPIO Group GPP_A -------
0x0400: 0x0000001884000502 GPP_A0       RCIN#               
0x0408: 0x0000301984000402 GPP_A1       LAD0                
0x0410: 0x0000301a84000402 GPP_A2       LAD1                
0x0418: 0x0000301b84000402 GPP_A3       LAD2                
0x0420: 0x0000301c84000402 GPP_A4       LAD3                
0x0428: 0x0000001d84000600 GPP_A5       LFRAME#             
0x0430: 0x0000001e84000402 GPP_A6       SERIRQ              
0x0438: 0x0000001f84000502 GPP_A7       PIRQA#              
0x0440: 0x0000002084000500 GPP_A8       CLKRUN#             
0x0448: 0x0000102184000600 GPP_A9       CLKOUT_LPC0         
0x0450: 0x0000102284000600 GPP_A10      CLKOUT_LPC1         
0x0458: 0x0000002384000502 GPP_A11      PME#                
0x0460: 0x0000002484000502 GPP_A12      BM_BUSY#            
0x0468: 0x0000002544000600 GPP_A13      SUSWARN#/SUSPWRDNACK
0x0470: 0x0000002644000600 GPP_A14      SUS_STAT#           
0x0478: 0x0000302744000502 GPP_A15      SUS_ACK#            
0x0480: 0x0000302844000200 GPP_A16      GPIO                
0x0488: 0x0000002984000201 GPP_A17      GPIO                
0x0490: 0x0000002a84000200 GPP_A18      GPIO                
0x0498: 0x0000302b44000200 GPP_A19      GPIO                
0x04a0: 0x0000002c84000200 GPP_A20      GPIO                
0x04a8: 0x0000002d84000100 GPP_A21      GPIO                
0x04b0: 0x0000002e84000102 GPP_A22      GPIO                
0x04b8: 0x0000002f84000102 GPP_A23      GPIO                
------- GPIO Group GPP_B -------
0x04c0: 0x0000003084000200 GPP_B0       GPIO                
0x04c8: 0x0000003184000200 GPP_B1       GPIO                
0x04d0: 0x0000003284000502 GPP_B2       VRALERT#            
0x04d8: 0x0000003384000200 GPP_B3       GPIO                
0x04e0: 0x0000003484000200 GPP_B4       GPIO                
0x04e8: 0x0000003584000102 GPP_B5       GPIO                
0x04f0: 0x0000003684000200 GPP_B6       GPIO                
0x04f8: 0x0000003784000100 GPP_B7       GPIO                
0x0500: 0x0000003884000102 GPP_B8       GPIO                
0x0508: 0x0000003984000500 GPP_B9       SRCCLKREQ4#         
0x0510: 0x0000003a44000702 GPP_B10      SRCCLKREQ5#         
0x0518: 0x0000003b84000200 GPP_B11      GPIO                
0x0520: 0x0000003c44000600 GPP_B12      SLP_S0#             
0x0528: 0x0000003d44000600 GPP_B13      PLTRST#             
0x0530: 0x0000103e84060600 GPP_B14      SPKR                
0x0538: 0x0000003f84000201 GPP_B15      GPIO                
0x0540: 0x0000004084000102 GPP_B16      GPIO                
0x0548: 0x0000004184000200 GPP_B17      GPIO                
0x0550: 0x0000004284000500 GPP_B18      GSPIO_MOSI          
0x0558: 0x0000004384000200 GPP_B19      GPIO                
0x0560: 0x0000004484060102 GPP_B20      GPIO                
0x0568: 0x0000004584000200 GPP_B21      GPIO                
0x0570: 0x0000004684000500 GPP_B22      GSPI1_MOSI          
0x0578: 0x0000104784060500 GPP_B23      SML1ALERT#          
------- GPIO Community 1 -------

PCR Port ID: 0xae0000

------- GPIO Group GPP_C -------
0x0400: 0x0000004844000502 GPP_C0       SMBCLK              
0x0408: 0x0000004944000502 GPP_C1       SMBDATA             
0x0410: 0x0000004a44000502 GPP_C2       SMBALERT#           
0x0418: 0x0000004b44000502 GPP_C3       SML0CLK             
0x0420: 0x0000004c44000502 GPP_C4       SML0DATA            
0x0428: 0x0000004d84000500 GPP_C5       SML0ALERT#          
0x0430: 0xffffffffffffffff GPP_C6       RESERVED            
0x0438: 0xffffffffffffffff GPP_C7       RESERVED            
0x0440: 0x0000005084000102 GPP_C8       GPIO                
0x0448: 0x0000005184000200 GPP_C9       GPIO                
0x0450: 0x0000005284000200 GPP_C10      GPIO                
0x0458: 0x0000005384000102 GPP_C11      GPIO                
0x0460: 0x0000005484000201 GPP_C12      GPIO                
0x0468: 0x0000005584000201 GPP_C13      GPIO                
0x0470: 0x0000005684000102 GPP_C14      GPIO                
0x0478: 0x0000005784000201 GPP_C15      GPIO                
0x0480: 0x0000005884000200 GPP_C16      GPIO                
0x0488: 0x0000005984000200 GPP_C17      GPIO                
0x0490: 0x0000005a84000200 GPP_C18      GPIO                
0x0498: 0x0000005b84000200 GPP_C19      GPIO                
0x04a0: 0x0000005c84000200 GPP_C20      GPIO                
0x04a8: 0x0000005d84000200 GPP_C21      GPIO                
0x04b0: 0x0000005e84060200 GPP_C22      GPIO                
0x04b8: 0x0000005f84060200 GPP_C23      GPIO                
------- GPIO Group GPP_D -------
0x04c0: 0x0000006084060200 GPP_D0       GPIO                
0x04c8: 0x0000006184000201 GPP_D1       GPIO                
0x04d0: 0x0000006284060500 GPP_D2       n/a                 
0x04d8: 0x0000006384060500 GPP_D3       n/a                 
0x04e0: 0x0000006404060201 GPP_D4       GPIO                
0x04e8: 0x0000006504000200 GPP_D5       GPIO                
0x04f0: 0x0000006604000200 GPP_D6       GPIO                
0x04f8: 0x0000006704000200 GPP_D7       GPIO                
0x0500: 0x0000006804000200 GPP_D8       GPIO                
0x0508: 0x0000006904000200 GPP_D9       GPIO                
0x0510: 0x0000006a04000200 GPP_D10      GPIO                
0x0518: 0x0000006b84000102 GPP_D11      GPIO                
0x0520: 0x0000006c84000102 GPP_D12      GPIO                
0x0528: 0x0000006d84000102 GPP_D13      GPIO                
0x0530: 0x0000006e84000102 GPP_D14      GPIO                
0x0538: 0x0000006f84000102 GPP_D15      GPIO                
0x0540: 0x0000007084000200 GPP_D16      GPIO                
0x0548: 0x0000007184000102 GPP_D17      GPIO                
0x0550: 0x0000007284000102 GPP_D18      GPIO                
0x0558: 0x0000007384000200 GPP_D19      GPIO                
0x0560: 0x0000007484000200 GPP_D20      GPIO                
0x0568: 0x0000007584000200 GPP_D21      GPIO                
0x0570: 0x0000007684000200 GPP_D22      GPIO                
0x0578: 0x0000007784000200 GPP_D23      GPIO                
------- GPIO Group GPP_E -------
0x0580: 0x0000301884060200 GPP_E0       GPIO                
0x0588: 0x0000301984060200 GPP_E1       GPIO                
0x0590: 0x0000301a84060200 GPP_E2       GPIO                
0x0598: 0x0000001b84060201 GPP_E3       GPIO                
0x05a0: 0x0000001c84060201 GPP_E4       GPIO                
0x05a8: 0x0000001d80880102 GPP_E5       GPIO                
0x05b0: 0x0000001e84060200 GPP_E6       GPIO                
0x05b8: 0x0000001f84060200 GPP_E7       GPIO                
0x05c0: 0x0000002084000600 GPP_E8       SATA_LED#           
0x05c8: 0x0000002144000502 GPP_E9       USB_OC0#            
0x05d0: 0x0000002244000502 GPP_E10      USB_OC1#            
0x05d8: 0x0000002344000502 GPP_E11      USB_OC2#            
0x05e0: 0x0000002444000502 GPP_E12      USB_OC3#            
------- GPIO Group GPP_F -------
0x05e8: 0x0000002584000200 GPP_F0       GPIO                
0x05f0: 0x0000002684000600 GPP_F1       SATAXPCIE4          
0x05f8: 0x0000002784000600 GPP_F2       SATAXPCIE5          
0x0600: 0x0000002884000200 GPP_F3       GPIO                
0x0608: 0x0000002984000200 GPP_F4       GPIO                
0x0610: 0x0000002a02080500 GPP_F5       SATA_DEVSLP3        
0x0618: 0x0000002b44000102 GPP_F6       GPIO                
0x0620: 0x0000002c42080200 GPP_F7       GPIO                
0x0628: 0x0000002d84000200 GPP_F8       GPIO                
0x0630: 0x0000002e84000102 GPP_F9       GPIO                
0x0638: 0x0000002f80100600 GPP_F10      SATA_SCLOCK         
0x0640: 0x0000003084000600 GPP_F11      SATA_SLOAD          
0x0648: 0x0000003180100600 GPP_F12      SATA_SDATAOUT1      
0x0650: 0x0000003280100600 GPP_F13      SATA_SDATAOUT2      
0x0658: 0x0000003340100100 GPP_F14      GPIO                
0x0660: 0x0000003444000502 GPP_F15      USB_OC4#            
0x0668: 0x0000003544000502 GPP_F16      USB_OC5#            
0x0670: 0x0000003644000502 GPP_F17      USB_OC6#            
0x0678: 0x0000003784000502 GPP_F18      USB_OC7#            
0x0680: 0x0000003884000200 GPP_F19      GPIO                
0x0688: 0x0000003984000200 GPP_F20      GPIO                
0x0690: 0x0000003a84000200 GPP_F21      GPIO                
0x0698: 0x0000003b84000201 GPP_F22      GPIO                
0x06a0: 0x0000003c84000200 GPP_F23      GPIO                
------- GPIO Group GPP_G -------
0x06a8: 0x0000003d84000100 GPP_G0       GPIO                
0x06b0: 0x0000003e84000100 GPP_G1       GPIO                
0x06b8: 0x0000003f84000201 GPP_G2       GPIO                
0x06c0: 0x0000004084000201 GPP_G3       GPIO                
0x06c8: 0x0000004184000200 GPP_G4       GPIO                
0x06d0: 0x0000004284000200 GPP_G5       GPIO                
0x06d8: 0x0000004384000200 GPP_G6       GPIO                
0x06e0: 0x0000004484000200 GPP_G7       GPIO                
0x06e8: 0x0000004584000200 GPP_G8       GPIO                
0x06f0: 0x0000004684000200 GPP_G9       GPIO                
0x06f8: 0x0000004784000200 GPP_G10      GPIO                
0x0700: 0x0000004884000201 GPP_G11      GPIO                
0x0708: 0x0000004984000100 GPP_G12      GPIO                
0x0710: 0x0000004a84000100 GPP_G13      GPIO                
0x0718: 0x0000004b84000100 GPP_G14      GPIO                
0x0720: 0x0000004c84000102 GPP_G15      GPIO                
0x0728: 0x0000004d84000100 GPP_G16      GPIO                
0x0730: 0x0000004e84000102 GPP_G17      GPIO                
0x0738: 0x0000004f80100201 GPP_G18      GPIO                
0x0740: 0x0000005084800102 GPP_G19      GPIO                
0x0748: 0x0000005184000102 GPP_G20      GPIO                
0x0750: 0x0000005284000102 GPP_G21      GPIO                
0x0758: 0x0000005384000102 GPP_G22      GPIO                
0x0760: 0x0000005484000201 GPP_G23      GPIO                
------- GPIO Group GPP_H -------
0x0768: 0x0000005584000102 GPP_H0       GPIO                
0x0770: 0x0000005604000201 GPP_H1       GPIO                
0x0778: 0x0000005784000102 GPP_H2       GPIO                
0x0780: 0x0000005884000102 GPP_H3       GPIO                
0x0788: 0x0000005984000200 GPP_H4       GPIO                
0x0790: 0x0000005a84000200 GPP_H5       GPIO                
0x0798: 0x0000005b84000200 GPP_H6       GPIO                
0x07a0: 0x0000005c84000200 GPP_H7       GPIO                
0x07a8: 0x0000005d84000200 GPP_H8       GPIO                
0x07b0: 0x0000005e84000200 GPP_H9       GPIO                
0x07b8: 0x0000005f84000201 GPP_H10      GPIO                
0x07c0: 0x0000006084000201 GPP_H11      GPIO                
0x07c8: 0x0000006184000200 GPP_H12      GPIO                
0x07d0: 0x0000006284000200 GPP_H13      GPIO                
0x07d8: 0x0000006384000200 GPP_H14      GPIO                
0x07e0: 0x0000006484000201 GPP_H15      GPIO                
0x07e8: 0x0000006584000200 GPP_H16      GPIO                
0x07f0: 0x0000006684000200 GPP_H17      GPIO                
0x07f8: 0x0000006784000201 GPP_H18      GPIO                
0x0800: 0x0000006884000200 GPP_H19      GPIO                
0x0808: 0x0000006984000200 GPP_H20      GPIO                
0x0810: 0x0000006a84000200 GPP_H21      GPIO                
0x0818: 0x0000006b84000200 GPP_H22      GPIO                
0x0820: 0x0000006c84000200 GPP_H23      GPIO                
------- GPIO Community 2 -------

PCR Port ID: 0xad0000

-------- GPIO Group GPD --------
0x0400: 0x0000001884000502 GPD0         BATLOW#             
0x0408: 0x0000001904000602 GPD1         ACPRESENT           
0x0410: 0x0000101a00080502 GPD2         LAN_WAKE#           
0x0418: 0x0000301b04000502 GPD3         PWRBTN#             
0x0420: 0x0000001c04000600 GPD4         SLP_S3#             
0x0428: 0x0000001d04000600 GPD5         SLP_S4#             
0x0430: 0x0000001e04000600 GPD6         SLP_A#              
0x0438: 0x0000001f04000200 GPD7         GPIO                
0x0440: 0x0000002004000600 GPD8         SUSCLK              
0x0448: 0x0000002104000600 GPD9         SLP_WLAN#           
0x0450: 0x0000002204000600 GPD10        SLP_S5#             
0x0458: 0x0000002304000600 GPD11        LANPHYPC            
------- GPIO Community 3 -------

PCR Port ID: 0xac0000

------- GPIO Group GPP_I -------
0x0400: 0x0000006d84060500 GPP_I0       DDPB_HPD0           
0x0408: 0x0000006e84060500 GPP_I1       DDPC_HPD1           
0x0410: 0x0000006f84060500 GPP_I2       DDPD_HPD2           
0x0418: 0x0000007084060100 GPP_I3       GPIO                
0x0420: 0x0000007184000100 GPP_I4       GPIO                
0x0428: 0x0000007284000200 GPP_I5       GPIO                
0x0430: 0x0000107384000102 GPP_I6       GPIO                
0x0438: 0x0000007484000500 GPP_I7       DDPC_CTRLCLK        
0x0440: 0x0000107584000500 GPP_I8       DDPC_CTRLDATA       
0x0448: 0x0000007684000500 GPP_I9       DDPD_CTRLCLK        
0x0450: 0x0000107784000500 GPP_I10      DDPD_CTRLDATA       


