CPU: ID 0x906e9, Processor Type 0x0, Family 0x6, Model 0x9e, Stepping 0x9
Northbridge: 8086:5918 (7th generation (Kaby Lake family) Core Processor Xeon E3-1200)
Southbridge: 8086:a149 (C236)
Trying to reveal Primary to Sideband Bridge (P2SB),
let's hope the OS doesn't mind... done.
SBREG_BAR = 0xfd000000 (MEM)

Hiding Primary to Sideband Bridge (P2SB).

============= GPIOS =============

------- GPIO Community 0 -------

PCR Port ID: 0xaf0000

0x0008: 0xffffffff (FAMBAR)
0x000c: 0x00000400 (PADBAR)
0x0010: 0x00043603 (MISCCFG)
0x0020: 0x00000000 (PAD_OWN_GPP_A_0)
0x0024: 0x00000000 (PAD_OWN_GPP_A_1)
0x0028: 0x00001000 (PAD_OWN_GPP_A_2)
0x0030: 0x00000000 (PAD_OWN_GPP_B_0)
0x0034: 0x00000000 (PAD_OWN_GPP_B_1)
0x0038: 0x00000000 (PAD_OWN_GPP_B_2)
0x00a0: 0x00000000 (PADCFGLOCK_GPP_A)
0x00a4: 0x00000000 (PADCFGLOCKTX_GPP_A)
0x00a8: 0x00000000 (PADCFGLOCK_GPP_B)
0x00ac: 0x00000000 (PADCFGLOCKTX_GPP_B)
0x00d0: 0x00f7efff (HOSTSW_OWN_GPP_A)
0x00d4: 0x00ffffff (HOSTSW_OWN_GPP_B)
0x0100: 0x00000000 (GPI_IS_GPP_A)
0x0104: 0x00000000 (GPI_IS_GPP_B)
0x0120: 0x00000000 (GPI_IE_GPP_A)
0x0124: 0x00000000 (GPI_IE_GPP_B)
0x0140: 0x00000000 (GPI_GPE_STS_GPP_A)
0x0144: 0x00000000 (GPI_GPE_STS_GPP_B)
0x0160: 0x00001000 (GPI_GPE_EN_GPP_A)
0x0164: 0x00000000 (GPI_GPE_EN_GPP_B)
0x0184: 0x00000000 (GPI_SMI_STS_GPP_B)
0x01a4: 0x00000000 (GPI_SMI_EN_GPP_B)
0x01c4: 0x00000000 (GPI_NMI_STS_GPP_B)
0x01e4: 0x00000000 (GPI_NMI_EN_GPP_B)
------- GPIO Group GPP_A -------
0x0400: 0x0000001844000702 GPP_A0       RCIN#               
0x0408: 0x0000001944000702 GPP_A1       LAD0                
0x0410: 0x0000001a44000700 GPP_A2       LAD1                
0x0418: 0x0000001b44000702 GPP_A3       LAD2                
0x0420: 0x0000001c44000700 GPP_A4       LAD3                
0x0428: 0x0000001d44000700 GPP_A5       LFRAME#             
0x0430: 0x0000001e44000700 GPP_A6       SERIRQ              
0x0438: 0x0000001f44000702 GPP_A7       PIRQA#              
0x0440: 0x0000002044000700 GPP_A8       CLKRUN#             
0x0448: 0x0000002144000700 GPP_A9       CLKOUT_LPC0         
0x0450: 0x0000002244000700 GPP_A10      CLKOUT_LPC1         
0x0458: 0x0000002344000702 GPP_A11      PME#                
0x0460: 0x0000002480080201 GPP_A12      GPIO                
0x0468: 0x0000002544000700 GPP_A13      SUSWARN#/SUSPWRDNACK
0x0470: 0x0000002644000700 GPP_A14      SUS_STAT#           
0x0478: 0x0000002744000702 GPP_A15      SUS_ACK#            
0x0480: 0x0000002844000700 GPP_A16      CLKOUT_48           
0x0488: 0x0000002944000300 GPP_A17      GPIO                
0x0490: 0x0000002a84000100 GPP_A18      GPIO                
0x0498: 0xffffffffffffffff GPP_A19      RESERVED            
0x04a0: 0x0000002c44000300 GPP_A20      GPIO                
0x04a8: 0x0000002d44000300 GPP_A21      GPIO                
0x04b0: 0x0000002e44000300 GPP_A22      GPIO                
0x04b8: 0x0000002f44000300 GPP_A23      GPIO                
------- GPIO Group GPP_B -------
0x04c0: 0x0000003044000201 GPP_B0       GPIO                
0x04c8: 0x0000003144000201 GPP_B1       GPIO                
0x04d0: 0x0000003244000300 GPP_B2       GPIO                
0x04d8: 0x0000003344000300 GPP_B3       GPIO                
0x04e0: 0x0000003444000301 GPP_B4       GPIO                
0x04e8: 0x0000003544000301 GPP_B5       GPIO                
0x04f0: 0x0000003684000301 GPP_B6       GPIO                
0x04f8: 0x0000003744000301 GPP_B7       GPIO                
0x0500: 0x0000003844000301 GPP_B8       GPIO                
0x0508: 0x0000003944000301 GPP_B9       GPIO                
0x0510: 0x0000003a44000301 GPP_B10      GPIO                
0x0518: 0x0000003b44000200 GPP_B11      GPIO                
0x0520: 0x0000003c44000700 GPP_B12      SLP_S0#             
0x0528: 0x0000003d44000700 GPP_B13      PLTRST#             
0x0530: 0x0000003e84000700 GPP_B14      SPKR                
0x0538: 0x0000003f44000300 GPP_B15      GPIO                
0x0540: 0x0000004044000300 GPP_B16      GPIO                
0x0548: 0x0000004144000300 GPP_B17      GPIO                
0x0550: 0x0000004244000300 GPP_B18      GPIO                
0x0558: 0x0000004344000300 GPP_B19      GPIO                
0x0560: 0x0000004484000201 GPP_B20      GPIO                
0x0568: 0x0000004544000300 GPP_B21      GPIO                
0x0570: 0x0000004644000300 GPP_B22      GPIO                
0x0578: 0x0000004744000b00 GPP_B23      PCHHOT#             
------- GPIO Community 1 -------

PCR Port ID: 0xae0000

0x0008: 0xffffffff (FAMBAR)
0x000c: 0x00000400 (PADBAR)
0x0010: 0x00043603 (MISCCFG)
0x0020: 0x00000000 (PAD_OWN_GPP_C_0)
0x0024: 0x00000000 (PAD_OWN_GPP_C_1)
0x0028: 0x00000000 (PAD_OWN_GPP_C_2)
0x002c: 0x00000000 (PAD_OWN_GPP_D_0)
0x0030: 0x00000000 (PAD_OWN_GPP_D_1)
0x0034: 0x00000000 (PAD_OWN_GPP_D_2)
0x0038: 0x00000000 (PAD_OWN_GPP_E_0)
0x003c: 0x00000000 (PAD_OWN_GPP_E_1)
0x0040: 0x00000000 (PAD_OWN_GPP_F_0)
0x0044: 0x00000000 (PAD_OWN_GPP_F_1)
0x0048: 0x00000000 (PAD_OWN_GPP_F_2)
0x004c: 0x00000000 (PAD_OWN_GPP_G_0)
0x0050: 0x00000000 (PAD_OWN_GPP_G_1)
0x0054: 0x00000000 (PAD_OWN_GPP_G_2)
0x0058: 0x00000000 (PAD_OWN_GPP_H_0)
0x005c: 0x00000000 (PAD_OWN_GPP_H_1)
0x0060: 0x00000000 (PAD_OWN_GPP_H_2)
0x0090: 0x00000000 (PADCFGLOCK_GPP_C_0)
0x0094: 0x00000000 (PADCFGLOCKTX_GPP_C_0)
0x0098: 0x00000000 (PADCFGLOCK_GPP_D_0)
0x009c: 0x00000000 (PADCFGLOCKTX_GPP_D_0)
0x00a0: 0x00000000 (PADCFGLOCK_GPP_E_0)
0x00a4: 0x00000000 (PADCFGLOCKTX_GPP_E_0)
0x00a8: 0x00000000 (PADCFGLOCK_GPP_F_0)
0x00ac: 0x00000000 (PADCFGLOCKTX_GPP_F_0)
0x00b0: 0x00000000 (PADCFGLOCK_GPP_G_0)
0x00b4: 0x00000000 (PADCFGLOCKTX_GPP_G_0)
0x00b8: 0x00000000 (PADCFGLOCK_GPP_H_0)
0x00bc: 0x00000000 (PADCFGLOCKTX_GPP_H_0)
0x00d0: 0x008fbf3f (HOSTSW_OWN_GPP_C_0)
0x00d4: 0x00fffffb (HOSTSW_OWN_GPP_D_0)
0x00d8: 0x00001fbf (HOSTSW_OWN_GPP_E_0)
0x00dc: 0x00ffffff (HOSTSW_OWN_GPP_F_0)
0x00e0: 0x008fffff (HOSTSW_OWN_GPP_G_0)
0x00e4: 0x00fffff7 (HOSTSW_OWN_GPP_H_0)
0x0100: 0x00000000 (GPI_IS_GPP_C_0)
0x0104: 0x00000000 (GPI_IS_GPP_D_0)
0x0108: 0x00000000 (GPI_IS_GPP_E_0)
0x010c: 0x00000020 (GPI_IS_GPP_F_0)
0x0110: 0x00000000 (GPI_IS_GPP_G_0)
0x0114: 0x00000000 (GPI_IS_GPP_H_0)
0x0120: 0x00000000 (GPI_IE_GPP_C_0)
0x0124: 0x00000000 (GPI_IE_GPP_D_0)
0x0128: 0x00000000 (GPI_IE_GPP_E_0)
0x012c: 0x00000000 (GPI_IE_GPP_F_0)
0x0130: 0x00000000 (GPI_IE_GPP_G_0)
0x0134: 0x00000000 (GPI_IE_GPP_H_0)
0x0140: 0x00000000 (GPI_GPE_STS_GPP_C_0)
0x0144: 0x00000000 (GPI_GPE_STS_GPP_D_0)
0x0148: 0x00000000 (GPI_GPE_STS_GPP_E_0)
0x014c: 0x00000000 (GPI_GPE_STS_GPP_F_0)
0x0150: 0x00000000 (GPI_GPE_STS_GPP_G_0)
0x0154: 0x00000000 (GPI_GPE_STS_GPP_H_0)
0x0160: 0x00000000 (GPI_GPE_EN_GPP_C_0)
0x0164: 0x00000000 (GPI_GPE_EN_GPP_D_0)
0x0168: 0x00000000 (GPI_GPE_EN_GPP_E_0)
0x016c: 0x00000000 (GPI_GPE_EN_GPP_F_0)
0x0170: 0x00000000 (GPI_GPE_EN_GPP_G_0)
0x0174: 0x00000000 (GPI_GPE_EN_GPP_H_0)
0x0180: 0x00000000 (GPI_SMI_STS_GPP_C_0)
0x0184: 0x00000000 (GPI_SMI_STS_GPP_D_0)
0x0188: 0x00000000 (GPI_SMI_STS_GPP_E_0)
0x01a0: 0x00400000 (GPI_SMI_EN_GPP_C_0)
0x01a4: 0x00000000 (GPI_SMI_EN_GPP_D_0)
0x01a8: 0x00000000 (GPI_SMI_EN_GPP_E_0)
0x01c0: 0x00000000 (GPI_NMI_STS_GPP_C_0)
0x01c4: 0x00000000 (GPI_NMI_STS_GPP_D_0)
0x01c8: 0x00000000 (GPI_NMI_STS_GPP_E_0)
0x01e0: 0x00000000 (GPI_NMI_EN_GPP_C_0)
0x01e4: 0x00000004 (GPI_NMI_EN_GPP_D_0)
0x01e8: 0x00000040 (GPI_NMI_EN_GPP_E_0)
0x0204: 0x00000000 (PWMC)
0x020c: 0x00000000 (GP_SER_BLINK)
0x0210: 0x00080000 (GP_SER_CMDSTS)
0x0214: 0x00000000 (GP_SER_DATA)
0x021c: 0x00000000 (GSX_CAP)
0x0220: 0x00000000 (GSX_C0CAP_DW0)
0x0224: 0x00012000 (GSX_C0CAP_DW1)
0x0228: 0x00000000 (GSX_C0GPILVL_DW0)
0x022c: 0x00000000 (GSX_C0GPILVL_DW1)
0x0230: 0x00000000 (GSX_C0GPOLVL_DW0)
0x0234: 0x00000000 (GSX_C0GPOLVL_DW1)
0x0238: 0x00000000 (GSX_C0CMD)
0x023c: 0x00000000 (GSX_C0TM)
------- GPIO Group GPP_C -------
0x0400: 0x0000004844000702 GPP_C0       SMBCLK              
0x0408: 0x0000004944000702 GPP_C1       SMBDATA             
0x0410: 0x0000004a44000300 GPP_C2       GPIO                
0x0418: 0x0000004b44000702 GPP_C3       SML0CLK             
0x0420: 0x0000004c44000702 GPP_C4       SML0DATA            
0x0428: 0x0000004d44000201 GPP_C5       GPIO                
0x0430: 0x0000004e44000300 GPP_C6       GPIO                
0x0438: 0x0000004f44000300 GPP_C7       GPIO                
0x0440: 0x0000005084000102 GPP_C8       GPIO                
0x0448: 0x0000005184000100 GPP_C9       GPIO                
0x0450: 0x0000005284000102 GPP_C10      GPIO                
0x0458: 0x0000005344000300 GPP_C11      GPIO                
0x0460: 0x0000005444000300 GPP_C12      GPIO                
0x0468: 0x0000005544000300 GPP_C13      GPIO                
0x0470: 0x0000005684000300 GPP_C14      GPIO                
0x0478: 0x0000005744000300 GPP_C15      GPIO                
0x0480: 0x0000005844000300 GPP_C16      GPIO                
0x0488: 0x0000005944000300 GPP_C17      GPIO                
0x0490: 0x0000005a44000300 GPP_C18      GPIO                
0x0498: 0x0000005b44000300 GPP_C19      GPIO                
0x04a0: 0x0000005c44000300 GPP_C20      GPIO                
0x04a8: 0x0000005d44000300 GPP_C21      GPIO                
0x04b0: 0x0000305e42040102 GPP_C22      GPIO                
0x04b8: 0x0000005f84000300 GPP_C23      GPIO                
------- GPIO Group GPP_D -------
0x04c0: 0x0000006084000300 GPP_D0       GPIO                
0x04c8: 0x0000006144000201 GPP_D1       GPIO                
0x04d0: 0x0000306242020102 GPP_D2       GPIO                
0x04d8: 0x0000006344000300 GPP_D3       GPIO                
0x04e0: 0x0000006484000200 GPP_D4       GPIO                
0x04e8: 0x0000006544000300 GPP_D5       GPIO                
0x04f0: 0x0000006644000300 GPP_D6       GPIO                
0x04f8: 0x0000006744000300 GPP_D7       GPIO                
0x0500: 0x0000006844000300 GPP_D8       GPIO                
0x0508: 0x0000006944000300 GPP_D9       GPIO                
0x0510: 0x0000006a44000300 GPP_D10      GPIO                
0x0518: 0x0000006b44000300 GPP_D11      GPIO                
0x0520: 0x0000006c44000300 GPP_D12      GPIO                
0x0528: 0x0000006d44000300 GPP_D13      GPIO                
0x0530: 0x0000006e44000300 GPP_D14      GPIO                
0x0538: 0x0000006f44000300 GPP_D15      GPIO                
0x0540: 0x0000007044000300 GPP_D16      GPIO                
0x0548: 0x0000007144000300 GPP_D17      GPIO                
0x0550: 0x0000007284000201 GPP_D18      GPIO                
0x0558: 0x0000007384000201 GPP_D19      GPIO                
0x0560: 0x0000007444000300 GPP_D20      GPIO                
0x0568: 0x0000007544000200 GPP_D21      GPIO                
0x0570: 0x0000007604000102 GPP_D22      GPIO                
0x0578: 0x0000007744000300 GPP_D23      GPIO                
------- GPIO Group GPP_E -------
0x0580: 0x0000001844000502 GPP_E0       SATAXPCIE0          
0x0588: 0x0000001944000300 GPP_E1       GPIO                
0x0590: 0x0000001a44000300 GPP_E2       GPIO                
0x0598: 0x0000001b44000300 GPP_E3       GPIO                
0x05a0: 0x0000001c44000300 GPP_E4       GPIO                
0x05a8: 0x0000001d44000300 GPP_E5       GPIO                
0x05b0: 0x0000301e82020102 GPP_E6       GPIO                
0x05b8: 0x0000001f44000300 GPP_E7       GPIO                
0x05c0: 0x0000002044000700 GPP_E8       SATA_LED#           
0x05c8: 0x0000002144000702 GPP_E9       USB_OC0#            
0x05d0: 0x0000002244000702 GPP_E10      USB_OC1#            
0x05d8: 0x0000002344000702 GPP_E11      USB_OC2#            
0x05e0: 0x0000002444000702 GPP_E12      USB_OC3#            
------- GPIO Group GPP_F -------
0x05e8: 0x0000002544000300 GPP_F0       GPIO                
0x05f0: 0x0000002644000300 GPP_F1       GPIO                
0x05f8: 0x0000002744000300 GPP_F2       GPIO                
0x0600: 0x0000002844000300 GPP_F3       GPIO                
0x0608: 0x0000002944000300 GPP_F4       GPIO                
0x0610: 0x0000002a80100102 GPP_F5       GPIO                
0x0618: 0x0000002b84000201 GPP_F6       GPIO                
0x0620: 0x0000002c84000201 GPP_F7       GPIO                
0x0628: 0x0000002d84000201 GPP_F8       GPIO                
0x0630: 0x0000002e84000102 GPP_F9       GPIO                
0x0638: 0x0000002f44000700 GPP_F10      SATA_SCLOCK         
0x0640: 0x0000003044000700 GPP_F11      SATA_SLOAD          
0x0648: 0x0000003144000700 GPP_F12      SATA_SDATAOUT1      
0x0650: 0x0000003244000700 GPP_F13      SATA_SDATAOUT2      
0x0658: 0x0000003344000300 GPP_F14      GPIO                
0x0660: 0x0000003444000702 GPP_F15      USB_OC4#            
0x0668: 0x0000003544000702 GPP_F16      USB_OC5#            
0x0670: 0x0000003644000300 GPP_F17      GPIO                
0x0678: 0x0000003744000300 GPP_F18      GPIO                
0x0680: 0x0000003844000300 GPP_F19      GPIO                
0x0688: 0x0000003944000300 GPP_F20      GPIO                
0x0690: 0x0000003a44000300 GPP_F21      GPIO                
0x0698: 0x0000003b44000300 GPP_F22      GPIO                
0x06a0: 0x0000003c04000200 GPP_F23      GPIO                
------- GPIO Group GPP_G -------
0x06a8: 0x0000003d44000102 GPP_G0       GPIO                
0x06b0: 0x0000003e44000102 GPP_G1       GPIO                
0x06b8: 0x0000003f44000102 GPP_G2       GPIO                
0x06c0: 0x0000004044000102 GPP_G3       GPIO                
0x06c8: 0x0000004144000300 GPP_G4       GPIO                
0x06d0: 0x0000004244000300 GPP_G5       GPIO                
0x06d8: 0x0000004344000300 GPP_G6       GPIO                
0x06e0: 0x0000004444000300 GPP_G7       GPIO                
0x06e8: 0x0000004544000300 GPP_G8       GPIO                
0x06f0: 0x0000004644000300 GPP_G9       GPIO                
0x06f8: 0x0000004744000300 GPP_G10      GPIO                
0x0700: 0x0000004844000300 GPP_G11      GPIO                
0x0708: 0x0000004984000100 GPP_G12      GPIO                
0x0710: 0x0000004a84000100 GPP_G13      GPIO                
0x0718: 0x0000004b84000102 GPP_G14      GPIO                
0x0720: 0x0000004c84000100 GPP_G15      GPIO                
0x0728: 0x0000004d84000100 GPP_G16      GPIO                
0x0730: 0x0000004e44000300 GPP_G17      GPIO                
0x0738: 0x0000004f44000700 GPP_G18      NMI#                
0x0740: 0x0000005044000700 GPP_G19      SMI#                
0x0748: 0x0000005144000300 GPP_G20      GPIO                
0x0750: 0x0000005244000300 GPP_G21      GPIO                
0x0758: 0x0000005344000300 GPP_G22      GPIO                
0x0760: 0x0000005444000300 GPP_G23      GPIO                
------- GPIO Group GPP_H -------
0x0768: 0x0000005544000201 GPP_H0       GPIO                
0x0770: 0x0000005684000103 GPP_H1       GPIO                
0x0778: 0x0000005744000201 GPP_H2       GPIO                
0x0780: 0x0000005844000602 GPP_H3       SRCCLKREQ9#         
0x0788: 0x0000005984000103 GPP_H4       GPIO                
0x0790: 0x0000005a84000201 GPP_H5       GPIO                
0x0798: 0x0000005b84000201 GPP_H6       GPIO                
0x07a0: 0x0000005c84000201 GPP_H7       GPIO                
0x07a8: 0x0000005d84000201 GPP_H8       GPIO                
0x07b0: 0x0000005e84000201 GPP_H9       GPIO                
0x07b8: 0x0000005f44000702 GPP_H10      SML2CLK             
0x07c0: 0x0000006044000702 GPP_H11      SML2DATA            
0x07c8: 0x0000006144000300 GPP_H12      GPIO                
0x07d0: 0x0000006244000702 GPP_H13      SML3CLK             
0x07d8: 0x0000006344000702 GPP_H14      SML3DATA            
0x07e0: 0x0000006444000300 GPP_H15      GPIO                
0x07e8: 0x0000006544000702 GPP_H16      SML4CLK             
0x07f0: 0x0000006644000702 GPP_H17      SML4DATA            
0x07f8: 0x0000006744000300 GPP_H18      GPIO                
0x0800: 0x0000006884000201 GPP_H19      GPIO                
0x0808: 0x0000006984000201 GPP_H20      GPIO                
0x0810: 0x0000006a84000201 GPP_H21      GPIO                
0x0818: 0x0000006b84000201 GPP_H22      GPIO                
0x0820: 0x0000006c84000201 GPP_H23      GPIO                
------- GPIO Community 2 -------

PCR Port ID: 0xad0000

0x0008: 0xffffffff (FAMBAR)
0x000c: 0x00000400 (PADBAR)
0x0010: 0x00043603 (MISCCFG)
0x0020: 0x00000000 (PAD_OWN_GPD_0)
0x0024: 0x00000000 (PAD_OWN_GPD_1)
0x0090: 0x00000000 (PADCFGLOCK_GPD_0)
0x0094: 0x00000000 (PADCFGLOCKTX_GPD_0)
0x00d0: 0x00000fff (HOSTSW_OWN_GPD_0)
0x0100: 0x00000000 (GPI_IS_GPD_0)
0x0120: 0x00000000 (GPI_IE_GPD_0)
0x0140: 0x00000000 (GPI_GPE_STS_GPD_0)
0x0160: 0x00000000 (GPI_GPE_EN_GPD_0)
-------- GPIO Group GPD --------
0x0400: 0x0000001804000300 GPD0         GPIO                
0x0408: 0x0000001904000300 GPD1         GPIO                
0x0410: 0x0000001a04000702 GPD2         LAN_WAKE#           
0x0418: 0x0000001b04000702 GPD3         PWRBTN#             
0x0420: 0x0000001c04000700 GPD4         SLP_S3#             
0x0428: 0x0000001d04000700 GPD5         SLP_S4#             
0x0430: 0x0000001e04000700 GPD6         SLP_A#              
0x0438: 0x0000001f04000301 GPD7         GPIO                
0x0440: 0x0000002004000700 GPD8         SUSCLK              
0x0448: 0x0000002104000300 GPD9         GPIO                
0x0450: 0x0000002204000300 GPD10        GPIO                
0x0458: 0x0000002304000300 GPD11        GPIO                
------- GPIO Community 3 -------

PCR Port ID: 0xac0000

0x0004: 0x00000000 (CAP_LIST_0)
0x0008: 0xffffffff (FAMBAR)
0x000c: 0x00000400 (PADBAR)
0x0010: 0x00043603 (MISCCFG)
0x0020: 0x00000000 (PAD_OWN_GPP_I_0)
0x0024: 0x00000000 (PAD_OWN_GPP_I_1)
0x0090: 0x00000000 (PADCFGLOCK_GPP_I_0)
0x0094: 0x00000000 (PADCFGLOCKTX_GPP_I_0)
0x00d0: 0x000007ff (HOSTSW_OWN_GPP_I_0)
0x0100: 0x00000000 (GPI_IS_GPP_I_0)
0x0120: 0x00000000 (GPI_IE_GPP_I_0)
0x0140: 0x00000000 (GPI_GPE_STS_GPP_I_0)
0x0160: 0x00000000 (GPI_GPE_EN_GPP_I_0)
0x0180: 0x00000000 (GPI_SMI_STS_GPP_I_0)
0x01a0: 0x00000000 (GPI_SMI_EN_GPP_I_0)
0x01c0: 0x00000000 (GPI_NMI_STS_GPP_I_0)
0x01e0: 0x00000000 (GPI_NMI_EN_GPP_I_0)
------- GPIO Group GPP_I -------
0x0400: 0x0000006d44000700 GPP_I0       DDPB_HPD0           
0x0408: 0x0000006e44000700 GPP_I1       DDPC_HPD1           
0x0410: 0x0000006f44000700 GPP_I2       DDPD_HPD2           
0x0418: 0x0000007084000700 GPP_I3       DDPE_HPD3           
0x0420: 0x0000007144000300 GPP_I4       GPIO                
0x0428: 0x0000007244000700 GPP_I5       DDPB_CTRLCLK        
0x0430: 0x0000007344000700 GPP_I6       DDPB_CTRLDATA       
0x0438: 0x0000007444000700 GPP_I7       DDPC_CTRLCLK        
0x0440: 0x0000007544000700 GPP_I8       DDPC_CTRLDATA       
0x0448: 0x0000007644000700 GPP_I9       DDPD_CTRLCLK        
0x0450: 0x0000007744000700 GPP_I10      DDPD_CTRLDATA       



============= RCBA ==============

Error: Dumping RCBA on this southbridge is not (yet) supported.



========== ACPI/PMC =========

0x0000: 0xa1218086 (PCIID)
0x0004: 0x00000006 (PCISTS_PCICMD)
0x0008: 0x05800031 (PCICC_PCIRID)
0x000c: 0x00800000 (PCIHTYPE_PCILMT)
0x0010: 0xdf318000 (PM_DATA_BAR)
0x002c: 0x089c15d9 (PCISID)
0x0040: 0x00001801 (ABASE)
0x0044: 0x00000180 (ACTL)
0x0048: 0xfe000000 (PWRMBASE)
0x00a0: 0xa0a036f8 (GEN_PMCON_A)
0x00a4: 0x00061808 (GEN_PMCON_B)
0x00a8: 0x00004600 (BM_CX_CNF)
0x00ac: 0x81000000 (ETR3)

========== ABASE/PMBASE =========

PMBASE = 0x1800 (IO)

pmbase+0x0000: 0x0001     (PM1_STS)
pmbase+0x0002: 0x0120     (PM1_EN)
pmbase+0x0004: 0x00000001 (PM1_CNT)
pmbase+0x0008: 0x00ca3a21 (PM1_TMR)
pmbase+0x0030: 0x9000203b (SMI_EN)
pmbase+0x0034: 0x00004100 (SMI_STS)
pmbase+0x0040: 0x00000000 (GPE_CNTL)
pmbase+0x0044: 0x1060     (DEVACT_STS)
pmbase+0x0050: 0x00000000 (PM2_CNT)
pmbase+0x0054: 0x00002000 (OC_WDT_CTL)
pmbase+0x0080: 0x00000000 (GPE0_STS_31_0)
pmbase+0x0084: 0x00000000 (GPE0_STS_63_31)
pmbase+0x0088: 0x00000000 (GPE0_STS_95_64)
pmbase+0x008c: 0x00000000 (GPE0_STS_127_96)
pmbase+0x0090: 0x00000000 (GPE0_EN_31_0)
pmbase+0x0094: 0x00000000 (GPE0_EN_63_31)
pmbase+0x0098: 0x00000000 (GPE0_EN_95_64)
pmbase+0x009c: 0x00009246 (GPE0_EN_127_96)

=========== PWRMBASE ===========

PWRMBASE = 0xfe000000 (MEM)

0x0000: 0xffffffff
0x0004: 0xffffffff
0x0008: 0xffffffff
0x000c: 0xffffffff
0x0010: 0x0a310100
0x0014: 0x11052fff
0x0018: 0x294f0024
0x001c: 0x80000000
0x003c: 0x04000000
0x0048: 0x1e2dd701
0x004c: 0x00000001
0x0050: 0x1e2dd701
0x0054: 0x00000001
0x0058: 0x0001c000
0x0068: 0x04043400
0x0080: 0xbf8ff701
0x0084: 0x0201c7e1
0x0088: 0x3f8ff701
0x008c: 0x0201c7e1
0x0098: 0x0001c000
0x00a8: 0x00181300
0x00ac: 0x02006001
0x00b0: 0x00181300
0x00b4: 0x02006001
0x00c0: 0x00060a00
0x00d0: 0x00200840
0x00d4: 0x7000f4e6
0x00e0: 0x01040001
0x00e4: 0x16bf0003
0x00e8: 0x40028018
0x00f0: 0x30002de4
0x00f4: 0x7000f4c0
0x0100: 0x00000008
0x010c: 0x00002de4
0x0110: 0xffffffff
0x0120: 0x00000436
0x012c: 0x00000002
0x0200: 0x0000ffc0
0x0204: 0x0a000000
0x0210: 0x00003fff
0x0300: 0x07ffffff
0x030c: 0x00000044
0x0314: 0x1e0a4616
0x031c: 0x2bc0d00a
0x0320: 0x0005db01
0x0324: 0x40000006
0x0340: 0x40000008
0x034c: 0xc0200000
0x0350: 0x00040201
0x0354: 0x07fca251
0x0358: 0x07fca251
0x035c: 0x00000001
0x0368: 0x0000880a
0x0370: 0x000088a0
0x0378: 0x88ff88ff
0x03a8: 0x40000029
0x03b0: 0x00000021
0x03c0: 0x00008003
0x03d0: 0x800a2205
0x03e0: 0x60000069
0x03e8: 0x00200001
0x03ec: 0x00010000
0x0500: 0x03020100
0x0504: 0x07060504
0x0508: 0x0b0a0908
0x050c: 0x0f0e0d0c
0x0510: 0x13121110
0x0514: 0x17161514
0x0518: 0x1b1a1918
0x051c: 0x1f1e1d1c
0x0520: 0x23222120
0x0524: 0x27262524
0x0528: 0x2b2a2928
0x052c: 0x2f2e2d2c
0x0530: 0x33323130
0x0534: 0x37363534
0x0538: 0x3b3a3938
0x053c: 0x3f3e3d3c
0x0580: 0xf948813f
0x0584: 0xffffffcf
0x0590: 0x06b27ec0
0x0594: 0xfff80000
0x05a0: 0x06000606
0x05d0: 0x80000001
0x05e0: 0xf948813f
0x05e4: 0xffffffcf
0x0600: 0xe0000082
0x0604: 0x20000082
0x0620: 0x80000020
0x0624: 0x000007ff
0x0628: 0x00bfffac
0x0644: 0x00000015



========== LPC/eSPI =========

Device 0:1f.0 is LPC (BC.LPC_ESPI=0)

0x0000: 0xa1498086 (ID)
0x0004: 0x0007     (CMD)
0x0006: 0x0200     (STS)
0x0008: 0x31       (RID)
0x0009: 0x00       (CC[3])
0x000a: 0x01       (CC[2])
0x000b: 0x06       (CC[1])
0x000c: 0x00       (CC[0])
0x000e: 0x80       (HTYPE)
0x002c: 0x089c15d9 (SS)
0x0034: 0x00       (CAPP)
0x0064: 0xd0       (SCNT)
0x0080: 0x0070     (IOD)
0x0082: 0x3f0f     (IOE)
0x0084: 0x00fc0201 (LGIR1)
0x0088: 0x000c0ca1 (LGIR2)
0x008c: 0x007c0a01 (LGIR3)
0x0090: 0x000c03e1 (LGIR4)
0x0094: 0x00000000 (ULKMC)
0x0098: 0x00000000 (LGMR)
0x00d0: 0x2233     (FS1)
0x00d4: 0x4567     (FS2)
0x00d8: 0xffcf     (BDE)
0x00dc: 0xa2       (BC)
0x00e0: 0x000000c1 (PCCTL)



========== SMBUS =========

0x0000: 0x8086     (VID)
0x0002: 0xa123     (DID)
0x0004: 0x0003     (CMD)
0x0006: 0x0280     (DS)
0x0008: 0x31       (RID)
0x0009: 0x00       (PI)
0x000a: 0x05       (SCC)
0x000b: 0x0c       (BCC)
0x0010: 0xdf31c004 (SMBBAR_31_0)
0x0014: 0x00000000 (SMBBAR_63_32)
0x0020: 0x0000f001 (SBA)
0x002c: 0x15d9     (SVID)
0x002e: 0x089c     (SID)
0x003c: 0x0b       (INTLN)
0x003d: 0x01       (INTPN)
0x0040: 0x11       (HCFG)
0x0050: 0x00000401 (TCOBASE)
0x0054: 0x00000101 (TCOCTL)
0x0064: 0x0a0a0000 (HTIM)
0x0080: 0x00040024 (SMBSM)

=========== SMBBASE ===========

SBA = 0xf000 (IO)

smbbase+0x0000: 0x40       (HSTS)
smbbase+0x0002: 0x08       (HCTL)
smbbase+0x0003: 0x0b       (HCMD)
smbbase+0x0004: 0xa7       (TSA)
smbbase+0x0005: 0x03       (HD0)
smbbase+0x0006: 0x0d       (HD1)
smbbase+0x0007: 0x00       (HBD)
smbbase+0x0008: 0x00       (PEC)
smbbase+0x0009: 0x44       (RSA)
smbbase+0x000a: 0x0000     (SD)
smbbase+0x000c: 0x1c       (AUXS)
smbbase+0x000d: 0x00       (AUXC)
smbbase+0x000e: 0x07       (SMLC)
smbbase+0x000f: 0x07       (SMBC)
smbbase+0x0010: 0x00       (SSTS)
smbbase+0x0011: 0x00       (SCMD)
smbbase+0x0014: 0x00       (NDA)
smbbase+0x0016: 0x00       (NDLB)
smbbase+0x0017: 0x00       (NDHB)

=========== TCOBASE ===========

TCOBA = 0x0400 (IO)

tcobase+0x0000: 0x0002     (TRLD)
tcobase+0x0002: 0x00       (TDI)
tcobase+0x0003: 0x00       (TDO)
tcobase+0x0004: 0x0000     (TSTS1)
tcobase+0x0006: 0x0000     (TSTS2)
tcobase+0x0008: 0x1a00     (TCTL1)
tcobase+0x000a: 0x0008     (TCTL2)
tcobase+0x000c: 0x0000     (TMSG)
tcobase+0x000e: 0x00       (TWDS)
tcobase+0x0010: 0x01       (LE)
tcobase+0x0012: 0x0002     (TTMR)



========== I2C[0] =========

device disabled.

========== I2C[1] =========

device disabled.

========== I2C[2] =========

device disabled.

========== I2C[3] =========

device disabled.



========== GSPI =========

device disabled.



========== Thermal =========

0x0000: 0x8086     (VID)
0x0002: 0xa131     (DID)
0x0004: 0x0006     (CMD)
0x0006: 0x0010     (STS)
0x0008: 0x31       (RID)
0x0009: 0x00       (PI)
0x000a: 0x80       (SCC)
0x000b: 0x11       (BCC)
0x000c: 0x00       (CLS)
0x000d: 0x00       (LT)
0x000e: 0x00       (HTYPE)
0x0010: 0xdf321004 (TBAR)
0x0014: 0x00000000 (TBARH)
0x002c: 0x15d9     (SVID)
0x002e: 0x089c     (SID)
0x0034: 0x00000050 (CAP_PTR)
0x003c: 0x0b       (INTLN)
0x003d: 0x03       (INTPN)
0x0040: 0x00000004 (TBARB)
0x0044: 0x00000000 (TBARBH)
0x0048: 0x00       (CB)
0x0050: 0x8001     (PID)
0x0052: 0x0023     (PC)
0x0054: 0x00000008 (PCS)
0x0080: 0x0005     (MID)
0x0082: 0x0000     (MC)
0x0084: 0x00000000 (MA)
0x0088: 0x00000000 (MD)

=========== ThermalBASE ===========

BAR = 0xdf321000 (MEM)

thermalbase+0x0000: 0x009b     (TEMP)
thermalbase+0x0004: 0x81       (TSC)
thermalbase+0x0006: 0x10       (TSS)
thermalbase+0x0008: 0x81       (TSEL)
thermalbase+0x000a: 0x01       (TSREL)
thermalbase+0x000c: 0x80       (TSMIC)
thermalbase+0x0010: 0x004a     (CTT)
thermalbase+0x0014: 0x0000     (TAHV)
thermalbase+0x0018: 0x0000     (TALV)
thermalbase+0x001c: 0x00c8     (TSPM)
thermalbase+0x0040: 0x0000003c (TL)
thermalbase+0x0050: 0x00000000 (TL2)
thermalbase+0x0060: 0x0000     (PHL)
thermalbase+0x0062: 0x01       (PHLC)
thermalbase+0x0080: 0x01       (TAS)
thermalbase+0x0082: 0x00       (TSPIEN)
thermalbase+0x0084: 0x00       (TSGPEN)
thermalbase+0x00f0: 0x00       (TCFD)



========== USB =========

0x0000: 0x8086     (VID)
0x0002: 0xa12f     (DID)
0x0004: 0x0406     (CMD)
0x0006: 0x0290     (STS)
0x0008: 0x31       (RID)
0x0009: 0x30       (PI)
0x000a: 0x03       (SCC)
0x000b: 0x0c       (BCC)
0x000d: 0x00       (MLT)
0x000e: 0x80       (HT)
0x0010: 0xdf300004 (MBAR)
        0x00000000
0x002c: 0x15d9     (SSVID)
0x002e: 0x089c     (SSID)
0x0034: 0x70       (CAP_PTR)
0x003c: 0x0b       (ILINE)
0x003d: 0x01       (IPIN)
0x0040: 0x803401fd (XHCC1)
0x0044: 0x800fc688 (XHCC2)
0x0050: 0x0fce6e5b (XHCLKGTEN)
0x0058: 0x00000000 (AUDSYNC)
0x0060: 0x30       (SBRN)
0x0061: 0x60       (FLADJ)
0x0062: 0x00       (BESL)
0x0070: 0x01       (PM_CID)
0x0071: 0x80       (PM_NEXT)
0x0072: 0xc1c2     (PM_CAP)
0x0074: 0x0008     (PM_CS)
0x0080: 0x05       (MSI_CID)
0x0081: 0x00       (MSI_NEXT)
0x0082: 0x0087     (MSI_MCTL)
0x0084: 0xfee002d8 (MSI_MAD)
0x0088: 0x00000000 (MSI_MUAD)
0x008c: 0x0000     (MSI_MD)
0x0094: 0x01400010 (VSHDR)
0x00a2: 0x0000     (PCE_REG)
0x00a4: 0x00001800 (HSCFG2)
0x00b0: 0x0000c003 (U2OCM#0)
0x00b4: 0x0000000c (U2OCM#1)
0x00b8: 0x00000030 (U2OCM#2)
0x00bc: 0x00001100 (U2OCM#3)
0x00c0: 0x00000c00 (U2OCM#4)
0x00c4: 0x00000200 (U2OCM#5)
0x00c8: 0x00000000 (U2OCM#6)
0x00cc: 0x00000000 (U2OCM#7)
0x00d0: 0x00000000 (U3OCM#0)
0x00d4: 0x00000000 (U3OCM#1)
0x00d8: 0x00000000 (U3OCM#2)
0x00dc: 0x00000018 (U3OCM#3)
0x00e0: 0x00000003 (U3OCM#4)
0x00e4: 0x00000004 (U3OCM#5)
0x00e8: 0x00000000 (U3OCM#6)
0x00ec: 0x00000000 (U3OCM#7)

=========== USBBASE ===========

BAR = 0xdf300000 (MEM)

usbbase+0x0000: 0x80       (CAPLENGTH)
usbbase+0x0002: 0x0100     (HCIVERSION)
usbbase+0x0004: 0x1a000840 (HCSPARAMS1)
usbbase+0x0008: 0x14200054 (HCSPARAMS2)
usbbase+0x000c: 0x0200000a (HCSPARAMS3)
usbbase+0x0010: 0x200077c1 (HCCPARAMS)
usbbase+0x0014: 0x00003000 (DBOFF)
usbbase+0x0018: 0x00002000 (RTSOFF)
usbbase+0x0080: 0x00000005 (USBCMD)
usbbase+0x0084: 0x00000000 (USBSTS)
usbbase+0x0088: 0x00000001 (PAGESIZE)
usbbase+0x0094: 0x00000002 (DNCTRL)
usbbase+0x0098: 0x00000008 (CRCR_LO)
usbbase+0x009c: 0x00000000 (CRCR_HI)
usbbase+0x00b0: 0x5ccf4000 (DCBAAP_LO)
usbbase+0x00b4: 0x00000004 (DCBAAP_HI)
usbbase+0x0480: 0x000002a0 (PORTSCN#1)
usbbase+0x0490: 0x000002a0 (PORTSCN#2)
usbbase+0x04a0: 0x000002a0 (PORTSCN#3)
usbbase+0x04b0: 0x000002a0 (PORTSCN#4)
usbbase+0x04c0: 0x000002a0 (PORTSCN#5)
usbbase+0x04d0: 0x000002a0 (PORTSCN#6)
usbbase+0x04e0: 0x000002a0 (PORTSCN#7)
usbbase+0x04f0: 0x000002a0 (PORTSCN#8)
usbbase+0x0500: 0x000002a0 (PORTSCN#9)
usbbase+0x0510: 0x000002a0 (PORTSCN#10)
usbbase+0x0520: 0x000002a0 (PORTSCN#11)
usbbase+0x0530: 0x000002a0 (PORTSCN#12)
usbbase+0x0540: 0x00000a03 (PORTSCN#13)
usbbase+0x0550: 0x00000e03 (PORTSCN#14)
usbbase+0x0484: 0x00000000 (PORTPMSCN#1)
usbbase+0x0494: 0x00000000 (PORTPMSCN#2)
usbbase+0x04a4: 0x00000000 (PORTPMSCN#3)
usbbase+0x04b4: 0x00000000 (PORTPMSCN#4)
usbbase+0x04c4: 0x00000000 (PORTPMSCN#5)
usbbase+0x04d4: 0x00000000 (PORTPMSCN#6)
usbbase+0x04e4: 0x00000000 (PORTPMSCN#7)
usbbase+0x04f4: 0x00000000 (PORTPMSCN#8)
usbbase+0x0504: 0x00000000 (PORTPMSCN#9)
usbbase+0x0514: 0x00000000 (PORTPMSCN#10)
usbbase+0x0524: 0x00000000 (PORTPMSCN#11)
usbbase+0x0534: 0x00000000 (PORTPMSCN#12)
usbbase+0x0544: 0x00000000 (PORTPMSCN#13)
usbbase+0x0554: 0x00000000 (PORTPMSCN#14)
usbbase+0x048c: 0x00000000 (PORTHLPMCN#1)
usbbase+0x049c: 0x00000000 (PORTHLPMCN#2)
usbbase+0x04ac: 0x00000000 (PORTHLPMCN#3)
usbbase+0x04bc: 0x00000000 (PORTHLPMCN#4)
usbbase+0x04cc: 0x00000000 (PORTHLPMCN#5)
usbbase+0x04dc: 0x00000000 (PORTHLPMCN#6)
usbbase+0x04ec: 0x00000000 (PORTHLPMCN#7)
usbbase+0x04fc: 0x00000000 (PORTHLPMCN#8)
usbbase+0x050c: 0x00000000 (PORTHLPMCN#9)
usbbase+0x051c: 0x00000000 (PORTHLPMCN#10)
usbbase+0x052c: 0x00000000 (PORTHLPMCN#11)
usbbase+0x053c: 0x00000000 (PORTHLPMCN#12)
usbbase+0x054c: 0x00000000 (PORTHLPMCN#13)
usbbase+0x055c: 0x00000000 (PORTHLPMCN#14)
usbbase+0x0580: 0x0a0002a0 (PORTSCXUSB3#1)
usbbase+0x0590: 0x0a0002a0 (PORTSCXUSB3#2)
usbbase+0x05a0: 0x0a0002a0 (PORTSCXUSB3#3)
usbbase+0x05b0: 0x0a0002a0 (PORTSCXUSB3#4)
usbbase+0x05c0: 0x0a0002a0 (PORTSCXUSB3#5)
usbbase+0x05d0: 0x0a0002a0 (PORTSCXUSB3#6)
usbbase+0x05e0: 0x0a0002a0 (PORTSCXUSB3#7)
usbbase+0x05f0: 0x0a0002a0 (PORTSCXUSB3#8)
usbbase+0x0600: 0x0a0002a0 (PORTSCXUSB3#9)
usbbase+0x0610: 0x0a0002a0 (PORTSCXUSB3#10)
usbbase+0x0584: 0x00000000 (PORTPMSCX#1)
usbbase+0x0594: 0x00000000 (PORTPMSCX#2)
usbbase+0x05a4: 0x00000000 (PORTPMSCX#3)
usbbase+0x05b4: 0x00000000 (PORTPMSCX#4)
usbbase+0x05c4: 0x00000000 (PORTPMSCX#5)
usbbase+0x05d4: 0x00000000 (PORTPMSCX#6)
usbbase+0x05e4: 0x00000000 (PORTPMSCX#7)
usbbase+0x05f4: 0x00000000 (PORTPMSCX#8)
usbbase+0x0604: 0x00000000 (PORTPMSCX#9)
usbbase+0x0614: 0x00000000 (PORTPMSCX#10)
usbbase+0x0584: 0x00000000 (PORTPMSCX#1)
usbbase+0x0594: 0x00000000 (PORTPMSCX#2)
usbbase+0x05a4: 0x00000000 (PORTPMSCX#3)
usbbase+0x05b4: 0x00000000 (PORTPMSCX#4)
usbbase+0x05c4: 0x00000000 (PORTPMSCX#5)
usbbase+0x05d4: 0x00000000 (PORTPMSCX#6)
usbbase+0x05e4: 0x00000000 (PORTPMSCX#7)
usbbase+0x05f4: 0x00000000 (PORTPMSCX#8)
usbbase+0x0604: 0x00000000 (PORTPMSCX#9)
usbbase+0x0614: 0x00000000 (PORTPMSCX#10)
usbbase+0x0588: 0x00000000 (PORTLIX#1)
usbbase+0x0598: 0x00000000 (PORTLIX#2)
usbbase+0x05a8: 0x00000000 (PORTLIX#3)
usbbase+0x05b8: 0x00000000 (PORTLIX#4)
usbbase+0x05c8: 0x00000000 (PORTLIX#5)
usbbase+0x05d8: 0x00000000 (PORTLIX#6)
usbbase+0x05e8: 0x00000000 (PORTLIX#7)
usbbase+0x05f8: 0x00000000 (PORTLIX#8)
usbbase+0x0608: 0x00000000 (PORTLIX#9)
usbbase+0x0618: 0x00000000 (PORTLIX#10)
usbbase+0x2000: 0x00227e68 (MFINDEX)
usbbase+0x2020: 0xe0638070 (IMAN0)
usbbase+0x2040: 0xe0708220 (IMAN1)
usbbase+0x2060: 0xe0dc8170 (IMAN2)
usbbase+0x2080: 0x00000000 (IMAN3)
usbbase+0x20a0: 0x00000000 (IMAN4)
usbbase+0x20c0: 0x00000000 (IMAN5)
usbbase+0x20e0: 0x00000000 (IMAN6)
usbbase+0x2100: 0x00000000 (IMAN7)
usbbase+0x2024: 0x00007f54 (IMOD0)
usbbase+0x2044: 0x00007f54 (IMOD1)
usbbase+0x2064: 0x00007f54 (IMOD2)
usbbase+0x2084: 0x00000000 (IMOD3)
usbbase+0x20a4: 0x00000000 (IMOD4)
usbbase+0x20c4: 0x00000000 (IMOD5)
usbbase+0x20e4: 0x00000000 (IMOD6)
usbbase+0x2104: 0x00000000 (IMOD7)
usbbase+0x2028: 0xe07081d0 (ERSTSZ0)
usbbase+0x2048: 0xe0708340 (ERSTSZ1)
usbbase+0x2068: 0x0000000a (ERSTSZ2)
usbbase+0x2088: 0x00000000 (ERSTSZ3)
usbbase+0x20a8: 0x00000000 (ERSTSZ4)
usbbase+0x20c8: 0x00000000 (ERSTSZ5)
usbbase+0x20e8: 0x00000000 (ERSTSZ6)
usbbase+0x2108: 0x00000000 (ERSTSZ7)
usbbase+0x2030: 0xe063b030 (ERSTBA_LO0)
usbbase+0x2050: 0x00000000 (ERSTBA_LO1)
usbbase+0x2070: 0xe0dc8428 (ERSTBA_LO2)
usbbase+0x2090: 0x00000001 (ERSTBA_LO3)
usbbase+0x20b0: 0x00000000 (ERSTBA_LO4)
usbbase+0x20d0: 0x00000000 (ERSTBA_LO5)
usbbase+0x20f0: 0x00000000 (ERSTBA_LO6)
usbbase+0x2110: 0x00000000 (ERSTBA_LO7)
usbbase+0x2034: 0x00007f54 (ERSTBA_HI0)
usbbase+0x2054: 0x00000000 (ERSTBA_HI1)
